kernel_gen/tuning_configs/configs_l40s.json
[
  {
    "N": 5000,
    "D": 16,
    "D_prime": 16,
    "K": 27,
    "dtype": "fp32",
    "acc_dtype": "fp32",
    "BLOCK_N": 16,
    "BLOCK_K": 16,
    "BLOCK_Dp": 16,
    "PARALLEL_K": 1,
    "num_warps": 2,
    "num_stages": 2,
    "sm": 89
  },
  {
    "N": 5000,
    "D": 16,
    "D_prime": 32,
    "K": 27,
    "dtype": "fp32",
    "acc_dtype": "fp32",
    "BLOCK_N": 16,
    "BLOCK_K": 16,
    "BLOCK_Dp": 16,
    "PARALLEL_K": 1,
    "num_warps": 2,
    "num_stages": 2,
    "sm": 89
  },
  {
    "N": 5000,
    "D": 32,
    "D_prime": 32,
    "K": 27,
    "dtype": "fp32",
    "acc_dtype": "fp32",
    "BLOCK_N": 16,
    "BLOCK_K": 32,
    "BLOCK_Dp": 32,
    "PARALLEL_K": 1,
    "num_warps": 2,
    "num_stages": 2,
    "sm": 89
  },
  {
    "N": 5000,
    "D": 32,
    "D_prime": 64,
    "K": 27,
    "dtype": "fp32",
    "acc_dtype": "fp32",
    "BLOCK_N": 16,
    "BLOCK_K": 32,
    "BLOCK_Dp": 64,
    "PARALLEL_K": 1,
    "num_warps": 4,
    "num_stages": 2,
    "sm": 89
  },
  {
    "N": 5000,
    "D": 64,
    "D_prime": 64,
    "K": 27,
    "dtype": "fp32",
    "acc_dtype": "fp32",
    "BLOCK_N": 16,
    "BLOCK_K": 64,
    "BLOCK_Dp": 64,
    "PARALLEL_K": 1,
    "num_warps": 4,
    "num_stages": 2,
    "sm": 89
  },
  {
    "N": 5000,
    "D": 64,
    "D_prime": 128,
    "K": 27,
    "dtype": "fp32",
    "acc_dtype": "fp32",
    "BLOCK_N": 16,
    "BLOCK_K": 32,
    "BLOCK_Dp": 32,
    "PARALLEL_K": 1,
    "num_warps": 2,
    "num_stages": 2,
    "sm": 89
  },
  {
    "N": 5000,
    "D": 128,
    "D_prime": 128,
    "K": 27,
    "dtype": "fp32",
    "acc_dtype": "fp32",
    "BLOCK_N": 16,
    "BLOCK_K": 32,
    "BLOCK_Dp": 32,
    "PARALLEL_K": 1,
    "num_warps": 2,
    "num_stages": 2,
    "sm": 89
  },
  {
    "N": 5000,
    "D": 128,
    "D_prime": 256,
    "K": 27,
    "dtype": "fp32",
    "acc_dtype": "fp32",
    "BLOCK_N": 16,
    "BLOCK_K": 32,
    "BLOCK_Dp": 64,
    "PARALLEL_K": 1,
    "num_warps": 2,
    "num_stages": 2,
    "sm": 89
  },
  {
    "N": 5000,
    "D": 256,
    "D_prime": 256,
    "K": 27,
    "dtype": "fp32",
    "acc_dtype": "fp32",
    "BLOCK_N": 16,
    "BLOCK_K": 32,
    "BLOCK_Dp": 64,
    "PARALLEL_K": 1,
    "num_warps": 2,
    "num_stages": 2,
    "sm": 89
  },
  {
    "N": 5000,
    "D": 16,
    "D_prime": 16,
    "K": 27,
    "dtype": "fp16",
    "acc_dtype": "fp32",
    "BLOCK_N": 16,
    "BLOCK_K": 16,
    "BLOCK_Dp": 16,
    "PARALLEL_K": 1,
    "num_warps": 2,
    "num_stages": 2,
    "sm": 89
  },
  {
    "N": 5000,
    "D": 16,
    "D_prime": 32,
    "K": 27,
    "dtype": "fp16",
    "acc_dtype": "fp32",
    "BLOCK_N": 16,
    "BLOCK_K": 16,
    "BLOCK_Dp": 16,
    "PARALLEL_K": 1,
    "num_warps": 2,
    "num_stages": 2,
    "sm": 89
  },
  {
    "N": 5000,
    "D": 32,
    "D_prime": 32,
    "K": 27,
    "dtype": "fp16",
    "acc_dtype": "fp32",
    "BLOCK_N": 16,
    "BLOCK_K": 32,
    "BLOCK_Dp": 32,
    "PARALLEL_K": 1,
    "num_warps": 2,
    "num_stages": 2,
    "sm": 89
  },
  {
    "N": 5000,
    "D": 32,
    "D_prime": 64,
    "K": 27,
    "dtype": "fp16",
    "acc_dtype": "fp32",
    "BLOCK_N": 16,
    "BLOCK_K": 32,
    "BLOCK_Dp": 32,
    "PARALLEL_K": 1,
    "num_warps": 2,
    "num_stages": 2,
    "sm": 89
  },
  {
    "N": 5000,
    "D": 64,
    "D_prime": 64,
    "K": 27,
    "dtype": "fp16",
    "acc_dtype": "fp32",
    "BLOCK_N": 16,
    "BLOCK_K": 64,
    "BLOCK_Dp": 64,
    "PARALLEL_K": 1,
    "num_warps": 4,
    "num_stages": 2,
    "sm": 89
  },
  {
    "N": 5000,
    "D": 64,
    "D_prime": 128,
    "K": 27,
    "dtype": "fp16",
    "acc_dtype": "fp32",
    "BLOCK_N": 16,
    "BLOCK_K": 64,
    "BLOCK_Dp": 64,
    "PARALLEL_K": 1,
    "num_warps": 4,
    "num_stages": 2,
    "sm": 89
  },
  {
    "N": 5000,
    "D": 128,
    "D_prime": 128,
    "K": 27,
    "dtype": "fp16",
    "acc_dtype": "fp32",
    "BLOCK_N": 16,
    "BLOCK_K": 64,
    "BLOCK_Dp": 64,
    "PARALLEL_K": 1,
    "num_warps": 4,
    "num_stages": 2,
    "sm": 89
  },
  {
    "N": 5000,
    "D": 128,
    "D_prime": 256,
    "K": 27,
    "dtype": "fp16",
    "acc_dtype": "fp32",
    "BLOCK_N": 16,
    "BLOCK_K": 32,
    "BLOCK_Dp": 64,
    "PARALLEL_K": 1,
    "num_warps": 2,
    "num_stages": 2,
    "sm": 89
  },
  {
    "N": 5000,
    "D": 256,
    "D_prime": 256,
    "K": 27,
    "dtype": "fp16",
    "acc_dtype": "fp32",
    "BLOCK_N": 16,
    "BLOCK_K": 64,
    "BLOCK_Dp": 64,
    "PARALLEL_K": 1,
    "num_warps": 4,
    "num_stages": 2,
    "sm": 89
  },
  {
    "N": 5000,
    "D": 16,
    "D_prime": 16,
    "K": 27,
    "dtype": "fp16",
    "acc_dtype": "fp16",
    "BLOCK_N": 16,
    "BLOCK_K": 16,
    "BLOCK_Dp": 16,
    "PARALLEL_K": 1,
    "num_warps": 2,
    "num_stages": 2,
    "sm": 89
  },
  {
    "N": 5000,
    "D": 16,
    "D_prime": 32,
    "K": 27,
    "dtype": "fp16",
    "acc_dtype": "fp16",
    "BLOCK_N": 16,
    "BLOCK_K": 16,
    "BLOCK_Dp": 16,
    "PARALLEL_K": 1,
    "num_warps": 2,
    "num_stages": 2,
    "sm": 89
  },
  {
    "N": 5000,
    "D": 32,
    "D_prime": 32,
    "K": 27,
    "dtype": "fp16",
    "acc_dtype": "fp16",
    "BLOCK_N": 16,
    "BLOCK_K": 32,
    "BLOCK_Dp": 32,
    "PARALLEL_K": 1,
    "num_warps": 2,
    "num_stages": 2,
    "sm": 89
  },
  {
    "N": 5000,
    "D": 32,
    "D_prime": 64,
    "K": 27,
    "dtype": "fp16",
    "acc_dtype": "fp16",
    "BLOCK_N": 16,
    "BLOCK_K": 32,
    "BLOCK_Dp": 64,
    "PARALLEL_K": 1,
    "num_warps": 4,
    "num_stages": 2,
    "sm": 89
  },
  {
    "N": 5000,
    "D": 64,
    "D_prime": 64,
    "K": 27,
    "dtype": "fp16",
    "acc_dtype": "fp16",
    "BLOCK_N": 16,
    "BLOCK_K": 64,
    "BLOCK_Dp": 64,
    "PARALLEL_K": 1,
    "num_warps": 4,
    "num_stages": 2,
    "sm": 89
  },
  {
    "N": 5000,
    "D": 64,
    "D_prime": 128,
    "K": 27,
    "dtype": "fp16",
    "acc_dtype": "fp16",
    "BLOCK_N": 16,
    "BLOCK_K": 64,
    "BLOCK_Dp": 64,
    "PARALLEL_K": 1,
    "num_warps": 4,
    "num_stages": 2,
    "sm": 89
  },
  {
    "N": 5000,
    "D": 128,
    "D_prime": 128,
    "K": 27,
    "dtype": "fp16",
    "acc_dtype": "fp16",
    "BLOCK_N": 16,
    "BLOCK_K": 64,
    "BLOCK_Dp": 64,
    "PARALLEL_K": 1,
    "num_warps": 4,
    "num_stages": 2,
    "sm": 89
  },
  {
    "N": 5000,
    "D": 128,
    "D_prime": 256,
    "K": 27,
    "dtype": "fp16",
    "acc_dtype": "fp16",
    "BLOCK_N": 16,
    "BLOCK_K": 32,
    "BLOCK_Dp": 64,
    "PARALLEL_K": 1,
    "num_warps": 2,
    "num_stages": 2,
    "sm": 89
  },
  {
    "N": 5000,
    "D": 256,
    "D_prime": 256,
    "K": 27,
    "dtype": "fp16",
    "acc_dtype": "fp16",
    "BLOCK_N": 16,
    "BLOCK_K": 64,
    "BLOCK_Dp": 64,
    "PARALLEL_K": 1,
    "num_warps": 4,
    "num_stages": 2,
    "sm": 89
  },
  {
    "N": 25000,
    "D": 16,
    "D_prime": 16,
    "K": 27,
    "dtype": "fp32",
    "acc_dtype": "fp32",
    "BLOCK_N": 16,
    "BLOCK_K": 16,
    "BLOCK_Dp": 16,
    "PARALLEL_K": 1,
    "num_warps": 2,
    "num_stages": 2,
    "sm": 89
  },
  {
    "N": 25000,
    "D": 16,
    "D_prime": 32,
    "K": 27,
    "dtype": "fp32",
    "acc_dtype": "fp32",
    "BLOCK_N": 32,
    "BLOCK_K": 16,
    "BLOCK_Dp": 32,
    "PARALLEL_K": 1,
    "num_warps": 2,
    "num_stages": 2,
    "sm": 89
  },
  {
    "N": 25000,
    "D": 32,
    "D_prime": 32,
    "K": 27,
    "dtype": "fp32",
    "acc_dtype": "fp32",
    "BLOCK_N": 16,
    "BLOCK_K": 32,
    "BLOCK_Dp": 32,
    "PARALLEL_K": 1,
    "num_warps": 2,
    "num_stages": 2,
    "sm": 89
  },
  {
    "N": 25000,
    "D": 32,
    "D_prime": 64,
    "K": 27,
    "dtype": "fp32",
    "acc_dtype": "fp32",
    "BLOCK_N": 32,
    "BLOCK_K": 16,
    "BLOCK_Dp": 32,
    "PARALLEL_K": 1,
    "num_warps": 2,
    "num_stages": 2,
    "sm": 89
  },
  {
    "N": 25000,
    "D": 64,
    "D_prime": 64,
    "K": 27,
    "dtype": "fp32",
    "acc_dtype": "fp32",
    "BLOCK_N": 128,
    "BLOCK_K": 32,
    "BLOCK_Dp": 32,
    "PARALLEL_K": 1,
    "num_warps": 4,
    "num_stages": 2,
    "sm": 89
  },
  {
    "N": 25000,
    "D": 64,
    "D_prime": 128,
    "K": 27,
    "dtype": "fp32",
    "acc_dtype": "fp32",
    "BLOCK_N": 32,
    "BLOCK_K": 16,
    "BLOCK_Dp": 32,
    "PARALLEL_K": 1,
    "num_warps": 2,
    "num_stages": 2,
    "sm": 89
  },
  {
    "N": 25000,
    "D": 128,
    "D_prime": 128,
    "K": 27,
    "dtype": "fp32",
    "acc_dtype": "fp32",
    "BLOCK_N": 32,
    "BLOCK_K": 16,
    "BLOCK_Dp": 32,
    "PARALLEL_K": 1,
    "num_warps": 2,
    "num_stages": 2,
    "sm": 89
  },
  {
    "N": 25000,
    "D": 128,
    "D_prime": 256,
    "K": 27,
    "dtype": "fp32",
    "acc_dtype": "fp32",
    "BLOCK_N": 128,
    "BLOCK_K": 32,
    "BLOCK_Dp": 32,
    "PARALLEL_K": 1,
    "num_warps": 4,
    "num_stages": 2,
    "sm": 89
  },
  {
    "N": 25000,
    "D": 256,
    "D_prime": 256,
    "K": 27,
    "dtype": "fp32",
    "acc_dtype": "fp32",
    "BLOCK_N": 128,
    "BLOCK_K": 32,
    "BLOCK_Dp": 32,
    "PARALLEL_K": 1,
    "num_warps": 4,
    "num_stages": 2,
    "sm": 89
  },
  {
    "N": 25000,
    "D": 16,
    "D_prime": 16,
    "K": 27,
    "dtype": "fp16",
    "acc_dtype": "fp32",
    "BLOCK_N": 16,
    "BLOCK_K": 16,
    "BLOCK_Dp": 16,
    "PARALLEL_K": 1,
    "num_warps": 2,
    "num_stages": 2,
    "sm": 89
  },
  {
    "N": 25000,
    "D": 16,
    "D_prime": 32,
    "K": 27,
    "dtype": "fp16",
    "acc_dtype": "fp32",
    "BLOCK_N": 32,
    "BLOCK_K": 16,
    "BLOCK_Dp": 32,
    "PARALLEL_K": 1,
    "num_warps": 2,
    "num_stages": 2,
    "sm": 89
  },
  {
    "N": 25000,
    "D": 32,
    "D_prime": 32,
    "K": 27,
    "dtype": "fp16",
    "acc_dtype": "fp32",
    "BLOCK_N": 16,
    "BLOCK_K": 32,
    "BLOCK_Dp": 32,
    "PARALLEL_K": 1,
    "num_warps": 2,
    "num_stages": 2,
    "sm": 89
  },
  {
    "N": 25000,
    "D": 32,
    "D_prime": 64,
    "K": 27,
    "dtype": "fp16",
    "acc_dtype": "fp32",
    "BLOCK_N": 16,
    "BLOCK_K": 32,
    "BLOCK_Dp": 32,
    "PARALLEL_K": 1,
    "num_warps": 2,
    "num_stages": 2,
    "sm": 89
  },
  {
    "N": 25000,
    "D": 64,
    "D_prime": 64,
    "K": 27,
    "dtype": "fp16",
    "acc_dtype": "fp32",
    "BLOCK_N": 16,
    "BLOCK_K": 64,
    "BLOCK_Dp": 64,
    "PARALLEL_K": 1,
    "num_warps": 4,
    "num_stages": 2,
    "sm": 89
  },
  {
    "N": 25000,
    "D": 64,
    "D_prime": 128,
    "K": 27,
    "dtype": "fp16",
    "acc_dtype": "fp32",
    "BLOCK_N": 16,
    "BLOCK_K": 32,
    "BLOCK_Dp": 128,
    "PARALLEL_K": 1,
    "num_warps": 4,
    "num_stages": 2,
    "sm": 89
  },
  {
    "N": 25000,
    "D": 128,
    "D_prime": 128,
    "K": 27,
    "dtype": "fp16",
    "acc_dtype": "fp32",
    "BLOCK_N": 16,
    "BLOCK_K": 32,
    "BLOCK_Dp": 128,
    "PARALLEL_K": 1,
    "num_warps": 4,
    "num_stages": 2,
    "sm": 89
  },
  {
    "N": 25000,
    "D": 128,
    "D_prime": 256,
    "K": 27,
    "dtype": "fp16",
    "acc_dtype": "fp32",
    "BLOCK_N": 16,
    "BLOCK_K": 32,
    "BLOCK_Dp": 128,
    "PARALLEL_K": 1,
    "num_warps": 4,
    "num_stages": 2,
    "sm": 89
  },
  {
    "N": 25000,
    "D": 256,
    "D_prime": 256,
    "K": 27,
    "dtype": "fp16",
    "acc_dtype": "fp32",
    "BLOCK_N": 16,
    "BLOCK_K": 32,
    "BLOCK_Dp": 64,
    "PARALLEL_K": 1,
    "num_warps": 2,
    "num_stages": 2,
    "sm": 89
  },
  {
    "N": 25000,
    "D": 16,
    "D_prime": 16,
    "K": 27,
    "dtype": "fp16",
    "acc_dtype": "fp16",
    "BLOCK_N": 16,
    "BLOCK_K": 16,
    "BLOCK_Dp": 16,
    "PARALLEL_K": 1,
    "num_warps": 2,
    "num_stages": 2,
    "sm": 89
  },
  {
    "N": 25000,
    "D": 16,
    "D_prime": 32,
    "K": 27,
    "dtype": "fp16",
    "acc_dtype": "fp16",
    "BLOCK_N": 32,
    "BLOCK_K": 16,
    "BLOCK_Dp": 32,
    "PARALLEL_K": 1,
    "num_warps": 2,
    "num_stages": 2,
    "sm": 89
  },
  {
    "N": 25000,
    "D": 32,
    "D_prime": 32,
    "K": 27,
    "dtype": "fp16",
    "acc_dtype": "fp16",
    "BLOCK_N": 16,
    "BLOCK_K": 32,
    "BLOCK_Dp": 32,
    "PARALLEL_K": 1,
    "num_warps": 2,
    "num_stages": 2,
    "sm": 89
  },
  {
    "N": 25000,
    "D": 32,
    "D_prime": 64,
    "K": 27,
    "dtype": "fp16",
    "acc_dtype": "fp16",
    "BLOCK_N": 16,
    "BLOCK_K": 32,
    "BLOCK_Dp": 64,
    "PARALLEL_K": 1,
    "num_warps": 2,
    "num_stages": 2,
    "sm": 89
  },
  {
    "N": 25000,
    "D": 64,
    "D_prime": 64,
    "K": 27,
    "dtype": "fp16",
    "acc_dtype": "fp16",
    "BLOCK_N": 16,
    "BLOCK_K": 32,
    "BLOCK_Dp": 64,
    "PARALLEL_K": 1,
    "num_warps": 2,
    "num_stages": 2,
    "sm": 89
  },
  {
    "N": 25000,
    "D": 64,
    "D_prime": 128,
    "K": 27,
    "dtype": "fp16",
    "acc_dtype": "fp16",
    "BLOCK_N": 16,
    "BLOCK_K": 32,
    "BLOCK_Dp": 128,
    "PARALLEL_K": 1,
    "num_warps": 4,
    "num_stages": 2,
    "sm": 89
  },
  {
    "N": 25000,
    "D": 128,
    "D_prime": 128,
    "K": 27,
    "dtype": "fp16",
    "acc_dtype": "fp16",
    "BLOCK_N": 16,
    "BLOCK_K": 32,
    "BLOCK_Dp": 128,
    "PARALLEL_K": 1,
    "num_warps": 4,
    "num_stages": 2,
    "sm": 89
  },
  {
    "N": 25000,
    "D": 128,
    "D_prime": 256,
    "K": 27,
    "dtype": "fp16",
    "acc_dtype": "fp16",
    "BLOCK_N": 128,
    "BLOCK_K": 32,
    "BLOCK_Dp": 32,
    "PARALLEL_K": 1,
    "num_warps": 4,
    "num_stages": 2,
    "sm": 89
  },
  {
    "N": 25000,
    "D": 256,
    "D_prime": 256,
    "K": 27,
    "dtype": "fp16",
    "acc_dtype": "fp16",
    "BLOCK_N": 128,
    "BLOCK_K": 32,
    "BLOCK_Dp": 32,
    "PARALLEL_K": 1,
    "num_warps": 4,
    "num_stages": 2,
    "sm": 89
  },
  {
    "N": 50000,
    "D": 16,
    "D_prime": 16,
    "K": 27,
    "dtype": "fp32",
    "acc_dtype": "fp32",
    "BLOCK_N": 32,
    "BLOCK_K": 16,
    "BLOCK_Dp": 16,
    "PARALLEL_K": 1,
    "num_warps": 2,
    "num_stages": 2,
    "sm": 89
  },
  {
    "N": 50000,
    "D": 16,
    "D_prime": 32,
    "K": 27,
    "dtype": "fp32",
    "acc_dtype": "fp32",
    "BLOCK_N": 32,
    "BLOCK_K": 16,
    "BLOCK_Dp": 32,
    "PARALLEL_K": 1,
    "num_warps": 2,
    "num_stages": 2,
    "sm": 89
  },
  {
    "N": 50000,
    "D": 32,
    "D_prime": 32,
    "K": 27,
    "dtype": "fp32",
    "acc_dtype": "fp32",
    "BLOCK_N": 32,
    "BLOCK_K": 16,
    "BLOCK_Dp": 32,
    "PARALLEL_K": 1,
    "num_warps": 2,
    "num_stages": 2,
    "sm": 89
  },
  {
    "N": 50000,
    "D": 32,
    "D_prime": 64,
    "K": 27,
    "dtype": "fp32",
    "acc_dtype": "fp32",
    "BLOCK_N": 32,
    "BLOCK_K": 16,
    "BLOCK_Dp": 32,
    "PARALLEL_K": 1,
    "num_warps": 2,
    "num_stages": 2,
    "sm": 89
  },
  {
    "N": 50000,
    "D": 64,
    "D_prime": 64,
    "K": 27,
    "dtype": "fp32",
    "acc_dtype": "fp32",
    "BLOCK_N": 32,
    "BLOCK_K": 16,
    "BLOCK_Dp": 32,
    "PARALLEL_K": 1,
    "num_warps": 2,
    "num_stages": 2,
    "sm": 89
  },
  {
    "N": 50000,
    "D": 64,
    "D_prime": 128,
    "K": 27,
    "dtype": "fp32",
    "acc_dtype": "fp32",
    "BLOCK_N": 32,
    "BLOCK_K": 16,
    "BLOCK_Dp": 32,
    "PARALLEL_K": 1,
    "num_warps": 2,
    "num_stages": 2,
    "sm": 89
  },
  {
    "N": 50000,
    "D": 128,
    "D_prime": 128,
    "K": 27,
    "dtype": "fp32",
    "acc_dtype": "fp32",
    "BLOCK_N": 128,
    "BLOCK_K": 32,
    "BLOCK_Dp": 32,
    "PARALLEL_K": 1,
    "num_warps": 4,
    "num_stages": 2,
    "sm": 89
  },
  {
    "N": 50000,
    "D": 128,
    "D_prime": 256,
    "K": 27,
    "dtype": "fp32",
    "acc_dtype": "fp32",
    "BLOCK_N": 128,
    "BLOCK_K": 32,
    "BLOCK_Dp": 32,
    "PARALLEL_K": 1,
    "num_warps": 4,
    "num_stages": 2,
    "sm": 89
  },
  {
    "N": 50000,
    "D": 256,
    "D_prime": 256,
    "K": 27,
    "dtype": "fp32",
    "acc_dtype": "fp32",
    "BLOCK_N": 128,
    "BLOCK_K": 32,
    "BLOCK_Dp": 32,
    "PARALLEL_K": 1,
    "num_warps": 4,
    "num_stages": 2,
    "sm": 89
  },
  {
    "N": 50000,
    "D": 16,
    "D_prime": 16,
    "K": 27,
    "dtype": "fp16",
    "acc_dtype": "fp32",
    "BLOCK_N": 32,
    "BLOCK_K": 16,
    "BLOCK_Dp": 16,
    "PARALLEL_K": 1,
    "num_warps": 2,
    "num_stages": 2,
    "sm": 89
  },
  {
    "N": 50000,
    "D": 16,
    "D_prime": 32,
    "K": 27,
    "dtype": "fp16",
    "acc_dtype": "fp32",
    "BLOCK_N": 32,
    "BLOCK_K": 16,
    "BLOCK_Dp": 32,
    "PARALLEL_K": 1,
    "num_warps": 2,
    "num_stages": 2,
    "sm": 89
  },
  {
    "N": 50000,
    "D": 32,
    "D_prime": 32,
    "K": 27,
    "dtype": "fp16",
    "acc_dtype": "fp32",
    "BLOCK_N": 32,
    "BLOCK_K": 16,
    "BLOCK_Dp": 32,
    "PARALLEL_K": 1,
    "num_warps": 2,
    "num_stages": 2,
    "sm": 89
  },
  {
    "N": 50000,
    "D": 32,
    "D_prime": 64,
    "K": 27,
    "dtype": "fp16",
    "acc_dtype": "fp32",
    "BLOCK_N": 32,
    "BLOCK_K": 16,
    "BLOCK_Dp": 32,
    "PARALLEL_K": 1,
    "num_warps": 2,
    "num_stages": 2,
    "sm": 89
  },
  {
    "N": 50000,
    "D": 64,
    "D_prime": 64,
    "K": 27,
    "dtype": "fp16",
    "acc_dtype": "fp32",
    "BLOCK_N": 16,
    "BLOCK_K": 32,
    "BLOCK_Dp": 64,
    "PARALLEL_K": 1,
    "num_warps": 2,
    "num_stages": 2,
    "sm": 89
  },
  {
    "N": 50000,
    "D": 64,
    "D_prime": 128,
    "K": 27,
    "dtype": "fp16",
    "acc_dtype": "fp32",
    "BLOCK_N": 16,
    "BLOCK_K": 32,
    "BLOCK_Dp": 128,
    "PARALLEL_K": 1,
    "num_warps": 4,
    "num_stages": 2,
    "sm": 89
  },
  {
    "N": 50000,
    "D": 128,
    "D_prime": 128,
    "K": 27,
    "dtype": "fp16",
    "acc_dtype": "fp32",
    "BLOCK_N": 16,
    "BLOCK_K": 32,
    "BLOCK_Dp": 64,
    "PARALLEL_K": 1,
    "num_warps": 2,
    "num_stages": 2,
    "sm": 89
  },
  {
    "N": 50000,
    "D": 128,
    "D_prime": 256,
    "K": 27,
    "dtype": "fp16",
    "acc_dtype": "fp32",
    "BLOCK_N": 16,
    "BLOCK_K": 32,
    "BLOCK_Dp": 128,
    "PARALLEL_K": 1,
    "num_warps": 4,
    "num_stages": 2,
    "sm": 89
  },
  {
    "N": 50000,
    "D": 256,
    "D_prime": 256,
    "K": 27,
    "dtype": "fp16",
    "acc_dtype": "fp32",
    "BLOCK_N": 16,
    "BLOCK_K": 32,
    "BLOCK_Dp": 64,
    "PARALLEL_K": 1,
    "num_warps": 2,
    "num_stages": 2,
    "sm": 89
  },
  {
    "N": 50000,
    "D": 16,
    "D_prime": 16,
    "K": 27,
    "dtype": "fp16",
    "acc_dtype": "fp16",
    "BLOCK_N": 16,
    "BLOCK_K": 16,
    "BLOCK_Dp": 16,
    "PARALLEL_K": 1,
    "num_warps": 2,
    "num_stages": 2,
    "sm": 89
  },
  {
    "N": 50000,
    "D": 16,
    "D_prime": 32,
    "K": 27,
    "dtype": "fp16",
    "acc_dtype": "fp16",
    "BLOCK_N": 32,
    "BLOCK_K": 16,
    "BLOCK_Dp": 32,
    "PARALLEL_K": 1,
    "num_warps": 2,
    "num_stages": 2,
    "sm": 89
  },
  {
    "N": 50000,
    "D": 32,
    "D_prime": 32,
    "K": 27,
    "dtype": "fp16",
    "acc_dtype": "fp16",
    "BLOCK_N": 32,
    "BLOCK_K": 16,
    "BLOCK_Dp": 32,
    "PARALLEL_K": 1,
    "num_warps": 2,
    "num_stages": 2,
    "sm": 89
  },
  {
    "N": 50000,
    "D": 32,
    "D_prime": 64,
    "K": 27,
    "dtype": "fp16",
    "acc_dtype": "fp16",
    "BLOCK_N": 16,
    "BLOCK_K": 32,
    "BLOCK_Dp": 64,
    "PARALLEL_K": 1,
    "num_warps": 2,
    "num_stages": 2,
    "sm": 89
  },
  {
    "N": 50000,
    "D": 64,
    "D_prime": 64,
    "K": 27,
    "dtype": "fp16",
    "acc_dtype": "fp16",
    "BLOCK_N": 16,
    "BLOCK_K": 64,
    "BLOCK_Dp": 64,
    "PARALLEL_K": 1,
    "num_warps": 4,
    "num_stages": 2,
    "sm": 89
  },
  {
    "N": 50000,
    "D": 64,
    "D_prime": 128,
    "K": 27,
    "dtype": "fp16",
    "acc_dtype": "fp16",
    "BLOCK_N": 16,
    "BLOCK_K": 32,
    "BLOCK_Dp": 128,
    "PARALLEL_K": 1,
    "num_warps": 4,
    "num_stages": 2,
    "sm": 89
  },
  {
    "N": 50000,
    "D": 128,
    "D_prime": 128,
    "K": 27,
    "dtype": "fp16",
    "acc_dtype": "fp16",
    "BLOCK_N": 128,
    "BLOCK_K": 32,
    "BLOCK_Dp": 32,
    "PARALLEL_K": 1,
    "num_warps": 4,
    "num_stages": 2,
    "sm": 89
  },
  {
    "N": 50000,
    "D": 128,
    "D_prime": 256,
    "K": 27,
    "dtype": "fp16",
    "acc_dtype": "fp16",
    "BLOCK_N": 128,
    "BLOCK_K": 32,
    "BLOCK_Dp": 32,
    "PARALLEL_K": 1,
    "num_warps": 4,
    "num_stages": 2,
    "sm": 89
  },
  {
    "N": 50000,
    "D": 256,
    "D_prime": 256,
    "K": 27,
    "dtype": "fp16",
    "acc_dtype": "fp16",
    "BLOCK_N": 128,
    "BLOCK_K": 32,
    "BLOCK_Dp": 32,
    "PARALLEL_K": 1,
    "num_warps": 4,
    "num_stages": 2,
    "sm": 89
  },
  {
    "N": 100000,
    "D": 16,
    "D_prime": 16,
    "K": 27,
    "dtype": "fp32",
    "acc_dtype": "fp32",
    "BLOCK_N": 32,
    "BLOCK_K": 16,
    "BLOCK_Dp": 16,
    "PARALLEL_K": 1,
    "num_warps": 2,
    "num_stages": 2,
    "sm": 89
  },
  {
    "N": 100000,
    "D": 16,
    "D_prime": 32,
    "K": 27,
    "dtype": "fp32",
    "acc_dtype": "fp32",
    "BLOCK_N": 32,
    "BLOCK_K": 16,
    "BLOCK_Dp": 32,
    "PARALLEL_K": 1,
    "num_warps": 2,
    "num_stages": 2,
    "sm": 89
  },
  {
    "N": 100000,
    "D": 32,
    "D_prime": 32,
    "K": 27,
    "dtype": "fp32",
    "acc_dtype": "fp32",
    "BLOCK_N": 32,
    "BLOCK_K": 16,
    "BLOCK_Dp": 32,
    "PARALLEL_K": 1,
    "num_warps": 2,
    "num_stages": 2,
    "sm": 89
  },
  {
    "N": 100000,
    "D": 32,
    "D_prime": 64,
    "K": 27,
    "dtype": "fp32",
    "acc_dtype": "fp32",
    "BLOCK_N": 32,
    "BLOCK_K": 16,
    "BLOCK_Dp": 32,
    "PARALLEL_K": 1,
    "num_warps": 2,
    "num_stages": 2,
    "sm": 89
  },
  {
    "N": 100000,
    "D": 64,
    "D_prime": 64,
    "K": 27,
    "dtype": "fp32",
    "acc_dtype": "fp32",
    "BLOCK_N": 128,
    "BLOCK_K": 32,
    "BLOCK_Dp": 32,
    "PARALLEL_K": 1,
    "num_warps": 4,
    "num_stages": 2,
    "sm": 89
  },
  {
    "N": 100000,
    "D": 64,
    "D_prime": 128,
    "K": 27,
    "dtype": "fp32",
    "acc_dtype": "fp32",
    "BLOCK_N": 128,
    "BLOCK_K": 32,
    "BLOCK_Dp": 32,
    "PARALLEL_K": 1,
    "num_warps": 4,
    "num_stages": 2,
    "sm": 89
  },
  {
    "N": 100000,
    "D": 128,
    "D_prime": 128,
    "K": 27,
    "dtype": "fp32",
    "acc_dtype": "fp32",
    "BLOCK_N": 128,
    "BLOCK_K": 32,
    "BLOCK_Dp": 32,
    "PARALLEL_K": 1,
    "num_warps": 4,
    "num_stages": 2,
    "sm": 89
  },
  {
    "N": 100000,
    "D": 128,
    "D_prime": 256,
    "K": 27,
    "dtype": "fp32",
    "acc_dtype": "fp32",
    "BLOCK_N": 128,
    "BLOCK_K": 32,
    "BLOCK_Dp": 32,
    "PARALLEL_K": 1,
    "num_warps": 4,
    "num_stages": 2,
    "sm": 89
  },
  {
    "N": 100000,
    "D": 256,
    "D_prime": 256,
    "K": 27,
    "dtype": "fp32",
    "acc_dtype": "fp32",
    "BLOCK_N": 128,
    "BLOCK_K": 32,
    "BLOCK_Dp": 32,
    "PARALLEL_K": 1,
    "num_warps": 4,
    "num_stages": 2,
    "sm": 89
  },
  {
    "N": 100000,
    "D": 16,
    "D_prime": 16,
    "K": 27,
    "dtype": "fp16",
    "acc_dtype": "fp32",
    "BLOCK_N": 32,
    "BLOCK_K": 16,
    "BLOCK_Dp": 16,
    "PARALLEL_K": 1,
    "num_warps": 2,
    "num_stages": 2,
    "sm": 89
  },
  {
    "N": 100000,
    "D": 16,
    "D_prime": 32,
    "K": 27,
    "dtype": "fp16",
    "acc_dtype": "fp32",
    "BLOCK_N": 32,
    "BLOCK_K": 16,
    "BLOCK_Dp": 32,
    "PARALLEL_K": 1,
    "num_warps": 2,
    "num_stages": 2,
    "sm": 89
  },
  {
    "N": 100000,
    "D": 32,
    "D_prime": 32,
    "K": 27,
    "dtype": "fp16",
    "acc_dtype": "fp32",
    "BLOCK_N": 32,
    "BLOCK_K": 16,
    "BLOCK_Dp": 32,
    "PARALLEL_K": 1,
    "num_warps": 2,
    "num_stages": 2,
    "sm": 89
  },
  {
    "N": 100000,
    "D": 32,
    "D_prime": 64,
    "K": 27,
    "dtype": "fp16",
    "acc_dtype": "fp32",
    "BLOCK_N": 32,
    "BLOCK_K": 16,
    "BLOCK_Dp": 32,
    "PARALLEL_K": 1,
    "num_warps": 2,
    "num_stages": 2,
    "sm": 89
  },
  {
    "N": 100000,
    "D": 64,
    "D_prime": 64,
    "K": 27,
    "dtype": "fp16",
    "acc_dtype": "fp32",
    "BLOCK_N": 16,
    "BLOCK_K": 32,
    "BLOCK_Dp": 64,
    "PARALLEL_K": 1,
    "num_warps": 2,
    "num_stages": 2,
    "sm": 89
  },
  {
    "N": 100000,
    "D": 64,
    "D_prime": 128,
    "K": 27,
    "dtype": "fp16",
    "acc_dtype": "fp32",
    "BLOCK_N": 16,
    "BLOCK_K": 32,
    "BLOCK_Dp": 128,
    "PARALLEL_K": 1,
    "num_warps": 4,
    "num_stages": 2,
    "sm": 89
  },
  {
    "N": 100000,
    "D": 128,
    "D_prime": 128,
    "K": 27,
    "dtype": "fp16",
    "acc_dtype": "fp32",
    "BLOCK_N": 16,
    "BLOCK_K": 32,
    "BLOCK_Dp": 128,
    "PARALLEL_K": 1,
    "num_warps": 4,
    "num_stages": 2,
    "sm": 89
  },
  {
    "N": 100000,
    "D": 128,
    "D_prime": 256,
    "K": 27,
    "dtype": "fp16",
    "acc_dtype": "fp32",
    "BLOCK_N": 128,
    "BLOCK_K": 32,
    "BLOCK_Dp": 32,
    "PARALLEL_K": 1,
    "num_warps": 4,
    "num_stages": 2,
    "sm": 89
  },
  {
    "N": 100000,
    "D": 256,
    "D_prime": 256,
    "K": 27,
    "dtype": "fp16",
    "acc_dtype": "fp32",
    "BLOCK_N": 128,
    "BLOCK_K": 32,
    "BLOCK_Dp": 32,
    "PARALLEL_K": 1,
    "num_warps": 4,
    "num_stages": 2,
    "sm": 89
  },
  {
    "N": 100000,
    "D": 16,
    "D_prime": 16,
    "K": 27,
    "dtype": "fp16",
    "acc_dtype": "fp16",
    "BLOCK_N": 32,
    "BLOCK_K": 16,
    "BLOCK_Dp": 16,
    "PARALLEL_K": 1,
    "num_warps": 2,
    "num_stages": 2,
    "sm": 89
  },
  {
    "N": 100000,
    "D": 16,
    "D_prime": 32,
    "K": 27,
    "dtype": "fp16",
    "acc_dtype": "fp16",
    "BLOCK_N": 32,
    "BLOCK_K": 16,
    "BLOCK_Dp": 32,
    "PARALLEL_K": 1,
    "num_warps": 2,
    "num_stages": 2,
    "sm": 89
  },
  {
    "N": 100000,
    "D": 32,
    "D_prime": 32,
    "K": 27,
    "dtype": "fp16",
    "acc_dtype": "fp16",
    "BLOCK_N": 32,
    "BLOCK_K": 16,
    "BLOCK_Dp": 32,
    "PARALLEL_K": 1,
    "num_warps": 2,
    "num_stages": 2,
    "sm": 89
  },
  {
    "N": 100000,
    "D": 32,
    "D_prime": 64,
    "K": 27,
    "dtype": "fp16",
    "acc_dtype": "fp16",
    "BLOCK_N": 128,
    "BLOCK_K": 32,
    "BLOCK_Dp": 32,
    "PARALLEL_K": 1,
    "num_warps": 4,
    "num_stages": 2,
    "sm": 89
  },
  {
    "N": 100000,
    "D": 64,
    "D_prime": 64,
    "K": 27,
    "dtype": "fp16",
    "acc_dtype": "fp16",
    "BLOCK_N": 128,
    "BLOCK_K": 32,
    "BLOCK_Dp": 32,
    "PARALLEL_K": 1,
    "num_warps": 4,
    "num_stages": 2,
    "sm": 89
  },
  {
    "N": 100000,
    "D": 64,
    "D_prime": 128,
    "K": 27,
    "dtype": "fp16",
    "acc_dtype": "fp16",
    "BLOCK_N": 128,
    "BLOCK_K": 32,
    "BLOCK_Dp": 32,
    "PARALLEL_K": 1,
    "num_warps": 4,
    "num_stages": 2,
    "sm": 89
  },
  {
    "N": 100000,
    "D": 128,
    "D_prime": 128,
    "K": 27,
    "dtype": "fp16",
    "acc_dtype": "fp16",
    "BLOCK_N": 128,
    "BLOCK_K": 32,
    "BLOCK_Dp": 32,
    "PARALLEL_K": 1,
    "num_warps": 4,
    "num_stages": 2,
    "sm": 89
  },
  {
    "N": 100000,
    "D": 128,
    "D_prime": 256,
    "K": 27,
    "dtype": "fp16",
    "acc_dtype": "fp16",
    "BLOCK_N": 128,
    "BLOCK_K": 32,
    "BLOCK_Dp": 32,
    "PARALLEL_K": 1,
    "num_warps": 4,
    "num_stages": 2,
    "sm": 89
  },
  {
    "N": 100000,
    "D": 256,
    "D_prime": 256,
    "K": 27,
    "dtype": "fp16",
    "acc_dtype": "fp16",
    "BLOCK_N": 128,
    "BLOCK_K": 32,
    "BLOCK_Dp": 32,
    "PARALLEL_K": 1,
    "num_warps": 4,
    "num_stages": 2,
    "sm": 89
  },
  {
    "N": 200000,
    "D": 16,
    "D_prime": 16,
    "K": 27,
    "dtype": "fp32",
    "acc_dtype": "fp32",
    "BLOCK_N": 32,
    "BLOCK_K": 16,
    "BLOCK_Dp": 16,
    "PARALLEL_K": 1,
    "num_warps": 2,
    "num_stages": 2,
    "sm": 89
  },
  {
    "N": 200000,
    "D": 16,
    "D_prime": 32,
    "K": 27,
    "dtype": "fp32",
    "acc_dtype": "fp32",
    "BLOCK_N": 32,
    "BLOCK_K": 16,
    "BLOCK_Dp": 32,
    "PARALLEL_K": 1,
    "num_warps": 2,
    "num_stages": 2,
    "sm": 89
  },
  {
    "N": 200000,
    "D": 32,
    "D_prime": 32,
    "K": 27,
    "dtype": "fp32",
    "acc_dtype": "fp32",
    "BLOCK_N": 128,
    "BLOCK_K": 32,
    "BLOCK_Dp": 32,
    "PARALLEL_K": 1,
    "num_warps": 4,
    "num_stages": 2,
    "sm": 89
  },
  {
    "N": 200000,
    "D": 32,
    "D_prime": 64,
    "K": 27,
    "dtype": "fp32",
    "acc_dtype": "fp32",
    "BLOCK_N": 128,
    "BLOCK_K": 32,
    "BLOCK_Dp": 32,
    "PARALLEL_K": 1,
    "num_warps": 4,
    "num_stages": 2,
    "sm": 89
  },
  {
    "N": 200000,
    "D": 64,
    "D_prime": 64,
    "K": 27,
    "dtype": "fp32",
    "acc_dtype": "fp32",
    "BLOCK_N": 128,
    "BLOCK_K": 32,
    "BLOCK_Dp": 32,
    "PARALLEL_K": 1,
    "num_warps": 4,
    "num_stages": 2,
    "sm": 89
  },
  {
    "N": 200000,
    "D": 64,
    "D_prime": 128,
    "K": 27,
    "dtype": "fp32",
    "acc_dtype": "fp32",
    "BLOCK_N": 128,
    "BLOCK_K": 32,
    "BLOCK_Dp": 32,
    "PARALLEL_K": 1,
    "num_warps": 8,
    "num_stages": 2,
    "sm": 89
  },
  {
    "N": 200000,
    "D": 128,
    "D_prime": 128,
    "K": 27,
    "dtype": "fp32",
    "acc_dtype": "fp32",
    "BLOCK_N": 128,
    "BLOCK_K": 32,
    "BLOCK_Dp": 32,
    "PARALLEL_K": 1,
    "num_warps": 4,
    "num_stages": 2,
    "sm": 89
  },
  {
    "N": 200000,
    "D": 128,
    "D_prime": 256,
    "K": 27,
    "dtype": "fp32",
    "acc_dtype": "fp32",
    "BLOCK_N": 128,
    "BLOCK_K": 32,
    "BLOCK_Dp": 32,
    "PARALLEL_K": 1,
    "num_warps": 4,
    "num_stages": 2,
    "sm": 89
  },
  {
    "N": 200000,
    "D": 256,
    "D_prime": 256,
    "K": 27,
    "dtype": "fp32",
    "acc_dtype": "fp32",
    "BLOCK_N": 128,
    "BLOCK_K": 32,
    "BLOCK_Dp": 32,
    "PARALLEL_K": 1,
    "num_warps": 8,
    "num_stages": 2,
    "sm": 89
  },
  {
    "N": 200000,
    "D": 16,
    "D_prime": 16,
    "K": 27,
    "dtype": "fp16",
    "acc_dtype": "fp32",
    "BLOCK_N": 32,
    "BLOCK_K": 16,
    "BLOCK_Dp": 16,
    "PARALLEL_K": 1,
    "num_warps": 2,
    "num_stages": 2,
    "sm": 89
  },
  {
    "N": 200000,
    "D": 16,
    "D_prime": 32,
    "K": 27,
    "dtype": "fp16",
    "acc_dtype": "fp32",
    "BLOCK_N": 32,
    "BLOCK_K": 16,
    "BLOCK_Dp": 32,
    "PARALLEL_K": 1,
    "num_warps": 2,
    "num_stages": 2,
    "sm": 89
  },
  {
    "N": 200000,
    "D": 32,
    "D_prime": 32,
    "K": 27,
    "dtype": "fp16",
    "acc_dtype": "fp32",
    "BLOCK_N": 128,
    "BLOCK_K": 32,
    "BLOCK_Dp": 32,
    "PARALLEL_K": 1,
    "num_warps": 4,
    "num_stages": 2,
    "sm": 89
  },
  {
    "N": 200000,
    "D": 32,
    "D_prime": 64,
    "K": 27,
    "dtype": "fp16",
    "acc_dtype": "fp32",
    "BLOCK_N": 128,
    "BLOCK_K": 32,
    "BLOCK_Dp": 32,
    "PARALLEL_K": 1,
    "num_warps": 4,
    "num_stages": 2,
    "sm": 89
  },
  {
    "N": 200000,
    "D": 64,
    "D_prime": 64,
    "K": 27,
    "dtype": "fp16",
    "acc_dtype": "fp32",
    "BLOCK_N": 128,
    "BLOCK_K": 32,
    "BLOCK_Dp": 32,
    "PARALLEL_K": 1,
    "num_warps": 4,
    "num_stages": 2,
    "sm": 89
  },
  {
    "N": 200000,
    "D": 64,
    "D_prime": 128,
    "K": 27,
    "dtype": "fp16",
    "acc_dtype": "fp32",
    "BLOCK_N": 128,
    "BLOCK_K": 32,
    "BLOCK_Dp": 32,
    "PARALLEL_K": 1,
    "num_warps": 4,
    "num_stages": 2,
    "sm": 89
  },
  {
    "N": 200000,
    "D": 128,
    "D_prime": 128,
    "K": 27,
    "dtype": "fp16",
    "acc_dtype": "fp32",
    "BLOCK_N": 128,
    "BLOCK_K": 32,
    "BLOCK_Dp": 32,
    "PARALLEL_K": 1,
    "num_warps": 4,
    "num_stages": 2,
    "sm": 89
  },
  {
    "N": 200000,
    "D": 128,
    "D_prime": 256,
    "K": 27,
    "dtype": "fp16",
    "acc_dtype": "fp32",
    "BLOCK_N": 128,
    "BLOCK_K": 32,
    "BLOCK_Dp": 32,
    "PARALLEL_K": 1,
    "num_warps": 4,
    "num_stages": 2,
    "sm": 89
  },
  {
    "N": 200000,
    "D": 256,
    "D_prime": 256,
    "K": 27,
    "dtype": "fp16",
    "acc_dtype": "fp32",
    "BLOCK_N": 128,
    "BLOCK_K": 32,
    "BLOCK_Dp": 32,
    "PARALLEL_K": 1,
    "num_warps": 4,
    "num_stages": 2,
    "sm": 89
  },
  {
    "N": 200000,
    "D": 16,
    "D_prime": 16,
    "K": 27,
    "dtype": "fp16",
    "acc_dtype": "fp16",
    "BLOCK_N": 32,
    "BLOCK_K": 16,
    "BLOCK_Dp": 16,
    "PARALLEL_K": 1,
    "num_warps": 2,
    "num_stages": 2,
    "sm": 89
  },
  {
    "N": 200000,
    "D": 16,
    "D_prime": 32,
    "K": 27,
    "dtype": "fp16",
    "acc_dtype": "fp16",
    "BLOCK_N": 32,
    "BLOCK_K": 16,
    "BLOCK_Dp": 32,
    "PARALLEL_K": 1,
    "num_warps": 2,
    "num_stages": 2,
    "sm": 89
  },
  {
    "N": 200000,
    "D": 32,
    "D_prime": 32,
    "K": 27,
    "dtype": "fp16",
    "acc_dtype": "fp16",
    "BLOCK_N": 128,
    "BLOCK_K": 32,
    "BLOCK_Dp": 32,
    "PARALLEL_K": 1,
    "num_warps": 4,
    "num_stages": 2,
    "sm": 89
  },
  {
    "N": 200000,
    "D": 32,
    "D_prime": 64,
    "K": 27,
    "dtype": "fp16",
    "acc_dtype": "fp16",
    "BLOCK_N": 128,
    "BLOCK_K": 32,
    "BLOCK_Dp": 32,
    "PARALLEL_K": 1,
    "num_warps": 4,
    "num_stages": 2,
    "sm": 89
  },
  {
    "N": 200000,
    "D": 64,
    "D_prime": 64,
    "K": 27,
    "dtype": "fp16",
    "acc_dtype": "fp16",
    "BLOCK_N": 128,
    "BLOCK_K": 32,
    "BLOCK_Dp": 32,
    "PARALLEL_K": 1,
    "num_warps": 4,
    "num_stages": 2,
    "sm": 89
  },
  {
    "N": 200000,
    "D": 64,
    "D_prime": 128,
    "K": 27,
    "dtype": "fp16",
    "acc_dtype": "fp16",
    "BLOCK_N": 128,
    "BLOCK_K": 32,
    "BLOCK_Dp": 32,
    "PARALLEL_K": 1,
    "num_warps": 4,
    "num_stages": 2,
    "sm": 89
  },
  {
    "N": 200000,
    "D": 128,
    "D_prime": 128,
    "K": 27,
    "dtype": "fp16",
    "acc_dtype": "fp16",
    "BLOCK_N": 128,
    "BLOCK_K": 32,
    "BLOCK_Dp": 32,
    "PARALLEL_K": 1,
    "num_warps": 4,
    "num_stages": 2,
    "sm": 89
  },
  {
    "N": 200000,
    "D": 128,
    "D_prime": 256,
    "K": 27,
    "dtype": "fp16",
    "acc_dtype": "fp16",
    "BLOCK_N": 128,
    "BLOCK_K": 32,
    "BLOCK_Dp": 32,
    "PARALLEL_K": 1,
    "num_warps": 4,
    "num_stages": 2,
    "sm": 89
  },
  {
    "N": 200000,
    "D": 256,
    "D_prime": 256,
    "K": 27,
    "dtype": "fp16",
    "acc_dtype": "fp16",
    "BLOCK_N": 128,
    "BLOCK_K": 32,
    "BLOCK_Dp": 32,
    "PARALLEL_K": 1,
    "num_warps": 4,
    "num_stages": 2,
    "sm": 89
  },
  {
    "N": 400000,
    "D": 16,
    "D_prime": 16,
    "K": 27,
    "dtype": "fp32",
    "acc_dtype": "fp32",
    "BLOCK_N": 32,
    "BLOCK_K": 16,
    "BLOCK_Dp": 16,
    "PARALLEL_K": 1,
    "num_warps": 2,
    "num_stages": 2,
    "sm": 89
  },
  {
    "N": 400000,
    "D": 16,
    "D_prime": 32,
    "K": 27,
    "dtype": "fp32",
    "acc_dtype": "fp32",
    "BLOCK_N": 32,
    "BLOCK_K": 16,
    "BLOCK_Dp": 32,
    "PARALLEL_K": 1,
    "num_warps": 2,
    "num_stages": 2,
    "sm": 89
  },
  {
    "N": 400000,
    "D": 32,
    "D_prime": 32,
    "K": 27,
    "dtype": "fp32",
    "acc_dtype": "fp32",
    "BLOCK_N": 128,
    "BLOCK_K": 32,
    "BLOCK_Dp": 32,
    "PARALLEL_K": 1,
    "num_warps": 4,
    "num_stages": 2,
    "sm": 89
  },
  {
    "N": 400000,
    "D": 32,
    "D_prime": 64,
    "K": 27,
    "dtype": "fp32",
    "acc_dtype": "fp32",
    "BLOCK_N": 128,
    "BLOCK_K": 32,
    "BLOCK_Dp": 32,
    "PARALLEL_K": 1,
    "num_warps": 4,
    "num_stages": 2,
    "sm": 89
  },
  {
    "N": 400000,
    "D": 64,
    "D_prime": 64,
    "K": 27,
    "dtype": "fp32",
    "acc_dtype": "fp32",
    "BLOCK_N": 128,
    "BLOCK_K": 32,
    "BLOCK_Dp": 32,
    "PARALLEL_K": 1,
    "num_warps": 4,
    "num_stages": 2,
    "sm": 89
  },
  {
    "N": 400000,
    "D": 64,
    "D_prime": 128,
    "K": 27,
    "dtype": "fp32",
    "acc_dtype": "fp32",
    "BLOCK_N": 128,
    "BLOCK_K": 32,
    "BLOCK_Dp": 32,
    "PARALLEL_K": 1,
    "num_warps": 4,
    "num_stages": 2,
    "sm": 89
  },
  {
    "N": 400000,
    "D": 128,
    "D_prime": 128,
    "K": 27,
    "dtype": "fp32",
    "acc_dtype": "fp32",
    "BLOCK_N": 128,
    "BLOCK_K": 32,
    "BLOCK_Dp": 32,
    "PARALLEL_K": 1,
    "num_warps": 8,
    "num_stages": 2,
    "sm": 89
  },
  {
    "N": 400000,
    "D": 128,
    "D_prime": 256,
    "K": 27,
    "dtype": "fp32",
    "acc_dtype": "fp32",
    "BLOCK_N": 128,
    "BLOCK_K": 32,
    "BLOCK_Dp": 32,
    "PARALLEL_K": 1,
    "num_warps": 4,
    "num_stages": 2,
    "sm": 89
  },
  {
    "N": 400000,
    "D": 256,
    "D_prime": 256,
    "K": 27,
    "dtype": "fp32",
    "acc_dtype": "fp32",
    "BLOCK_N": 128,
    "BLOCK_K": 32,
    "BLOCK_Dp": 32,
    "PARALLEL_K": 1,
    "num_warps": 4,
    "num_stages": 2,
    "sm": 89
  },
  {
    "N": 400000,
    "D": 16,
    "D_prime": 16,
    "K": 27,
    "dtype": "fp16",
    "acc_dtype": "fp32",
    "BLOCK_N": 32,
    "BLOCK_K": 16,
    "BLOCK_Dp": 16,
    "PARALLEL_K": 1,
    "num_warps": 2,
    "num_stages": 2,
    "sm": 89
  },
  {
    "N": 400000,
    "D": 16,
    "D_prime": 32,
    "K": 27,
    "dtype": "fp16",
    "acc_dtype": "fp32",
    "BLOCK_N": 32,
    "BLOCK_K": 16,
    "BLOCK_Dp": 32,
    "PARALLEL_K": 1,
    "num_warps": 2,
    "num_stages": 2,
    "sm": 89
  },
  {
    "N": 400000,
    "D": 32,
    "D_prime": 32,
    "K": 27,
    "dtype": "fp16",
    "acc_dtype": "fp32",
    "BLOCK_N": 128,
    "BLOCK_K": 32,
    "BLOCK_Dp": 32,
    "PARALLEL_K": 1,
    "num_warps": 4,
    "num_stages": 2,
    "sm": 89
  },
  {
    "N": 400000,
    "D": 32,
    "D_prime": 64,
    "K": 27,
    "dtype": "fp16",
    "acc_dtype": "fp32",
    "BLOCK_N": 128,
    "BLOCK_K": 32,
    "BLOCK_Dp": 32,
    "PARALLEL_K": 1,
    "num_warps": 4,
    "num_stages": 2,
    "sm": 89
  },
  {
    "N": 400000,
    "D": 64,
    "D_prime": 64,
    "K": 27,
    "dtype": "fp16",
    "acc_dtype": "fp32",
    "BLOCK_N": 128,
    "BLOCK_K": 32,
    "BLOCK_Dp": 32,
    "PARALLEL_K": 1,
    "num_warps": 4,
    "num_stages": 2,
    "sm": 89
  },
  {
    "N": 400000,
    "D": 64,
    "D_prime": 128,
    "K": 27,
    "dtype": "fp16",
    "acc_dtype": "fp32",
    "BLOCK_N": 128,
    "BLOCK_K": 32,
    "BLOCK_Dp": 32,
    "PARALLEL_K": 1,
    "num_warps": 4,
    "num_stages": 2,
    "sm": 89
  },
  {
    "N": 400000,
    "D": 128,
    "D_prime": 128,
    "K": 27,
    "dtype": "fp16",
    "acc_dtype": "fp32",
    "BLOCK_N": 128,
    "BLOCK_K": 32,
    "BLOCK_Dp": 32,
    "PARALLEL_K": 1,
    "num_warps": 4,
    "num_stages": 2,
    "sm": 89
  },
  {
    "N": 400000,
    "D": 128,
    "D_prime": 256,
    "K": 27,
    "dtype": "fp16",
    "acc_dtype": "fp32",
    "BLOCK_N": 128,
    "BLOCK_K": 32,
    "BLOCK_Dp": 32,
    "PARALLEL_K": 1,
    "num_warps": 4,
    "num_stages": 2,
    "sm": 89
  },
  {
    "N": 400000,
    "D": 256,
    "D_prime": 256,
    "K": 27,
    "dtype": "fp16",
    "acc_dtype": "fp32",
    "BLOCK_N": 128,
    "BLOCK_K": 32,
    "BLOCK_Dp": 32,
    "PARALLEL_K": 1,
    "num_warps": 4,
    "num_stages": 2,
    "sm": 89
  },
  {
    "N": 400000,
    "D": 16,
    "D_prime": 16,
    "K": 27,
    "dtype": "fp16",
    "acc_dtype": "fp16",
    "BLOCK_N": 32,
    "BLOCK_K": 16,
    "BLOCK_Dp": 16,
    "PARALLEL_K": 1,
    "num_warps": 2,
    "num_stages": 2,
    "sm": 89
  },
  {
    "N": 400000,
    "D": 16,
    "D_prime": 32,
    "K": 27,
    "dtype": "fp16",
    "acc_dtype": "fp16",
    "BLOCK_N": 32,
    "BLOCK_K": 16,
    "BLOCK_Dp": 32,
    "PARALLEL_K": 1,
    "num_warps": 2,
    "num_stages": 2,
    "sm": 89
  },
  {
    "N": 400000,
    "D": 32,
    "D_prime": 32,
    "K": 27,
    "dtype": "fp16",
    "acc_dtype": "fp16",
    "BLOCK_N": 128,
    "BLOCK_K": 32,
    "BLOCK_Dp": 32,
    "PARALLEL_K": 1,
    "num_warps": 4,
    "num_stages": 2,
    "sm": 89
  },
  {
    "N": 400000,
    "D": 32,
    "D_prime": 64,
    "K": 27,
    "dtype": "fp16",
    "acc_dtype": "fp16",
    "BLOCK_N": 128,
    "BLOCK_K": 32,
    "BLOCK_Dp": 32,
    "PARALLEL_K": 1,
    "num_warps": 4,
    "num_stages": 2,
    "sm": 89
  },
  {
    "N": 400000,
    "D": 64,
    "D_prime": 64,
    "K": 27,
    "dtype": "fp16",
    "acc_dtype": "fp16",
    "BLOCK_N": 128,
    "BLOCK_K": 32,
    "BLOCK_Dp": 32,
    "PARALLEL_K": 1,
    "num_warps": 4,
    "num_stages": 2,
    "sm": 89
  },
  {
    "N": 400000,
    "D": 64,
    "D_prime": 128,
    "K": 27,
    "dtype": "fp16",
    "acc_dtype": "fp16",
    "BLOCK_N": 128,
    "BLOCK_K": 32,
    "BLOCK_Dp": 32,
    "PARALLEL_K": 1,
    "num_warps": 4,
    "num_stages": 2,
    "sm": 89
  },
  {
    "N": 400000,
    "D": 128,
    "D_prime": 128,
    "K": 27,
    "dtype": "fp16",
    "acc_dtype": "fp16",
    "BLOCK_N": 128,
    "BLOCK_K": 32,
    "BLOCK_Dp": 32,
    "PARALLEL_K": 1,
    "num_warps": 4,
    "num_stages": 2,
    "sm": 89
  },
  {
    "N": 400000,
    "D": 128,
    "D_prime": 256,
    "K": 27,
    "dtype": "fp16",
    "acc_dtype": "fp16",
    "BLOCK_N": 128,
    "BLOCK_K": 32,
    "BLOCK_Dp": 32,
    "PARALLEL_K": 1,
    "num_warps": 4,
    "num_stages": 2,
    "sm": 89
  },
  {
    "N": 400000,
    "D": 256,
    "D_prime": 256,
    "K": 27,
    "dtype": "fp16",
    "acc_dtype": "fp16",
    "BLOCK_N": 128,
    "BLOCK_K": 32,
    "BLOCK_Dp": 32,
    "PARALLEL_K": 1,
    "num_warps": 4,
    "num_stages": 2,
    "sm": 89
  }
]