kernel_ptx/meta.json
{
    "Config(BLOCK_N=32, BLOCK_K=32, BLOCK_Dp=16, num_warps=2, num_stages=2, parallel_k=1, div_k=False, div_d=True, div_dp=True, acc_dtype='fp32', dtype='fp16', sm=86).ptx": {
        "config": {
            "BLOCK_N": 32,
            "BLOCK_K": 32,
            "BLOCK_Dp": 16,
            "num_warps": 2,
            "num_stages": 2,
            "parallel_k": 1,
            "div_k": false,
            "div_d": true,
            "div_dp": true,
            "acc_dtype": "fp32",
            "dtype": "fp16",
            "sm": 86
        },
        "meta": {
            "shared": 3072,
            "num_warps": 2,
            "num_stages": 2,
            "global_scratch_size": 0
        }
    },
    "Config(BLOCK_N=16, BLOCK_K=32, BLOCK_Dp=64, num_warps=2, num_stages=2, parallel_k=1, div_k=False, div_d=True, div_dp=True, acc_dtype='fp32', dtype='fp16', sm=86).ptx": {
        "config": {
            "BLOCK_N": 16,
            "BLOCK_K": 32,
            "BLOCK_Dp": 64,
            "num_warps": 2,
            "num_stages": 2,
            "parallel_k": 1,
            "div_k": false,
            "div_d": true,
            "div_dp": true,
            "acc_dtype": "fp32",
            "dtype": "fp16",
            "sm": 86
        },
        "meta": {
            "shared": 5120,
            "num_warps": 2,
            "num_stages": 2,
            "global_scratch_size": 0
        }
    },
    "Config(BLOCK_N=32, BLOCK_K=16, BLOCK_Dp=16, num_warps=2, num_stages=2, parallel_k=1, div_k=False, div_d=True, div_dp=True, acc_dtype='fp32', dtype='fp16', sm=86).ptx": {
        "config": {
            "BLOCK_N": 32,
            "BLOCK_K": 16,
            "BLOCK_Dp": 16,
            "num_warps": 2,
            "num_stages": 2,
            "parallel_k": 1,
            "div_k": false,
            "div_d": true,
            "div_dp": true,
            "acc_dtype": "fp32",
            "dtype": "fp16",
            "sm": 86
        },
        "meta": {
            "shared": 1536,
            "num_warps": 2,
            "num_stages": 2,
            "global_scratch_size": 0
        }
    },
    "Config(BLOCK_N=16, BLOCK_K=32, BLOCK_Dp=64, num_warps=2, num_stages=2, parallel_k=1, div_k=False, div_d=True, div_dp=True, acc_dtype='fp32', dtype='fp16', sm=89).ptx": {
        "config": {
            "BLOCK_N": 16,
            "BLOCK_K": 32,
            "BLOCK_Dp": 64,
            "num_warps": 2,
            "num_stages": 2,
            "parallel_k": 1,
            "div_k": false,
            "div_d": true,
            "div_dp": true,
            "acc_dtype": "fp32",
            "dtype": "fp16",
            "sm": 89
        },
        "meta": {
            "shared": 5120,
            "num_warps": 2,
            "num_stages": 2,
            "global_scratch_size": 0
        }
    },
    "Config(BLOCK_N=32, BLOCK_K=16, BLOCK_Dp=16, num_warps=2, num_stages=2, parallel_k=1, div_k=False, div_d=True, div_dp=True, acc_dtype='fp32', dtype='fp16', sm=89).ptx": {
        "config": {
            "BLOCK_N": 32,
            "BLOCK_K": 16,
            "BLOCK_Dp": 16,
            "num_warps": 2,
            "num_stages": 2,
            "parallel_k": 1,
            "div_k": false,
            "div_d": true,
            "div_dp": true,
            "acc_dtype": "fp32",
            "dtype": "fp16",
            "sm": 89
        },
        "meta": {
            "shared": 1536,
            "num_warps": 2,
            "num_stages": 2,
            "global_scratch_size": 0
        }
    },
    "Config(BLOCK_N=32, BLOCK_K=32, BLOCK_Dp=16, num_warps=2, num_stages=2, parallel_k=1, div_k=False, div_d=True, div_dp=True, acc_dtype='fp32', dtype='fp32', sm=86).ptx": {
        "config": {
            "BLOCK_N": 32,
            "BLOCK_K": 32,
            "BLOCK_Dp": 16,
            "num_warps": 2,
            "num_stages": 2,
            "parallel_k": 1,
            "div_k": false,
            "div_d": true,
            "div_dp": true,
            "acc_dtype": "fp32",
            "dtype": "fp32",
            "sm": 86
        },
        "meta": {
            "shared": 6144,
            "num_warps": 2,
            "num_stages": 2,
            "global_scratch_size": 0
        }
    },
    "Config(BLOCK_N=32, BLOCK_K=16, BLOCK_Dp=16, num_warps=2, num_stages=2, parallel_k=1, div_k=False, div_d=True, div_dp=True, acc_dtype='fp32', dtype='fp32', sm=86).ptx": {
        "config": {
            "BLOCK_N": 32,
            "BLOCK_K": 16,
            "BLOCK_Dp": 16,
            "num_warps": 2,
            "num_stages": 2,
            "parallel_k": 1,
            "div_k": false,
            "div_d": true,
            "div_dp": true,
            "acc_dtype": "fp32",
            "dtype": "fp32",
            "sm": 86
        },
        "meta": {
            "shared": 3072,
            "num_warps": 2,
            "num_stages": 2,
            "global_scratch_size": 0
        }
    },
    "Config(BLOCK_N=16, BLOCK_K=32, BLOCK_Dp=64, num_warps=2, num_stages=2, parallel_k=1, div_k=False, div_d=True, div_dp=True, acc_dtype='fp32', dtype='fp32', sm=89).ptx": {
        "config": {
            "BLOCK_N": 16,
            "BLOCK_K": 32,
            "BLOCK_Dp": 64,
            "num_warps": 2,
            "num_stages": 2,
            "parallel_k": 1,
            "div_k": false,
            "div_d": true,
            "div_dp": true,
            "acc_dtype": "fp32",
            "dtype": "fp32",
            "sm": 89
        },
        "meta": {
            "shared": 10240,
            "num_warps": 2,
            "num_stages": 2,
            "global_scratch_size": 0
        }
    },
    "Config(BLOCK_N=32, BLOCK_K=16, BLOCK_Dp=16, num_warps=2, num_stages=2, parallel_k=1, div_k=False, div_d=True, div_dp=True, acc_dtype='fp32', dtype='fp32', sm=89).ptx": {
        "config": {
            "BLOCK_N": 32,
            "BLOCK_K": 16,
            "BLOCK_Dp": 16,
            "num_warps": 2,
            "num_stages": 2,
            "parallel_k": 1,
            "div_k": false,
            "div_d": true,
            "div_dp": true,
            "acc_dtype": "fp32",
            "dtype": "fp32",
            "sm": 89
        },
        "meta": {
            "shared": 3072,
            "num_warps": 2,
            "num_stages": 2,
            "global_scratch_size": 0
        }
    },
    "Config(BLOCK_N=16, BLOCK_K=32, BLOCK_Dp=128, num_warps=4, num_stages=2, parallel_k=1, div_k=False, div_d=True, div_dp=True, acc_dtype='fp16', dtype='fp16', sm=89).ptx": {
        "config": {
            "BLOCK_N": 16,
            "BLOCK_K": 32,
            "BLOCK_Dp": 128,
            "num_warps": 4,
            "num_stages": 2,
            "parallel_k": 1,
            "div_k": false,
            "div_d": true,
            "div_dp": true,
            "acc_dtype": "fp16",
            "dtype": "fp16",
            "sm": 89
        },
        "meta": {
            "shared": 9216,
            "num_warps": 4,
            "num_stages": 2,
            "global_scratch_size": 0
        }
    },
    "Config(BLOCK_N=16, BLOCK_K=32, BLOCK_Dp=128, num_warps=4, num_stages=2, parallel_k=1, div_k=False, div_d=True, div_dp=True, acc_dtype='fp32', dtype='fp16', sm=86).ptx": {
        "config": {
            "BLOCK_N": 16,
            "BLOCK_K": 32,
            "BLOCK_Dp": 128,
            "num_warps": 4,
            "num_stages": 2,
            "parallel_k": 1,
            "div_k": false,
            "div_d": true,
            "div_dp": true,
            "acc_dtype": "fp32",
            "dtype": "fp16",
            "sm": 86
        },
        "meta": {
            "shared": 9216,
            "num_warps": 4,
            "num_stages": 2,
            "global_scratch_size": 0
        }
    },
    "Config(BLOCK_N=32, BLOCK_K=16, BLOCK_Dp=32, num_warps=2, num_stages=2, parallel_k=1, div_k=False, div_d=True, div_dp=True, acc_dtype='fp16', dtype='fp16', sm=86).ptx": {
        "config": {
            "BLOCK_N": 32,
            "BLOCK_K": 16,
            "BLOCK_Dp": 32,
            "num_warps": 2,
            "num_stages": 2,
            "parallel_k": 1,
            "div_k": false,
            "div_d": true,
            "div_dp": true,
            "acc_dtype": "fp16",
            "dtype": "fp16",
            "sm": 86
        },
        "meta": {
            "shared": 2048,
            "num_warps": 2,
            "num_stages": 2,
            "global_scratch_size": 0
        }
    },
    "Config(BLOCK_N=16, BLOCK_K=32, BLOCK_Dp=128, num_warps=4, num_stages=2, parallel_k=1, div_k=False, div_d=True, div_dp=True, acc_dtype='fp32', dtype='fp16', sm=89).ptx": {
        "config": {
            "BLOCK_N": 16,
            "BLOCK_K": 32,
            "BLOCK_Dp": 128,
            "num_warps": 4,
            "num_stages": 2,
            "parallel_k": 1,
            "div_k": false,
            "div_d": true,
            "div_dp": true,
            "acc_dtype": "fp32",
            "dtype": "fp16",
            "sm": 89
        },
        "meta": {
            "shared": 9216,
            "num_warps": 4,
            "num_stages": 2,
            "global_scratch_size": 0
        }
    },
    "Config(BLOCK_N=32, BLOCK_K=16, BLOCK_Dp=32, num_warps=2, num_stages=2, parallel_k=1, div_k=False, div_d=True, div_dp=True, acc_dtype='fp16', dtype='fp16', sm=89).ptx": {
        "config": {
            "BLOCK_N": 32,
            "BLOCK_K": 16,
            "BLOCK_Dp": 32,
            "num_warps": 2,
            "num_stages": 2,
            "parallel_k": 1,
            "div_k": false,
            "div_d": true,
            "div_dp": true,
            "acc_dtype": "fp16",
            "dtype": "fp16",
            "sm": 89
        },
        "meta": {
            "shared": 2048,
            "num_warps": 2,
            "num_stages": 2,
            "global_scratch_size": 0
        }
    },
    "Config(BLOCK_N=32, BLOCK_K=16, BLOCK_Dp=16, num_warps=2, num_stages=2, parallel_k=1, div_k=False, div_d=True, div_dp=True, acc_dtype='fp16', dtype='fp16', sm=86).ptx": {
        "config": {
            "BLOCK_N": 32,
            "BLOCK_K": 16,
            "BLOCK_Dp": 16,
            "num_warps": 2,
            "num_stages": 2,
            "parallel_k": 1,
            "div_k": false,
            "div_d": true,
            "div_dp": true,
            "acc_dtype": "fp16",
            "dtype": "fp16",
            "sm": 86
        },
        "meta": {
            "shared": 1536,
            "num_warps": 2,
            "num_stages": 2,
            "global_scratch_size": 0
        }
    },
    "Config(BLOCK_N=16, BLOCK_K=64, BLOCK_Dp=64, num_warps=4, num_stages=2, parallel_k=1, div_k=False, div_d=True, div_dp=True, acc_dtype='fp32', dtype='fp16', sm=86).ptx": {
        "config": {
            "BLOCK_N": 16,
            "BLOCK_K": 64,
            "BLOCK_Dp": 64,
            "num_warps": 4,
            "num_stages": 2,
            "parallel_k": 1,
            "div_k": false,
            "div_d": true,
            "div_dp": true,
            "acc_dtype": "fp32",
            "dtype": "fp16",
            "sm": 86
        },
        "meta": {
            "shared": 10240,
            "num_warps": 4,
            "num_stages": 2,
            "global_scratch_size": 0
        }
    },
    "Config(BLOCK_N=16, BLOCK_K=32, BLOCK_Dp=64, num_warps=4, num_stages=2, parallel_k=1, div_k=False, div_d=True, div_dp=True, acc_dtype='fp16', dtype='fp16', sm=89).ptx": {
        "config": {
            "BLOCK_N": 16,
            "BLOCK_K": 32,
            "BLOCK_Dp": 64,
            "num_warps": 4,
            "num_stages": 2,
            "parallel_k": 1,
            "div_k": false,
            "div_d": true,
            "div_dp": true,
            "acc_dtype": "fp16",
            "dtype": "fp16",
            "sm": 89
        },
        "meta": {
            "shared": 5120,
            "num_warps": 4,
            "num_stages": 2,
            "global_scratch_size": 0
        }
    },
    "Config(BLOCK_N=16, BLOCK_K=32, BLOCK_Dp=64, num_warps=2, num_stages=2, parallel_k=1, div_k=False, div_d=True, div_dp=True, acc_dtype='fp16', dtype='fp16', sm=89).ptx": {
        "config": {
            "BLOCK_N": 16,
            "BLOCK_K": 32,
            "BLOCK_Dp": 64,
            "num_warps": 2,
            "num_stages": 2,
            "parallel_k": 1,
            "div_k": false,
            "div_d": true,
            "div_dp": true,
            "acc_dtype": "fp16",
            "dtype": "fp16",
            "sm": 89
        },
        "meta": {
            "shared": 5120,
            "num_warps": 2,
            "num_stages": 2,
            "global_scratch_size": 0
        }
    },
    "Config(BLOCK_N=32, BLOCK_K=16, BLOCK_Dp=16, num_warps=2, num_stages=2, parallel_k=1, div_k=False, div_d=True, div_dp=True, acc_dtype='fp16', dtype='fp16', sm=89).ptx": {
        "config": {
            "BLOCK_N": 32,
            "BLOCK_K": 16,
            "BLOCK_Dp": 16,
            "num_warps": 2,
            "num_stages": 2,
            "parallel_k": 1,
            "div_k": false,
            "div_d": true,
            "div_dp": true,
            "acc_dtype": "fp16",
            "dtype": "fp16",
            "sm": 89
        },
        "meta": {
            "shared": 1536,
            "num_warps": 2,
            "num_stages": 2,
            "global_scratch_size": 0
        }
    },
    "Config(BLOCK_N=16, BLOCK_K=64, BLOCK_Dp=64, num_warps=4, num_stages=2, parallel_k=1, div_k=False, div_d=True, div_dp=True, acc_dtype='fp32', dtype='fp16', sm=89).ptx": {
        "config": {
            "BLOCK_N": 16,
            "BLOCK_K": 64,
            "BLOCK_Dp": 64,
            "num_warps": 4,
            "num_stages": 2,
            "parallel_k": 1,
            "div_k": false,
            "div_d": true,
            "div_dp": true,
            "acc_dtype": "fp32",
            "dtype": "fp16",
            "sm": 89
        },
        "meta": {
            "shared": 10240,
            "num_warps": 4,
            "num_stages": 2,
            "global_scratch_size": 0
        }
    },
    "Config(BLOCK_N=16, BLOCK_K=32, BLOCK_Dp=64, num_warps=4, num_stages=2, parallel_k=1, div_k=False, div_d=True, div_dp=True, acc_dtype='fp32', dtype='fp16', sm=86).ptx": {
        "config": {
            "BLOCK_N": 16,
            "BLOCK_K": 32,
            "BLOCK_Dp": 64,
            "num_warps": 4,
            "num_stages": 2,
            "parallel_k": 1,
            "div_k": false,
            "div_d": true,
            "div_dp": true,
            "acc_dtype": "fp32",
            "dtype": "fp16",
            "sm": 86
        },
        "meta": {
            "shared": 5120,
            "num_warps": 4,
            "num_stages": 2,
            "global_scratch_size": 0
        }
    },
    "Config(BLOCK_N=16, BLOCK_K=16, BLOCK_Dp=16, num_warps=2, num_stages=2, parallel_k=1, div_k=False, div_d=True, div_dp=True, acc_dtype='fp32', dtype='fp16', sm=89).ptx": {
        "config": {
            "BLOCK_N": 16,
            "BLOCK_K": 16,
            "BLOCK_Dp": 16,
            "num_warps": 2,
            "num_stages": 2,
            "parallel_k": 1,
            "div_k": false,
            "div_d": true,
            "div_dp": true,
            "acc_dtype": "fp32",
            "dtype": "fp16",
            "sm": 89
        },
        "meta": {
            "shared": 1024,
            "num_warps": 2,
            "num_stages": 2,
            "global_scratch_size": 0
        }
    },
    "Config(BLOCK_N=16, BLOCK_K=32, BLOCK_Dp=32, num_warps=2, num_stages=2, parallel_k=1, div_k=False, div_d=True, div_dp=True, acc_dtype='fp32', dtype='fp32', sm=86).ptx": {
        "config": {
            "BLOCK_N": 16,
            "BLOCK_K": 32,
            "BLOCK_Dp": 32,
            "num_warps": 2,
            "num_stages": 2,
            "parallel_k": 1,
            "div_k": false,
            "div_d": true,
            "div_dp": true,
            "acc_dtype": "fp32",
            "dtype": "fp32",
            "sm": 86
        },
        "meta": {
            "shared": 6144,
            "num_warps": 2,
            "num_stages": 2,
            "global_scratch_size": 0
        }
    },
    "Config(BLOCK_N=16, BLOCK_K=16, BLOCK_Dp=16, num_warps=2, num_stages=2, parallel_k=1, div_k=False, div_d=True, div_dp=True, acc_dtype='fp32', dtype='fp16', sm=86).ptx": {
        "config": {
            "BLOCK_N": 16,
            "BLOCK_K": 16,
            "BLOCK_Dp": 16,
            "num_warps": 2,
            "num_stages": 2,
            "parallel_k": 1,
            "div_k": false,
            "div_d": true,
            "div_dp": true,
            "acc_dtype": "fp32",
            "dtype": "fp16",
            "sm": 86
        },
        "meta": {
            "shared": 1024,
            "num_warps": 2,
            "num_stages": 2,
            "global_scratch_size": 0
        }
    },
    "Config(BLOCK_N=16, BLOCK_K=64, BLOCK_Dp=64, num_warps=4, num_stages=2, parallel_k=1, div_k=False, div_d=True, div_dp=True, acc_dtype='fp32', dtype='fp32', sm=89).ptx": {
        "config": {
            "BLOCK_N": 16,
            "BLOCK_K": 64,
            "BLOCK_Dp": 64,
            "num_warps": 4,
            "num_stages": 2,
            "parallel_k": 1,
            "div_k": false,
            "div_d": true,
            "div_dp": true,
            "acc_dtype": "fp32",
            "dtype": "fp32",
            "sm": 89
        },
        "meta": {
            "shared": 20480,
            "num_warps": 4,
            "num_stages": 2,
            "global_scratch_size": 0
        }
    },
    "Config(BLOCK_N=16, BLOCK_K=32, BLOCK_Dp=32, num_warps=2, num_stages=2, parallel_k=1, div_k=False, div_d=True, div_dp=True, acc_dtype='fp32', dtype='fp16', sm=86).ptx": {
        "config": {
            "BLOCK_N": 16,
            "BLOCK_K": 32,
            "BLOCK_Dp": 32,
            "num_warps": 2,
            "num_stages": 2,
            "parallel_k": 1,
            "div_k": false,
            "div_d": true,
            "div_dp": true,
            "acc_dtype": "fp32",
            "dtype": "fp16",
            "sm": 86
        },
        "meta": {
            "shared": 3072,
            "num_warps": 2,
            "num_stages": 2,
            "global_scratch_size": 0
        }
    },
    "Config(BLOCK_N=16, BLOCK_K=32, BLOCK_Dp=32, num_warps=2, num_stages=2, parallel_k=1, div_k=False, div_d=True, div_dp=True, acc_dtype='fp32', dtype='fp32', sm=89).ptx": {
        "config": {
            "BLOCK_N": 16,
            "BLOCK_K": 32,
            "BLOCK_Dp": 32,
            "num_warps": 2,
            "num_stages": 2,
            "parallel_k": 1,
            "div_k": false,
            "div_d": true,
            "div_dp": true,
            "acc_dtype": "fp32",
            "dtype": "fp32",
            "sm": 89
        },
        "meta": {
            "shared": 6144,
            "num_warps": 2,
            "num_stages": 2,
            "global_scratch_size": 0
        }
    },
    "Config(BLOCK_N=128, BLOCK_K=32, BLOCK_Dp=32, num_warps=4, num_stages=2, parallel_k=1, div_k=False, div_d=True, div_dp=True, acc_dtype='fp32', dtype='fp32', sm=86).ptx": {
        "config": {
            "BLOCK_N": 128,
            "BLOCK_K": 32,
            "BLOCK_Dp": 32,
            "num_warps": 4,
            "num_stages": 2,
            "parallel_k": 1,
            "div_k": false,
            "div_d": true,
            "div_dp": true,
            "acc_dtype": "fp32",
            "dtype": "fp32",
            "sm": 86
        },
        "meta": {
            "shared": 20480,
            "num_warps": 4,
            "num_stages": 2,
            "global_scratch_size": 0
        }
    },
    "Config(BLOCK_N=16, BLOCK_K=32, BLOCK_Dp=64, num_warps=4, num_stages=2, parallel_k=1, div_k=False, div_d=True, div_dp=True, acc_dtype='fp32', dtype='fp32', sm=86).ptx": {
        "config": {
            "BLOCK_N": 16,
            "BLOCK_K": 32,
            "BLOCK_Dp": 64,
            "num_warps": 4,
            "num_stages": 2,
            "parallel_k": 1,
            "div_k": false,
            "div_d": true,
            "div_dp": true,
            "acc_dtype": "fp32",
            "dtype": "fp32",
            "sm": 86
        },
        "meta": {
            "shared": 10240,
            "num_warps": 4,
            "num_stages": 2,
            "global_scratch_size": 0
        }
    },
    "Config(BLOCK_N=16, BLOCK_K=32, BLOCK_Dp=32, num_warps=2, num_stages=2, parallel_k=1, div_k=False, div_d=True, div_dp=True, acc_dtype='fp32', dtype='fp16', sm=89).ptx": {
        "config": {
            "BLOCK_N": 16,
            "BLOCK_K": 32,
            "BLOCK_Dp": 32,
            "num_warps": 2,
            "num_stages": 2,
            "parallel_k": 1,
            "div_k": false,
            "div_d": true,
            "div_dp": true,
            "acc_dtype": "fp32",
            "dtype": "fp16",
            "sm": 89
        },
        "meta": {
            "shared": 3072,
            "num_warps": 2,
            "num_stages": 2,
            "global_scratch_size": 0
        }
    },
    "Config(BLOCK_N=16, BLOCK_K=16, BLOCK_Dp=16, num_warps=2, num_stages=2, parallel_k=1, div_k=False, div_d=True, div_dp=True, acc_dtype='fp32', dtype='fp32', sm=86).ptx": {
        "config": {
            "BLOCK_N": 16,
            "BLOCK_K": 16,
            "BLOCK_Dp": 16,
            "num_warps": 2,
            "num_stages": 2,
            "parallel_k": 1,
            "div_k": false,
            "div_d": true,
            "div_dp": true,
            "acc_dtype": "fp32",
            "dtype": "fp32",
            "sm": 86
        },
        "meta": {
            "shared": 2048,
            "num_warps": 2,
            "num_stages": 2,
            "global_scratch_size": 0
        }
    },
    "Config(BLOCK_N=128, BLOCK_K=32, BLOCK_Dp=32, num_warps=4, num_stages=2, parallel_k=1, div_k=False, div_d=True, div_dp=True, acc_dtype='fp32', dtype='fp32', sm=89).ptx": {
        "config": {
            "BLOCK_N": 128,
            "BLOCK_K": 32,
            "BLOCK_Dp": 32,
            "num_warps": 4,
            "num_stages": 2,
            "parallel_k": 1,
            "div_k": false,
            "div_d": true,
            "div_dp": true,
            "acc_dtype": "fp32",
            "dtype": "fp32",
            "sm": 89
        },
        "meta": {
            "shared": 20480,
            "num_warps": 4,
            "num_stages": 2,
            "global_scratch_size": 0
        }
    },
    "Config(BLOCK_N=16, BLOCK_K=32, BLOCK_Dp=64, num_warps=4, num_stages=2, parallel_k=1, div_k=False, div_d=True, div_dp=True, acc_dtype='fp32', dtype='fp32', sm=89).ptx": {
        "config": {
            "BLOCK_N": 16,
            "BLOCK_K": 32,
            "BLOCK_Dp": 64,
            "num_warps": 4,
            "num_stages": 2,
            "parallel_k": 1,
            "div_k": false,
            "div_d": true,
            "div_dp": true,
            "acc_dtype": "fp32",
            "dtype": "fp32",
            "sm": 89
        },
        "meta": {
            "shared": 10240,
            "num_warps": 4,
            "num_stages": 2,
            "global_scratch_size": 0
        }
    },
    "Config(BLOCK_N=16, BLOCK_K=16, BLOCK_Dp=16, num_warps=2, num_stages=2, parallel_k=1, div_k=False, div_d=True, div_dp=True, acc_dtype='fp32', dtype='fp32', sm=89).ptx": {
        "config": {
            "BLOCK_N": 16,
            "BLOCK_K": 16,
            "BLOCK_Dp": 16,
            "num_warps": 2,
            "num_stages": 2,
            "parallel_k": 1,
            "div_k": false,
            "div_d": true,
            "div_dp": true,
            "acc_dtype": "fp32",
            "dtype": "fp32",
            "sm": 89
        },
        "meta": {
            "shared": 2048,
            "num_warps": 2,
            "num_stages": 2,
            "global_scratch_size": 0
        }
    },
    "Config(BLOCK_N=128, BLOCK_K=32, BLOCK_Dp=32, num_warps=4, num_stages=2, parallel_k=1, div_k=False, div_d=True, div_dp=True, acc_dtype='fp32', dtype='fp16', sm=89).ptx": {
        "config": {
            "BLOCK_N": 128,
            "BLOCK_K": 32,
            "BLOCK_Dp": 32,
            "num_warps": 4,
            "num_stages": 2,
            "parallel_k": 1,
            "div_k": false,
            "div_d": true,
            "div_dp": true,
            "acc_dtype": "fp32",
            "dtype": "fp16",
            "sm": 89
        },
        "meta": {
            "shared": 10240,
            "num_warps": 4,
            "num_stages": 2,
            "global_scratch_size": 0
        }
    },
    "Config(BLOCK_N=128, BLOCK_K=32, BLOCK_Dp=32, num_warps=8, num_stages=2, parallel_k=1, div_k=False, div_d=True, div_dp=True, acc_dtype='fp32', dtype='fp32', sm=89).ptx": {
        "config": {
            "BLOCK_N": 128,
            "BLOCK_K": 32,
            "BLOCK_Dp": 32,
            "num_warps": 8,
            "num_stages": 2,
            "parallel_k": 1,
            "div_k": false,
            "div_d": true,
            "div_dp": true,
            "acc_dtype": "fp32",
            "dtype": "fp32",
            "sm": 89
        },
        "meta": {
            "shared": 20480,
            "num_warps": 8,
            "num_stages": 2,
            "global_scratch_size": 0
        }
    },
    "Config(BLOCK_N=16, BLOCK_K=64, BLOCK_Dp=64, num_warps=4, num_stages=2, parallel_k=1, div_k=False, div_d=True, div_dp=True, acc_dtype='fp16', dtype='fp16', sm=86).ptx": {
        "config": {
            "BLOCK_N": 16,
            "BLOCK_K": 64,
            "BLOCK_Dp": 64,
            "num_warps": 4,
            "num_stages": 2,
            "parallel_k": 1,
            "div_k": false,
            "div_d": true,
            "div_dp": true,
            "acc_dtype": "fp16",
            "dtype": "fp16",
            "sm": 86
        },
        "meta": {
            "shared": 10240,
            "num_warps": 4,
            "num_stages": 2,
            "global_scratch_size": 0
        }
    },
    "Config(BLOCK_N=32, BLOCK_K=16, BLOCK_Dp=32, num_warps=2, num_stages=2, parallel_k=1, div_k=False, div_d=True, div_dp=True, acc_dtype='fp32', dtype='fp16', sm=86).ptx": {
        "config": {
            "BLOCK_N": 32,
            "BLOCK_K": 16,
            "BLOCK_Dp": 32,
            "num_warps": 2,
            "num_stages": 2,
            "parallel_k": 1,
            "div_k": false,
            "div_d": true,
            "div_dp": true,
            "acc_dtype": "fp32",
            "dtype": "fp16",
            "sm": 86
        },
        "meta": {
            "shared": 2048,
            "num_warps": 2,
            "num_stages": 2,
            "global_scratch_size": 0
        }
    },
    "Config(BLOCK_N=16, BLOCK_K=32, BLOCK_Dp=32, num_warps=2, num_stages=2, parallel_k=1, div_k=False, div_d=True, div_dp=True, acc_dtype='fp16', dtype='fp16', sm=86).ptx": {
        "config": {
            "BLOCK_N": 16,
            "BLOCK_K": 32,
            "BLOCK_Dp": 32,
            "num_warps": 2,
            "num_stages": 2,
            "parallel_k": 1,
            "div_k": false,
            "div_d": true,
            "div_dp": true,
            "acc_dtype": "fp16",
            "dtype": "fp16",
            "sm": 86
        },
        "meta": {
            "shared": 3072,
            "num_warps": 2,
            "num_stages": 2,
            "global_scratch_size": 0
        }
    },
    "Config(BLOCK_N=16, BLOCK_K=64, BLOCK_Dp=64, num_warps=4, num_stages=2, parallel_k=1, div_k=False, div_d=True, div_dp=True, acc_dtype='fp16', dtype='fp16', sm=89).ptx": {
        "config": {
            "BLOCK_N": 16,
            "BLOCK_K": 64,
            "BLOCK_Dp": 64,
            "num_warps": 4,
            "num_stages": 2,
            "parallel_k": 1,
            "div_k": false,
            "div_d": true,
            "div_dp": true,
            "acc_dtype": "fp16",
            "dtype": "fp16",
            "sm": 89
        },
        "meta": {
            "shared": 10240,
            "num_warps": 4,
            "num_stages": 2,
            "global_scratch_size": 0
        }
    },
    "Config(BLOCK_N=32, BLOCK_K=16, BLOCK_Dp=32, num_warps=2, num_stages=2, parallel_k=1, div_k=False, div_d=True, div_dp=True, acc_dtype='fp32', dtype='fp16', sm=89).ptx": {
        "config": {
            "BLOCK_N": 32,
            "BLOCK_K": 16,
            "BLOCK_Dp": 32,
            "num_warps": 2,
            "num_stages": 2,
            "parallel_k": 1,
            "div_k": false,
            "div_d": true,
            "div_dp": true,
            "acc_dtype": "fp32",
            "dtype": "fp16",
            "sm": 89
        },
        "meta": {
            "shared": 2048,
            "num_warps": 2,
            "num_stages": 2,
            "global_scratch_size": 0
        }
    },
    "Config(BLOCK_N=16, BLOCK_K=32, BLOCK_Dp=32, num_warps=2, num_stages=2, parallel_k=1, div_k=False, div_d=True, div_dp=True, acc_dtype='fp16', dtype='fp16', sm=89).ptx": {
        "config": {
            "BLOCK_N": 16,
            "BLOCK_K": 32,
            "BLOCK_Dp": 32,
            "num_warps": 2,
            "num_stages": 2,
            "parallel_k": 1,
            "div_k": false,
            "div_d": true,
            "div_dp": true,
            "acc_dtype": "fp16",
            "dtype": "fp16",
            "sm": 89
        },
        "meta": {
            "shared": 3072,
            "num_warps": 2,
            "num_stages": 2,
            "global_scratch_size": 0
        }
    },
    "Config(BLOCK_N=128, BLOCK_K=32, BLOCK_Dp=32, num_warps=4, num_stages=2, parallel_k=1, div_k=False, div_d=True, div_dp=True, acc_dtype='fp16', dtype='fp16', sm=86).ptx": {
        "config": {
            "BLOCK_N": 128,
            "BLOCK_K": 32,
            "BLOCK_Dp": 32,
            "num_warps": 4,
            "num_stages": 2,
            "parallel_k": 1,
            "div_k": false,
            "div_d": true,
            "div_dp": true,
            "acc_dtype": "fp16",
            "dtype": "fp16",
            "sm": 86
        },
        "meta": {
            "shared": 10240,
            "num_warps": 4,
            "num_stages": 2,
            "global_scratch_size": 0
        }
    },
    "Config(BLOCK_N=16, BLOCK_K=16, BLOCK_Dp=16, num_warps=2, num_stages=2, parallel_k=1, div_k=False, div_d=True, div_dp=True, acc_dtype='fp16', dtype='fp16', sm=86).ptx": {
        "config": {
            "BLOCK_N": 16,
            "BLOCK_K": 16,
            "BLOCK_Dp": 16,
            "num_warps": 2,
            "num_stages": 2,
            "parallel_k": 1,
            "div_k": false,
            "div_d": true,
            "div_dp": true,
            "acc_dtype": "fp16",
            "dtype": "fp16",
            "sm": 86
        },
        "meta": {
            "shared": 1024,
            "num_warps": 2,
            "num_stages": 2,
            "global_scratch_size": 0
        }
    },
    "Config(BLOCK_N=128, BLOCK_K=32, BLOCK_Dp=32, num_warps=4, num_stages=2, parallel_k=1, div_k=False, div_d=True, div_dp=True, acc_dtype='fp16', dtype='fp16', sm=89).ptx": {
        "config": {
            "BLOCK_N": 128,
            "BLOCK_K": 32,
            "BLOCK_Dp": 32,
            "num_warps": 4,
            "num_stages": 2,
            "parallel_k": 1,
            "div_k": false,
            "div_d": true,
            "div_dp": true,
            "acc_dtype": "fp16",
            "dtype": "fp16",
            "sm": 89
        },
        "meta": {
            "shared": 10240,
            "num_warps": 4,
            "num_stages": 2,
            "global_scratch_size": 0
        }
    },
    "Config(BLOCK_N=16, BLOCK_K=16, BLOCK_Dp=16, num_warps=2, num_stages=2, parallel_k=1, div_k=False, div_d=True, div_dp=True, acc_dtype='fp16', dtype='fp16', sm=89).ptx": {
        "config": {
            "BLOCK_N": 16,
            "BLOCK_K": 16,
            "BLOCK_Dp": 16,
            "num_warps": 2,
            "num_stages": 2,
            "parallel_k": 1,
            "div_k": false,
            "div_d": true,
            "div_dp": true,
            "acc_dtype": "fp16",
            "dtype": "fp16",
            "sm": 89
        },
        "meta": {
            "shared": 1024,
            "num_warps": 2,
            "num_stages": 2,
            "global_scratch_size": 0
        }
    },
    "Config(BLOCK_N=32, BLOCK_K=16, BLOCK_Dp=32, num_warps=2, num_stages=2, parallel_k=1, div_k=False, div_d=True, div_dp=True, acc_dtype='fp32', dtype='fp32', sm=86).ptx": {
        "config": {
            "BLOCK_N": 32,
            "BLOCK_K": 16,
            "BLOCK_Dp": 32,
            "num_warps": 2,
            "num_stages": 2,
            "parallel_k": 1,
            "div_k": false,
            "div_d": true,
            "div_dp": true,
            "acc_dtype": "fp32",
            "dtype": "fp32",
            "sm": 86
        },
        "meta": {
            "shared": 4096,
            "num_warps": 2,
            "num_stages": 2,
            "global_scratch_size": 0
        }
    },
    "Config(BLOCK_N=32, BLOCK_K=16, BLOCK_Dp=32, num_warps=2, num_stages=2, parallel_k=1, div_k=False, div_d=True, div_dp=True, acc_dtype='fp32', dtype='fp32', sm=89).ptx": {
        "config": {
            "BLOCK_N": 32,
            "BLOCK_K": 16,
            "BLOCK_Dp": 32,
            "num_warps": 2,
            "num_stages": 2,
            "parallel_k": 1,
            "div_k": false,
            "div_d": true,
            "div_dp": true,
            "acc_dtype": "fp32",
            "dtype": "fp32",
            "sm": 89
        },
        "meta": {
            "shared": 4096,
            "num_warps": 2,
            "num_stages": 2,
            "global_scratch_size": 0
        }
    },
    "Config(BLOCK_N=32, BLOCK_K=16, BLOCK_Dp=32, num_warps=2, num_stages=2, parallel_k=1, div_k=False, div_d=False, div_dp=False, acc_dtype='fp16', dtype='fp16', sm=89).ptx": {
        "config": {
            "BLOCK_N": 32,
            "BLOCK_K": 16,
            "BLOCK_Dp": 32,
            "num_warps": 2,
            "num_stages": 2,
            "parallel_k": 1,
            "div_k": false,
            "div_d": false,
            "div_dp": false,
            "acc_dtype": "fp16",
            "dtype": "fp16",
            "sm": 89
        },
        "meta": {
            "shared": 2048,
            "num_warps": 2,
            "num_stages": 2,
            "global_scratch_size": 0
        }
    },
    "Config(BLOCK_N=16, BLOCK_K=32, BLOCK_Dp=64, num_warps=4, num_stages=2, parallel_k=1, div_k=False, div_d=False, div_dp=False, acc_dtype='fp32', dtype='fp32', sm=86).ptx": {
        "config": {
            "BLOCK_N": 16,
            "BLOCK_K": 32,
            "BLOCK_Dp": 64,
            "num_warps": 4,
            "num_stages": 2,
            "parallel_k": 1,
            "div_k": false,
            "div_d": false,
            "div_dp": false,
            "acc_dtype": "fp32",
            "dtype": "fp32",
            "sm": 86
        },
        "meta": {
            "shared": 10240,
            "num_warps": 4,
            "num_stages": 2,
            "global_scratch_size": 0
        }
    },
    "Config(BLOCK_N=128, BLOCK_K=32, BLOCK_Dp=32, num_warps=4, num_stages=2, parallel_k=1, div_k=False, div_d=False, div_dp=False, acc_dtype='fp32', dtype='fp32', sm=86).ptx": {
        "config": {
            "BLOCK_N": 128,
            "BLOCK_K": 32,
            "BLOCK_Dp": 32,
            "num_warps": 4,
            "num_stages": 2,
            "parallel_k": 1,
            "div_k": false,
            "div_d": false,
            "div_dp": false,
            "acc_dtype": "fp32",
            "dtype": "fp32",
            "sm": 86
        },
        "meta": {
            "shared": 20480,
            "num_warps": 4,
            "num_stages": 2,
            "global_scratch_size": 0
        }
    },
    "Config(BLOCK_N=16, BLOCK_K=32, BLOCK_Dp=64, num_warps=4, num_stages=2, parallel_k=1, div_k=False, div_d=False, div_dp=False, acc_dtype='fp32', dtype='fp32', sm=89).ptx": {
        "config": {
            "BLOCK_N": 16,
            "BLOCK_K": 32,
            "BLOCK_Dp": 64,
            "num_warps": 4,
            "num_stages": 2,
            "parallel_k": 1,
            "div_k": false,
            "div_d": false,
            "div_dp": false,
            "acc_dtype": "fp32",
            "dtype": "fp32",
            "sm": 89
        },
        "meta": {
            "shared": 10240,
            "num_warps": 4,
            "num_stages": 2,
            "global_scratch_size": 0
        }
    },
    "Config(BLOCK_N=128, BLOCK_K=32, BLOCK_Dp=32, num_warps=4, num_stages=2, parallel_k=1, div_k=False, div_d=False, div_dp=False, acc_dtype='fp32', dtype='fp32', sm=89).ptx": {
        "config": {
            "BLOCK_N": 128,
            "BLOCK_K": 32,
            "BLOCK_Dp": 32,
            "num_warps": 4,
            "num_stages": 2,
            "parallel_k": 1,
            "div_k": false,
            "div_d": false,
            "div_dp": false,
            "acc_dtype": "fp32",
            "dtype": "fp32",
            "sm": 89
        },
        "meta": {
            "shared": 20480,
            "num_warps": 4,
            "num_stages": 2,
            "global_scratch_size": 0
        }
    },
    "Config(BLOCK_N=128, BLOCK_K=32, BLOCK_Dp=32, num_warps=4, num_stages=2, parallel_k=1, div_k=False, div_d=False, div_dp=False, acc_dtype='fp32', dtype='fp16', sm=89).ptx": {
        "config": {
            "BLOCK_N": 128,
            "BLOCK_K": 32,
            "BLOCK_Dp": 32,
            "num_warps": 4,
            "num_stages": 2,
            "parallel_k": 1,
            "div_k": false,
            "div_d": false,
            "div_dp": false,
            "acc_dtype": "fp32",
            "dtype": "fp16",
            "sm": 89
        },
        "meta": {
            "shared": 10240,
            "num_warps": 4,
            "num_stages": 2,
            "global_scratch_size": 0
        }
    },
    "Config(BLOCK_N=16, BLOCK_K=32, BLOCK_Dp=64, num_warps=2, num_stages=2, parallel_k=1, div_k=False, div_d=False, div_dp=False, acc_dtype='fp16', dtype='fp16', sm=89).ptx": {
        "config": {
            "BLOCK_N": 16,
            "BLOCK_K": 32,
            "BLOCK_Dp": 64,
            "num_warps": 2,
            "num_stages": 2,
            "parallel_k": 1,
            "div_k": false,
            "div_d": false,
            "div_dp": false,
            "acc_dtype": "fp16",
            "dtype": "fp16",
            "sm": 89
        },
        "meta": {
            "shared": 5120,
            "num_warps": 2,
            "num_stages": 2,
            "global_scratch_size": 0
        }
    },
    "Config(BLOCK_N=32, BLOCK_K=16, BLOCK_Dp=16, num_warps=2, num_stages=2, parallel_k=1, div_k=False, div_d=False, div_dp=False, acc_dtype='fp16', dtype='fp16', sm=86).ptx": {
        "config": {
            "BLOCK_N": 32,
            "BLOCK_K": 16,
            "BLOCK_Dp": 16,
            "num_warps": 2,
            "num_stages": 2,
            "parallel_k": 1,
            "div_k": false,
            "div_d": false,
            "div_dp": false,
            "acc_dtype": "fp16",
            "dtype": "fp16",
            "sm": 86
        },
        "meta": {
            "shared": 1536,
            "num_warps": 2,
            "num_stages": 2,
            "global_scratch_size": 0
        }
    },
    "Config(BLOCK_N=32, BLOCK_K=16, BLOCK_Dp=16, num_warps=2, num_stages=2, parallel_k=1, div_k=False, div_d=False, div_dp=False, acc_dtype='fp16', dtype='fp16', sm=89).ptx": {
        "config": {
            "BLOCK_N": 32,
            "BLOCK_K": 16,
            "BLOCK_Dp": 16,
            "num_warps": 2,
            "num_stages": 2,
            "parallel_k": 1,
            "div_k": false,
            "div_d": false,
            "div_dp": false,
            "acc_dtype": "fp16",
            "dtype": "fp16",
            "sm": 89
        },
        "meta": {
            "shared": 1536,
            "num_warps": 2,
            "num_stages": 2,
            "global_scratch_size": 0
        }
    },
    "Config(BLOCK_N=16, BLOCK_K=64, BLOCK_Dp=64, num_warps=4, num_stages=2, parallel_k=1, div_k=False, div_d=False, div_dp=False, acc_dtype='fp16', dtype='fp16', sm=86).ptx": {
        "config": {
            "BLOCK_N": 16,
            "BLOCK_K": 64,
            "BLOCK_Dp": 64,
            "num_warps": 4,
            "num_stages": 2,
            "parallel_k": 1,
            "div_k": false,
            "div_d": false,
            "div_dp": false,
            "acc_dtype": "fp16",
            "dtype": "fp16",
            "sm": 86
        },
        "meta": {
            "shared": 10240,
            "num_warps": 4,
            "num_stages": 2,
            "global_scratch_size": 0
        }
    },
    "Config(BLOCK_N=16, BLOCK_K=64, BLOCK_Dp=64, num_warps=4, num_stages=2, parallel_k=1, div_k=False, div_d=False, div_dp=False, acc_dtype='fp16', dtype='fp16', sm=89).ptx": {
        "config": {
            "BLOCK_N": 16,
            "BLOCK_K": 64,
            "BLOCK_Dp": 64,
            "num_warps": 4,
            "num_stages": 2,
            "parallel_k": 1,
            "div_k": false,
            "div_d": false,
            "div_dp": false,
            "acc_dtype": "fp16",
            "dtype": "fp16",
            "sm": 89
        },
        "meta": {
            "shared": 10240,
            "num_warps": 4,
            "num_stages": 2,
            "global_scratch_size": 0
        }
    },
    "Config(BLOCK_N=16, BLOCK_K=32, BLOCK_Dp=32, num_warps=2, num_stages=2, parallel_k=1, div_k=False, div_d=False, div_dp=False, acc_dtype='fp16', dtype='fp16', sm=86).ptx": {
        "config": {
            "BLOCK_N": 16,
            "BLOCK_K": 32,
            "BLOCK_Dp": 32,
            "num_warps": 2,
            "num_stages": 2,
            "parallel_k": 1,
            "div_k": false,
            "div_d": false,
            "div_dp": false,
            "acc_dtype": "fp16",
            "dtype": "fp16",
            "sm": 86
        },
        "meta": {
            "shared": 3072,
            "num_warps": 2,
            "num_stages": 2,
            "global_scratch_size": 0
        }
    },
    "Config(BLOCK_N=16, BLOCK_K=16, BLOCK_Dp=16, num_warps=2, num_stages=2, parallel_k=1, div_k=False, div_d=False, div_dp=False, acc_dtype='fp32', dtype='fp16', sm=89).ptx": {
        "config": {
            "BLOCK_N": 16,
            "BLOCK_K": 16,
            "BLOCK_Dp": 16,
            "num_warps": 2,
            "num_stages": 2,
            "parallel_k": 1,
            "div_k": false,
            "div_d": false,
            "div_dp": false,
            "acc_dtype": "fp32",
            "dtype": "fp16",
            "sm": 89
        },
        "meta": {
            "shared": 1024,
            "num_warps": 2,
            "num_stages": 2,
            "global_scratch_size": 0
        }
    },
    "Config(BLOCK_N=16, BLOCK_K=16, BLOCK_Dp=16, num_warps=2, num_stages=2, parallel_k=1, div_k=False, div_d=False, div_dp=False, acc_dtype='fp32', dtype='fp16', sm=86).ptx": {
        "config": {
            "BLOCK_N": 16,
            "BLOCK_K": 16,
            "BLOCK_Dp": 16,
            "num_warps": 2,
            "num_stages": 2,
            "parallel_k": 1,
            "div_k": false,
            "div_d": false,
            "div_dp": false,
            "acc_dtype": "fp32",
            "dtype": "fp16",
            "sm": 86
        },
        "meta": {
            "shared": 1024,
            "num_warps": 2,
            "num_stages": 2,
            "global_scratch_size": 0
        }
    },
    "Config(BLOCK_N=16, BLOCK_K=32, BLOCK_Dp=32, num_warps=2, num_stages=2, parallel_k=1, div_k=False, div_d=False, div_dp=False, acc_dtype='fp16', dtype='fp16', sm=89).ptx": {
        "config": {
            "BLOCK_N": 16,
            "BLOCK_K": 32,
            "BLOCK_Dp": 32,
            "num_warps": 2,
            "num_stages": 2,
            "parallel_k": 1,
            "div_k": false,
            "div_d": false,
            "div_dp": false,
            "acc_dtype": "fp16",
            "dtype": "fp16",
            "sm": 89
        },
        "meta": {
            "shared": 3072,
            "num_warps": 2,
            "num_stages": 2,
            "global_scratch_size": 0
        }
    },
    "Config(BLOCK_N=16, BLOCK_K=32, BLOCK_Dp=32, num_warps=2, num_stages=2, parallel_k=1, div_k=False, div_d=False, div_dp=False, acc_dtype='fp32', dtype='fp32', sm=89).ptx": {
        "config": {
            "BLOCK_N": 16,
            "BLOCK_K": 32,
            "BLOCK_Dp": 32,
            "num_warps": 2,
            "num_stages": 2,
            "parallel_k": 1,
            "div_k": false,
            "div_d": false,
            "div_dp": false,
            "acc_dtype": "fp32",
            "dtype": "fp32",
            "sm": 89
        },
        "meta": {
            "shared": 6144,
            "num_warps": 2,
            "num_stages": 2,
            "global_scratch_size": 0
        }
    },
    "Config(BLOCK_N=16, BLOCK_K=32, BLOCK_Dp=64, num_warps=2, num_stages=2, parallel_k=1, div_k=False, div_d=False, div_dp=False, acc_dtype='fp32', dtype='fp32', sm=89).ptx": {
        "config": {
            "BLOCK_N": 16,
            "BLOCK_K": 32,
            "BLOCK_Dp": 64,
            "num_warps": 2,
            "num_stages": 2,
            "parallel_k": 1,
            "div_k": false,
            "div_d": false,
            "div_dp": false,
            "acc_dtype": "fp32",
            "dtype": "fp32",
            "sm": 89
        },
        "meta": {
            "shared": 10240,
            "num_warps": 2,
            "num_stages": 2,
            "global_scratch_size": 0
        }
    },
    "Config(BLOCK_N=16, BLOCK_K=32, BLOCK_Dp=32, num_warps=2, num_stages=2, parallel_k=1, div_k=False, div_d=False, div_dp=False, acc_dtype='fp32', dtype='fp32', sm=86).ptx": {
        "config": {
            "BLOCK_N": 16,
            "BLOCK_K": 32,
            "BLOCK_Dp": 32,
            "num_warps": 2,
            "num_stages": 2,
            "parallel_k": 1,
            "div_k": false,
            "div_d": false,
            "div_dp": false,
            "acc_dtype": "fp32",
            "dtype": "fp32",
            "sm": 86
        },
        "meta": {
            "shared": 6144,
            "num_warps": 2,
            "num_stages": 2,
            "global_scratch_size": 0
        }
    },
    "Config(BLOCK_N=16, BLOCK_K=16, BLOCK_Dp=16, num_warps=2, num_stages=2, parallel_k=1, div_k=False, div_d=False, div_dp=False, acc_dtype='fp32', dtype='fp32', sm=86).ptx": {
        "config": {
            "BLOCK_N": 16,
            "BLOCK_K": 16,
            "BLOCK_Dp": 16,
            "num_warps": 2,
            "num_stages": 2,
            "parallel_k": 1,
            "div_k": false,
            "div_d": false,
            "div_dp": false,
            "acc_dtype": "fp32",
            "dtype": "fp32",
            "sm": 86
        },
        "meta": {
            "shared": 2048,
            "num_warps": 2,
            "num_stages": 2,
            "global_scratch_size": 0
        }
    },
    "Config(BLOCK_N=32, BLOCK_K=32, BLOCK_Dp=16, num_warps=2, num_stages=2, parallel_k=1, div_k=False, div_d=False, div_dp=False, acc_dtype='fp32', dtype='fp16', sm=86).ptx": {
        "config": {
            "BLOCK_N": 32,
            "BLOCK_K": 32,
            "BLOCK_Dp": 16,
            "num_warps": 2,
            "num_stages": 2,
            "parallel_k": 1,
            "div_k": false,
            "div_d": false,
            "div_dp": false,
            "acc_dtype": "fp32",
            "dtype": "fp16",
            "sm": 86
        },
        "meta": {
            "shared": 3072,
            "num_warps": 2,
            "num_stages": 2,
            "global_scratch_size": 0
        }
    },
    "Config(BLOCK_N=16, BLOCK_K=32, BLOCK_Dp=64, num_warps=2, num_stages=2, parallel_k=1, div_k=False, div_d=False, div_dp=False, acc_dtype='fp32', dtype='fp16', sm=86).ptx": {
        "config": {
            "BLOCK_N": 16,
            "BLOCK_K": 32,
            "BLOCK_Dp": 64,
            "num_warps": 2,
            "num_stages": 2,
            "parallel_k": 1,
            "div_k": false,
            "div_d": false,
            "div_dp": false,
            "acc_dtype": "fp32",
            "dtype": "fp16",
            "sm": 86
        },
        "meta": {
            "shared": 5120,
            "num_warps": 2,
            "num_stages": 2,
            "global_scratch_size": 0
        }
    },
    "Config(BLOCK_N=16, BLOCK_K=32, BLOCK_Dp=32, num_warps=2, num_stages=2, parallel_k=1, div_k=False, div_d=False, div_dp=False, acc_dtype='fp32', dtype='fp16', sm=86).ptx": {
        "config": {
            "BLOCK_N": 16,
            "BLOCK_K": 32,
            "BLOCK_Dp": 32,
            "num_warps": 2,
            "num_stages": 2,
            "parallel_k": 1,
            "div_k": false,
            "div_d": false,
            "div_dp": false,
            "acc_dtype": "fp32",
            "dtype": "fp16",
            "sm": 86
        },
        "meta": {
            "shared": 3072,
            "num_warps": 2,
            "num_stages": 2,
            "global_scratch_size": 0
        }
    },
    "Config(BLOCK_N=16, BLOCK_K=16, BLOCK_Dp=16, num_warps=2, num_stages=2, parallel_k=1, div_k=False, div_d=False, div_dp=False, acc_dtype='fp32', dtype='fp32', sm=89).ptx": {
        "config": {
            "BLOCK_N": 16,
            "BLOCK_K": 16,
            "BLOCK_Dp": 16,
            "num_warps": 2,
            "num_stages": 2,
            "parallel_k": 1,
            "div_k": false,
            "div_d": false,
            "div_dp": false,
            "acc_dtype": "fp32",
            "dtype": "fp32",
            "sm": 89
        },
        "meta": {
            "shared": 2048,
            "num_warps": 2,
            "num_stages": 2,
            "global_scratch_size": 0
        }
    },
    "Config(BLOCK_N=32, BLOCK_K=16, BLOCK_Dp=32, num_warps=2, num_stages=2, parallel_k=1, div_k=False, div_d=False, div_dp=False, acc_dtype='fp32', dtype='fp32', sm=86).ptx": {
        "config": {
            "BLOCK_N": 32,
            "BLOCK_K": 16,
            "BLOCK_Dp": 32,
            "num_warps": 2,
            "num_stages": 2,
            "parallel_k": 1,
            "div_k": false,
            "div_d": false,
            "div_dp": false,
            "acc_dtype": "fp32",
            "dtype": "fp32",
            "sm": 86
        },
        "meta": {
            "shared": 4096,
            "num_warps": 2,
            "num_stages": 2,
            "global_scratch_size": 0
        }
    },
    "Config(BLOCK_N=16, BLOCK_K=64, BLOCK_Dp=64, num_warps=4, num_stages=2, parallel_k=1, div_k=False, div_d=False, div_dp=False, acc_dtype='fp32', dtype='fp32', sm=89).ptx": {
        "config": {
            "BLOCK_N": 16,
            "BLOCK_K": 64,
            "BLOCK_Dp": 64,
            "num_warps": 4,
            "num_stages": 2,
            "parallel_k": 1,
            "div_k": false,
            "div_d": false,
            "div_dp": false,
            "acc_dtype": "fp32",
            "dtype": "fp32",
            "sm": 89
        },
        "meta": {
            "shared": 20480,
            "num_warps": 4,
            "num_stages": 2,
            "global_scratch_size": 0
        }
    },
    "Config(BLOCK_N=16, BLOCK_K=32, BLOCK_Dp=32, num_warps=2, num_stages=2, parallel_k=1, div_k=False, div_d=False, div_dp=False, acc_dtype='fp32', dtype='fp16', sm=89).ptx": {
        "config": {
            "BLOCK_N": 16,
            "BLOCK_K": 32,
            "BLOCK_Dp": 32,
            "num_warps": 2,
            "num_stages": 2,
            "parallel_k": 1,
            "div_k": false,
            "div_d": false,
            "div_dp": false,
            "acc_dtype": "fp32",
            "dtype": "fp16",
            "sm": 89
        },
        "meta": {
            "shared": 3072,
            "num_warps": 2,
            "num_stages": 2,
            "global_scratch_size": 0
        }
    },
    "Config(BLOCK_N=32, BLOCK_K=16, BLOCK_Dp=32, num_warps=2, num_stages=2, parallel_k=1, div_k=False, div_d=False, div_dp=False, acc_dtype='fp32', dtype='fp16', sm=86).ptx": {
        "config": {
            "BLOCK_N": 32,
            "BLOCK_K": 16,
            "BLOCK_Dp": 32,
            "num_warps": 2,
            "num_stages": 2,
            "parallel_k": 1,
            "div_k": false,
            "div_d": false,
            "div_dp": false,
            "acc_dtype": "fp32",
            "dtype": "fp16",
            "sm": 86
        },
        "meta": {
            "shared": 2048,
            "num_warps": 2,
            "num_stages": 2,
            "global_scratch_size": 0
        }
    },
    "Config(BLOCK_N=16, BLOCK_K=64, BLOCK_Dp=64, num_warps=4, num_stages=2, parallel_k=1, div_k=False, div_d=False, div_dp=False, acc_dtype='fp32', dtype='fp16', sm=86).ptx": {
        "config": {
            "BLOCK_N": 16,
            "BLOCK_K": 64,
            "BLOCK_Dp": 64,
            "num_warps": 4,
            "num_stages": 2,
            "parallel_k": 1,
            "div_k": false,
            "div_d": false,
            "div_dp": false,
            "acc_dtype": "fp32",
            "dtype": "fp16",
            "sm": 86
        },
        "meta": {
            "shared": 10240,
            "num_warps": 4,
            "num_stages": 2,
            "global_scratch_size": 0
        }
    },
    "Config(BLOCK_N=16, BLOCK_K=32, BLOCK_Dp=64, num_warps=2, num_stages=2, parallel_k=1, div_k=False, div_d=False, div_dp=False, acc_dtype='fp32', dtype='fp16', sm=89).ptx": {
        "config": {
            "BLOCK_N": 16,
            "BLOCK_K": 32,
            "BLOCK_Dp": 64,
            "num_warps": 2,
            "num_stages": 2,
            "parallel_k": 1,
            "div_k": false,
            "div_d": false,
            "div_dp": false,
            "acc_dtype": "fp32",
            "dtype": "fp16",
            "sm": 89
        },
        "meta": {
            "shared": 5120,
            "num_warps": 2,
            "num_stages": 2,
            "global_scratch_size": 0
        }
    },
    "Config(BLOCK_N=32, BLOCK_K=16, BLOCK_Dp=32, num_warps=2, num_stages=2, parallel_k=1, div_k=False, div_d=False, div_dp=False, acc_dtype='fp32', dtype='fp32', sm=89).ptx": {
        "config": {
            "BLOCK_N": 32,
            "BLOCK_K": 16,
            "BLOCK_Dp": 32,
            "num_warps": 2,
            "num_stages": 2,
            "parallel_k": 1,
            "div_k": false,
            "div_d": false,
            "div_dp": false,
            "acc_dtype": "fp32",
            "dtype": "fp32",
            "sm": 89
        },
        "meta": {
            "shared": 4096,
            "num_warps": 2,
            "num_stages": 2,
            "global_scratch_size": 0
        }
    },
    "Config(BLOCK_N=32, BLOCK_K=16, BLOCK_Dp=32, num_warps=2, num_stages=2, parallel_k=1, div_k=False, div_d=False, div_dp=False, acc_dtype='fp32', dtype='fp16', sm=89).ptx": {
        "config": {
            "BLOCK_N": 32,
            "BLOCK_K": 16,
            "BLOCK_Dp": 32,
            "num_warps": 2,
            "num_stages": 2,
            "parallel_k": 1,
            "div_k": false,
            "div_d": false,
            "div_dp": false,
            "acc_dtype": "fp32",
            "dtype": "fp16",
            "sm": 89
        },
        "meta": {
            "shared": 2048,
            "num_warps": 2,
            "num_stages": 2,
            "global_scratch_size": 0
        }
    },
    "Config(BLOCK_N=16, BLOCK_K=64, BLOCK_Dp=64, num_warps=4, num_stages=2, parallel_k=1, div_k=False, div_d=False, div_dp=False, acc_dtype='fp32', dtype='fp16', sm=89).ptx": {
        "config": {
            "BLOCK_N": 16,
            "BLOCK_K": 64,
            "BLOCK_Dp": 64,
            "num_warps": 4,
            "num_stages": 2,
            "parallel_k": 1,
            "div_k": false,
            "div_d": false,
            "div_dp": false,
            "acc_dtype": "fp32",
            "dtype": "fp16",
            "sm": 89
        },
        "meta": {
            "shared": 10240,
            "num_warps": 4,
            "num_stages": 2,
            "global_scratch_size": 0
        }
    },
    "Config(BLOCK_N=16, BLOCK_K=32, BLOCK_Dp=128, num_warps=4, num_stages=2, parallel_k=1, div_k=False, div_d=False, div_dp=False, acc_dtype='fp16', dtype='fp16', sm=89).ptx": {
        "config": {
            "BLOCK_N": 16,
            "BLOCK_K": 32,
            "BLOCK_Dp": 128,
            "num_warps": 4,
            "num_stages": 2,
            "parallel_k": 1,
            "div_k": false,
            "div_d": false,
            "div_dp": false,
            "acc_dtype": "fp16",
            "dtype": "fp16",
            "sm": 89
        },
        "meta": {
            "shared": 9216,
            "num_warps": 4,
            "num_stages": 2,
            "global_scratch_size": 0
        }
    },
    "Config(BLOCK_N=32, BLOCK_K=32, BLOCK_Dp=16, num_warps=2, num_stages=2, parallel_k=1, div_k=False, div_d=False, div_dp=False, acc_dtype='fp32', dtype='fp32', sm=86).ptx": {
        "config": {
            "BLOCK_N": 32,
            "BLOCK_K": 32,
            "BLOCK_Dp": 16,
            "num_warps": 2,
            "num_stages": 2,
            "parallel_k": 1,
            "div_k": false,
            "div_d": false,
            "div_dp": false,
            "acc_dtype": "fp32",
            "dtype": "fp32",
            "sm": 86
        },
        "meta": {
            "shared": 6144,
            "num_warps": 2,
            "num_stages": 2,
            "global_scratch_size": 0
        }
    },
    "Config(BLOCK_N=128, BLOCK_K=32, BLOCK_Dp=32, num_warps=8, num_stages=2, parallel_k=1, div_k=False, div_d=False, div_dp=False, acc_dtype='fp32', dtype='fp32', sm=89).ptx": {
        "config": {
            "BLOCK_N": 128,
            "BLOCK_K": 32,
            "BLOCK_Dp": 32,
            "num_warps": 8,
            "num_stages": 2,
            "parallel_k": 1,
            "div_k": false,
            "div_d": false,
            "div_dp": false,
            "acc_dtype": "fp32",
            "dtype": "fp32",
            "sm": 89
        },
        "meta": {
            "shared": 20480,
            "num_warps": 8,
            "num_stages": 2,
            "global_scratch_size": 0
        }
    },
    "Config(BLOCK_N=16, BLOCK_K=16, BLOCK_Dp=16, num_warps=2, num_stages=2, parallel_k=1, div_k=False, div_d=False, div_dp=False, acc_dtype='fp16', dtype='fp16', sm=86).ptx": {
        "config": {
            "BLOCK_N": 16,
            "BLOCK_K": 16,
            "BLOCK_Dp": 16,
            "num_warps": 2,
            "num_stages": 2,
            "parallel_k": 1,
            "div_k": false,
            "div_d": false,
            "div_dp": false,
            "acc_dtype": "fp16",
            "dtype": "fp16",
            "sm": 86
        },
        "meta": {
            "shared": 1024,
            "num_warps": 2,
            "num_stages": 2,
            "global_scratch_size": 0
        }
    },
    "Config(BLOCK_N=32, BLOCK_K=16, BLOCK_Dp=16, num_warps=2, num_stages=2, parallel_k=1, div_k=False, div_d=False, div_dp=False, acc_dtype='fp32', dtype='fp32', sm=89).ptx": {
        "config": {
            "BLOCK_N": 32,
            "BLOCK_K": 16,
            "BLOCK_Dp": 16,
            "num_warps": 2,
            "num_stages": 2,
            "parallel_k": 1,
            "div_k": false,
            "div_d": false,
            "div_dp": false,
            "acc_dtype": "fp32",
            "dtype": "fp32",
            "sm": 89
        },
        "meta": {
            "shared": 3072,
            "num_warps": 2,
            "num_stages": 2,
            "global_scratch_size": 0
        }
    },
    "Config(BLOCK_N=16, BLOCK_K=16, BLOCK_Dp=16, num_warps=2, num_stages=2, parallel_k=1, div_k=False, div_d=False, div_dp=False, acc_dtype='fp16', dtype='fp16', sm=89).ptx": {
        "config": {
            "BLOCK_N": 16,
            "BLOCK_K": 16,
            "BLOCK_Dp": 16,
            "num_warps": 2,
            "num_stages": 2,
            "parallel_k": 1,
            "div_k": false,
            "div_d": false,
            "div_dp": false,
            "acc_dtype": "fp16",
            "dtype": "fp16",
            "sm": 89
        },
        "meta": {
            "shared": 1024,
            "num_warps": 2,
            "num_stages": 2,
            "global_scratch_size": 0
        }
    },
    "Config(BLOCK_N=16, BLOCK_K=32, BLOCK_Dp=128, num_warps=4, num_stages=2, parallel_k=1, div_k=False, div_d=False, div_dp=False, acc_dtype='fp32', dtype='fp16', sm=86).ptx": {
        "config": {
            "BLOCK_N": 16,
            "BLOCK_K": 32,
            "BLOCK_Dp": 128,
            "num_warps": 4,
            "num_stages": 2,
            "parallel_k": 1,
            "div_k": false,
            "div_d": false,
            "div_dp": false,
            "acc_dtype": "fp32",
            "dtype": "fp16",
            "sm": 86
        },
        "meta": {
            "shared": 9216,
            "num_warps": 4,
            "num_stages": 2,
            "global_scratch_size": 0
        }
    },
    "Config(BLOCK_N=16, BLOCK_K=32, BLOCK_Dp=128, num_warps=4, num_stages=2, parallel_k=1, div_k=False, div_d=False, div_dp=False, acc_dtype='fp32', dtype='fp16', sm=89).ptx": {
        "config": {
            "BLOCK_N": 16,
            "BLOCK_K": 32,
            "BLOCK_Dp": 128,
            "num_warps": 4,
            "num_stages": 2,
            "parallel_k": 1,
            "div_k": false,
            "div_d": false,
            "div_dp": false,
            "acc_dtype": "fp32",
            "dtype": "fp16",
            "sm": 89
        },
        "meta": {
            "shared": 9216,
            "num_warps": 4,
            "num_stages": 2,
            "global_scratch_size": 0
        }
    },
    "Config(BLOCK_N=32, BLOCK_K=16, BLOCK_Dp=16, num_warps=2, num_stages=2, parallel_k=1, div_k=False, div_d=False, div_dp=False, acc_dtype='fp32', dtype='fp16', sm=86).ptx": {
        "config": {
            "BLOCK_N": 32,
            "BLOCK_K": 16,
            "BLOCK_Dp": 16,
            "num_warps": 2,
            "num_stages": 2,
            "parallel_k": 1,
            "div_k": false,
            "div_d": false,
            "div_dp": false,
            "acc_dtype": "fp32",
            "dtype": "fp16",
            "sm": 86
        },
        "meta": {
            "shared": 1536,
            "num_warps": 2,
            "num_stages": 2,
            "global_scratch_size": 0
        }
    },
    "Config(BLOCK_N=32, BLOCK_K=16, BLOCK_Dp=16, num_warps=2, num_stages=2, parallel_k=1, div_k=False, div_d=False, div_dp=False, acc_dtype='fp32', dtype='fp16', sm=89).ptx": {
        "config": {
            "BLOCK_N": 32,
            "BLOCK_K": 16,
            "BLOCK_Dp": 16,
            "num_warps": 2,
            "num_stages": 2,
            "parallel_k": 1,
            "div_k": false,
            "div_d": false,
            "div_dp": false,
            "acc_dtype": "fp32",
            "dtype": "fp16",
            "sm": 89
        },
        "meta": {
            "shared": 1536,
            "num_warps": 2,
            "num_stages": 2,
            "global_scratch_size": 0
        }
    },
    "Config(BLOCK_N=128, BLOCK_K=32, BLOCK_Dp=32, num_warps=4, num_stages=2, parallel_k=1, div_k=False, div_d=False, div_dp=False, acc_dtype='fp16', dtype='fp16', sm=86).ptx": {
        "config": {
            "BLOCK_N": 128,
            "BLOCK_K": 32,
            "BLOCK_Dp": 32,
            "num_warps": 4,
            "num_stages": 2,
            "parallel_k": 1,
            "div_k": false,
            "div_d": false,
            "div_dp": false,
            "acc_dtype": "fp16",
            "dtype": "fp16",
            "sm": 86
        },
        "meta": {
            "shared": 10240,
            "num_warps": 4,
            "num_stages": 2,
            "global_scratch_size": 0
        }
    },
    "Config(BLOCK_N=16, BLOCK_K=32, BLOCK_Dp=64, num_warps=4, num_stages=2, parallel_k=1, div_k=False, div_d=False, div_dp=False, acc_dtype='fp16', dtype='fp16', sm=89).ptx": {
        "config": {
            "BLOCK_N": 16,
            "BLOCK_K": 32,
            "BLOCK_Dp": 64,
            "num_warps": 4,
            "num_stages": 2,
            "parallel_k": 1,
            "div_k": false,
            "div_d": false,
            "div_dp": false,
            "acc_dtype": "fp16",
            "dtype": "fp16",
            "sm": 89
        },
        "meta": {
            "shared": 5120,
            "num_warps": 4,
            "num_stages": 2,
            "global_scratch_size": 0
        }
    },
    "Config(BLOCK_N=128, BLOCK_K=32, BLOCK_Dp=32, num_warps=4, num_stages=2, parallel_k=1, div_k=False, div_d=False, div_dp=False, acc_dtype='fp16', dtype='fp16', sm=89).ptx": {
        "config": {
            "BLOCK_N": 128,
            "BLOCK_K": 32,
            "BLOCK_Dp": 32,
            "num_warps": 4,
            "num_stages": 2,
            "parallel_k": 1,
            "div_k": false,
            "div_d": false,
            "div_dp": false,
            "acc_dtype": "fp16",
            "dtype": "fp16",
            "sm": 89
        },
        "meta": {
            "shared": 10240,
            "num_warps": 4,
            "num_stages": 2,
            "global_scratch_size": 0
        }
    },
    "Config(BLOCK_N=32, BLOCK_K=16, BLOCK_Dp=16, num_warps=2, num_stages=2, parallel_k=1, div_k=False, div_d=False, div_dp=False, acc_dtype='fp32', dtype='fp32', sm=86).ptx": {
        "config": {
            "BLOCK_N": 32,
            "BLOCK_K": 16,
            "BLOCK_Dp": 16,
            "num_warps": 2,
            "num_stages": 2,
            "parallel_k": 1,
            "div_k": false,
            "div_d": false,
            "div_dp": false,
            "acc_dtype": "fp32",
            "dtype": "fp32",
            "sm": 86
        },
        "meta": {
            "shared": 3072,
            "num_warps": 2,
            "num_stages": 2,
            "global_scratch_size": 0
        }
    },
    "Config(BLOCK_N=16, BLOCK_K=32, BLOCK_Dp=64, num_warps=4, num_stages=2, parallel_k=1, div_k=False, div_d=False, div_dp=False, acc_dtype='fp32', dtype='fp16', sm=86).ptx": {
        "config": {
            "BLOCK_N": 16,
            "BLOCK_K": 32,
            "BLOCK_Dp": 64,
            "num_warps": 4,
            "num_stages": 2,
            "parallel_k": 1,
            "div_k": false,
            "div_d": false,
            "div_dp": false,
            "acc_dtype": "fp32",
            "dtype": "fp16",
            "sm": 86
        },
        "meta": {
            "shared": 5120,
            "num_warps": 4,
            "num_stages": 2,
            "global_scratch_size": 0
        }
    },
    "Config(BLOCK_N=32, BLOCK_K=16, BLOCK_Dp=32, num_warps=2, num_stages=2, parallel_k=1, div_k=False, div_d=False, div_dp=False, acc_dtype='fp16', dtype='fp16', sm=86).ptx": {
        "config": {
            "BLOCK_N": 32,
            "BLOCK_K": 16,
            "BLOCK_Dp": 32,
            "num_warps": 2,
            "num_stages": 2,
            "parallel_k": 1,
            "div_k": false,
            "div_d": false,
            "div_dp": false,
            "acc_dtype": "fp16",
            "dtype": "fp16",
            "sm": 86
        },
        "meta": {
            "shared": 2048,
            "num_warps": 2,
            "num_stages": 2,
            "global_scratch_size": 0
        }
    },
    "Config(BLOCK_N=16, BLOCK_K=32, BLOCK_Dp=64, num_warps=4, num_stages=2, parallel_k=2, div_k=False, div_d=True, div_dp=True, acc_dtype='fp16', dtype='fp16', sm=89).ptx": {
        "config": {
            "BLOCK_N": 16,
            "BLOCK_K": 32,
            "BLOCK_Dp": 64,
            "num_warps": 4,
            "num_stages": 2,
            "parallel_k": 2,
            "div_k": false,
            "div_d": true,
            "div_dp": true,
            "acc_dtype": "fp16",
            "dtype": "fp16",
            "sm": 89
        },
        "meta": {
            "shared": 5120,
            "num_warps": 4,
            "num_stages": 2,
            "global_scratch_size": 0
        }
    },
    "Config(BLOCK_N=16, BLOCK_K=32, BLOCK_Dp=32, num_warps=2, num_stages=2, parallel_k=2, div_k=False, div_d=True, div_dp=True, acc_dtype='fp16', dtype='fp16', sm=86).ptx": {
        "config": {
            "BLOCK_N": 16,
            "BLOCK_K": 32,
            "BLOCK_Dp": 32,
            "num_warps": 2,
            "num_stages": 2,
            "parallel_k": 2,
            "div_k": false,
            "div_d": true,
            "div_dp": true,
            "acc_dtype": "fp16",
            "dtype": "fp16",
            "sm": 86
        },
        "meta": {
            "shared": 3072,
            "num_warps": 2,
            "num_stages": 2,
            "global_scratch_size": 0
        }
    },
    "Config(BLOCK_N=16, BLOCK_K=32, BLOCK_Dp=32, num_warps=2, num_stages=2, parallel_k=2, div_k=False, div_d=True, div_dp=True, acc_dtype='fp16', dtype='fp16', sm=89).ptx": {
        "config": {
            "BLOCK_N": 16,
            "BLOCK_K": 32,
            "BLOCK_Dp": 32,
            "num_warps": 2,
            "num_stages": 2,
            "parallel_k": 2,
            "div_k": false,
            "div_d": true,
            "div_dp": true,
            "acc_dtype": "fp16",
            "dtype": "fp16",
            "sm": 89
        },
        "meta": {
            "shared": 3072,
            "num_warps": 2,
            "num_stages": 2,
            "global_scratch_size": 0
        }
    },
    "Config(BLOCK_N=32, BLOCK_K=16, BLOCK_Dp=32, num_warps=2, num_stages=2, parallel_k=2, div_k=False, div_d=True, div_dp=True, acc_dtype='fp32', dtype='fp16', sm=86).ptx": {
        "config": {
            "BLOCK_N": 32,
            "BLOCK_K": 16,
            "BLOCK_Dp": 32,
            "num_warps": 2,
            "num_stages": 2,
            "parallel_k": 2,
            "div_k": false,
            "div_d": true,
            "div_dp": true,
            "acc_dtype": "fp32",
            "dtype": "fp16",
            "sm": 86
        },
        "meta": {
            "shared": 2048,
            "num_warps": 2,
            "num_stages": 2,
            "global_scratch_size": 0
        }
    },
    "Config(BLOCK_N=32, BLOCK_K=16, BLOCK_Dp=32, num_warps=2, num_stages=2, parallel_k=2, div_k=False, div_d=True, div_dp=True, acc_dtype='fp32', dtype='fp16', sm=89).ptx": {
        "config": {
            "BLOCK_N": 32,
            "BLOCK_K": 16,
            "BLOCK_Dp": 32,
            "num_warps": 2,
            "num_stages": 2,
            "parallel_k": 2,
            "div_k": false,
            "div_d": true,
            "div_dp": true,
            "acc_dtype": "fp32",
            "dtype": "fp16",
            "sm": 89
        },
        "meta": {
            "shared": 2048,
            "num_warps": 2,
            "num_stages": 2,
            "global_scratch_size": 0
        }
    },
    "Config(BLOCK_N=16, BLOCK_K=32, BLOCK_Dp=32, num_warps=2, num_stages=2, parallel_k=2, div_k=False, div_d=True, div_dp=True, acc_dtype='fp32', dtype='fp16', sm=86).ptx": {
        "config": {
            "BLOCK_N": 16,
            "BLOCK_K": 32,
            "BLOCK_Dp": 32,
            "num_warps": 2,
            "num_stages": 2,
            "parallel_k": 2,
            "div_k": false,
            "div_d": true,
            "div_dp": true,
            "acc_dtype": "fp32",
            "dtype": "fp16",
            "sm": 86
        },
        "meta": {
            "shared": 3072,
            "num_warps": 2,
            "num_stages": 2,
            "global_scratch_size": 0
        }
    },
    "Config(BLOCK_N=16, BLOCK_K=32, BLOCK_Dp=32, num_warps=2, num_stages=2, parallel_k=2, div_k=False, div_d=True, div_dp=True, acc_dtype='fp32', dtype='fp16', sm=89).ptx": {
        "config": {
            "BLOCK_N": 16,
            "BLOCK_K": 32,
            "BLOCK_Dp": 32,
            "num_warps": 2,
            "num_stages": 2,
            "parallel_k": 2,
            "div_k": false,
            "div_d": true,
            "div_dp": true,
            "acc_dtype": "fp32",
            "dtype": "fp16",
            "sm": 89
        },
        "meta": {
            "shared": 3072,
            "num_warps": 2,
            "num_stages": 2,
            "global_scratch_size": 0
        }
    },
    "Config(BLOCK_N=32, BLOCK_K=16, BLOCK_Dp=32, num_warps=2, num_stages=2, parallel_k=2, div_k=False, div_d=True, div_dp=True, acc_dtype='fp32', dtype='fp32', sm=86).ptx": {
        "config": {
            "BLOCK_N": 32,
            "BLOCK_K": 16,
            "BLOCK_Dp": 32,
            "num_warps": 2,
            "num_stages": 2,
            "parallel_k": 2,
            "div_k": false,
            "div_d": true,
            "div_dp": true,
            "acc_dtype": "fp32",
            "dtype": "fp32",
            "sm": 86
        },
        "meta": {
            "shared": 4096,
            "num_warps": 2,
            "num_stages": 2,
            "global_scratch_size": 0
        }
    },
    "Config(BLOCK_N=32, BLOCK_K=16, BLOCK_Dp=32, num_warps=2, num_stages=2, parallel_k=2, div_k=False, div_d=True, div_dp=True, acc_dtype='fp32', dtype='fp32', sm=89).ptx": {
        "config": {
            "BLOCK_N": 32,
            "BLOCK_K": 16,
            "BLOCK_Dp": 32,
            "num_warps": 2,
            "num_stages": 2,
            "parallel_k": 2,
            "div_k": false,
            "div_d": true,
            "div_dp": true,
            "acc_dtype": "fp32",
            "dtype": "fp32",
            "sm": 89
        },
        "meta": {
            "shared": 4096,
            "num_warps": 2,
            "num_stages": 2,
            "global_scratch_size": 0
        }
    },
    "Config(BLOCK_N=16, BLOCK_K=32, BLOCK_Dp=32, num_warps=2, num_stages=2, parallel_k=2, div_k=False, div_d=True, div_dp=True, acc_dtype='fp32', dtype='fp32', sm=86).ptx": {
        "config": {
            "BLOCK_N": 16,
            "BLOCK_K": 32,
            "BLOCK_Dp": 32,
            "num_warps": 2,
            "num_stages": 2,
            "parallel_k": 2,
            "div_k": false,
            "div_d": true,
            "div_dp": true,
            "acc_dtype": "fp32",
            "dtype": "fp32",
            "sm": 86
        },
        "meta": {
            "shared": 6144,
            "num_warps": 2,
            "num_stages": 2,
            "global_scratch_size": 0
        }
    },
    "Config(BLOCK_N=16, BLOCK_K=32, BLOCK_Dp=32, num_warps=2, num_stages=2, parallel_k=2, div_k=False, div_d=True, div_dp=True, acc_dtype='fp32', dtype='fp32', sm=89).ptx": {
        "config": {
            "BLOCK_N": 16,
            "BLOCK_K": 32,
            "BLOCK_Dp": 32,
            "num_warps": 2,
            "num_stages": 2,
            "parallel_k": 2,
            "div_k": false,
            "div_d": true,
            "div_dp": true,
            "acc_dtype": "fp32",
            "dtype": "fp32",
            "sm": 89
        },
        "meta": {
            "shared": 6144,
            "num_warps": 2,
            "num_stages": 2,
            "global_scratch_size": 0
        }
    },
    "Config(BLOCK_N=128, BLOCK_K=32, BLOCK_Dp=32, num_warps=4, num_stages=2, parallel_k=2, div_k=False, div_d=True, div_dp=True, acc_dtype='fp32', dtype='fp16', sm=89).ptx": {
        "config": {
            "BLOCK_N": 128,
            "BLOCK_K": 32,
            "BLOCK_Dp": 32,
            "num_warps": 4,
            "num_stages": 2,
            "parallel_k": 2,
            "div_k": false,
            "div_d": true,
            "div_dp": true,
            "acc_dtype": "fp32",
            "dtype": "fp16",
            "sm": 89
        },
        "meta": {
            "shared": 10240,
            "num_warps": 4,
            "num_stages": 2,
            "global_scratch_size": 0
        }
    },
    "Config(BLOCK_N=16, BLOCK_K=32, BLOCK_Dp=128, num_warps=4, num_stages=2, parallel_k=2, div_k=False, div_d=True, div_dp=True, acc_dtype='fp32', dtype='fp16', sm=86).ptx": {
        "config": {
            "BLOCK_N": 16,
            "BLOCK_K": 32,
            "BLOCK_Dp": 128,
            "num_warps": 4,
            "num_stages": 2,
            "parallel_k": 2,
            "div_k": false,
            "div_d": true,
            "div_dp": true,
            "acc_dtype": "fp32",
            "dtype": "fp16",
            "sm": 86
        },
        "meta": {
            "shared": 9216,
            "num_warps": 4,
            "num_stages": 2,
            "global_scratch_size": 0
        }
    },
    "Config(BLOCK_N=32, BLOCK_K=16, BLOCK_Dp=16, num_warps=2, num_stages=2, parallel_k=2, div_k=False, div_d=True, div_dp=True, acc_dtype='fp16', dtype='fp16', sm=86).ptx": {
        "config": {
            "BLOCK_N": 32,
            "BLOCK_K": 16,
            "BLOCK_Dp": 16,
            "num_warps": 2,
            "num_stages": 2,
            "parallel_k": 2,
            "div_k": false,
            "div_d": true,
            "div_dp": true,
            "acc_dtype": "fp16",
            "dtype": "fp16",
            "sm": 86
        },
        "meta": {
            "shared": 1536,
            "num_warps": 2,
            "num_stages": 2,
            "global_scratch_size": 0
        }
    },
    "Config(BLOCK_N=16, BLOCK_K=32, BLOCK_Dp=128, num_warps=4, num_stages=2, parallel_k=2, div_k=False, div_d=True, div_dp=True, acc_dtype='fp32', dtype='fp16', sm=89).ptx": {
        "config": {
            "BLOCK_N": 16,
            "BLOCK_K": 32,
            "BLOCK_Dp": 128,
            "num_warps": 4,
            "num_stages": 2,
            "parallel_k": 2,
            "div_k": false,
            "div_d": true,
            "div_dp": true,
            "acc_dtype": "fp32",
            "dtype": "fp16",
            "sm": 89
        },
        "meta": {
            "shared": 9216,
            "num_warps": 4,
            "num_stages": 2,
            "global_scratch_size": 0
        }
    },
    "Config(BLOCK_N=32, BLOCK_K=16, BLOCK_Dp=16, num_warps=2, num_stages=2, parallel_k=2, div_k=False, div_d=True, div_dp=True, acc_dtype='fp16', dtype='fp16', sm=89).ptx": {
        "config": {
            "BLOCK_N": 32,
            "BLOCK_K": 16,
            "BLOCK_Dp": 16,
            "num_warps": 2,
            "num_stages": 2,
            "parallel_k": 2,
            "div_k": false,
            "div_d": true,
            "div_dp": true,
            "acc_dtype": "fp16",
            "dtype": "fp16",
            "sm": 89
        },
        "meta": {
            "shared": 1536,
            "num_warps": 2,
            "num_stages": 2,
            "global_scratch_size": 0
        }
    },
    "Config(BLOCK_N=16, BLOCK_K=16, BLOCK_Dp=16, num_warps=2, num_stages=2, parallel_k=2, div_k=False, div_d=True, div_dp=True, acc_dtype='fp32', dtype='fp32', sm=86).ptx": {
        "config": {
            "BLOCK_N": 16,
            "BLOCK_K": 16,
            "BLOCK_Dp": 16,
            "num_warps": 2,
            "num_stages": 2,
            "parallel_k": 2,
            "div_k": false,
            "div_d": true,
            "div_dp": true,
            "acc_dtype": "fp32",
            "dtype": "fp32",
            "sm": 86
        },
        "meta": {
            "shared": 2048,
            "num_warps": 2,
            "num_stages": 2,
            "global_scratch_size": 0
        }
    },
    "Config(BLOCK_N=128, BLOCK_K=32, BLOCK_Dp=32, num_warps=4, num_stages=2, parallel_k=2, div_k=False, div_d=True, div_dp=True, acc_dtype='fp32', dtype='fp32', sm=89).ptx": {
        "config": {
            "BLOCK_N": 128,
            "BLOCK_K": 32,
            "BLOCK_Dp": 32,
            "num_warps": 4,
            "num_stages": 2,
            "parallel_k": 2,
            "div_k": false,
            "div_d": true,
            "div_dp": true,
            "acc_dtype": "fp32",
            "dtype": "fp32",
            "sm": 89
        },
        "meta": {
            "shared": 20480,
            "num_warps": 4,
            "num_stages": 2,
            "global_scratch_size": 0
        }
    },
    "Config(BLOCK_N=128, BLOCK_K=32, BLOCK_Dp=32, num_warps=4, num_stages=2, parallel_k=2, div_k=False, div_d=True, div_dp=True, acc_dtype='fp32', dtype='fp32', sm=86).ptx": {
        "config": {
            "BLOCK_N": 128,
            "BLOCK_K": 32,
            "BLOCK_Dp": 32,
            "num_warps": 4,
            "num_stages": 2,
            "parallel_k": 2,
            "div_k": false,
            "div_d": true,
            "div_dp": true,
            "acc_dtype": "fp32",
            "dtype": "fp32",
            "sm": 86
        },
        "meta": {
            "shared": 20480,
            "num_warps": 4,
            "num_stages": 2,
            "global_scratch_size": 0
        }
    },
    "Config(BLOCK_N=16, BLOCK_K=16, BLOCK_Dp=16, num_warps=2, num_stages=2, parallel_k=2, div_k=False, div_d=True, div_dp=True, acc_dtype='fp32', dtype='fp32', sm=89).ptx": {
        "config": {
            "BLOCK_N": 16,
            "BLOCK_K": 16,
            "BLOCK_Dp": 16,
            "num_warps": 2,
            "num_stages": 2,
            "parallel_k": 2,
            "div_k": false,
            "div_d": true,
            "div_dp": true,
            "acc_dtype": "fp32",
            "dtype": "fp32",
            "sm": 89
        },
        "meta": {
            "shared": 2048,
            "num_warps": 2,
            "num_stages": 2,
            "global_scratch_size": 0
        }
    },
    "Config(BLOCK_N=32, BLOCK_K=16, BLOCK_Dp=32, num_warps=2, num_stages=2, parallel_k=2, div_k=False, div_d=True, div_dp=True, acc_dtype='fp16', dtype='fp16', sm=86).ptx": {
        "config": {
            "BLOCK_N": 32,
            "BLOCK_K": 16,
            "BLOCK_Dp": 32,
            "num_warps": 2,
            "num_stages": 2,
            "parallel_k": 2,
            "div_k": false,
            "div_d": true,
            "div_dp": true,
            "acc_dtype": "fp16",
            "dtype": "fp16",
            "sm": 86
        },
        "meta": {
            "shared": 2048,
            "num_warps": 2,
            "num_stages": 2,
            "global_scratch_size": 0
        }
    },
    "Config(BLOCK_N=128, BLOCK_K=32, BLOCK_Dp=32, num_warps=8, num_stages=2, parallel_k=2, div_k=False, div_d=True, div_dp=True, acc_dtype='fp32', dtype='fp32', sm=89).ptx": {
        "config": {
            "BLOCK_N": 128,
            "BLOCK_K": 32,
            "BLOCK_Dp": 32,
            "num_warps": 8,
            "num_stages": 2,
            "parallel_k": 2,
            "div_k": false,
            "div_d": true,
            "div_dp": true,
            "acc_dtype": "fp32",
            "dtype": "fp32",
            "sm": 89
        },
        "meta": {
            "shared": 20480,
            "num_warps": 8,
            "num_stages": 2,
            "global_scratch_size": 0
        }
    },
    "Config(BLOCK_N=32, BLOCK_K=16, BLOCK_Dp=32, num_warps=2, num_stages=2, parallel_k=2, div_k=False, div_d=True, div_dp=True, acc_dtype='fp16', dtype='fp16', sm=89).ptx": {
        "config": {
            "BLOCK_N": 32,
            "BLOCK_K": 16,
            "BLOCK_Dp": 32,
            "num_warps": 2,
            "num_stages": 2,
            "parallel_k": 2,
            "div_k": false,
            "div_d": true,
            "div_dp": true,
            "acc_dtype": "fp16",
            "dtype": "fp16",
            "sm": 89
        },
        "meta": {
            "shared": 2048,
            "num_warps": 2,
            "num_stages": 2,
            "global_scratch_size": 0
        }
    },
    "Config(BLOCK_N=32, BLOCK_K=16, BLOCK_Dp=16, num_warps=2, num_stages=2, parallel_k=2, div_k=False, div_d=True, div_dp=True, acc_dtype='fp32', dtype='fp32', sm=86).ptx": {
        "config": {
            "BLOCK_N": 32,
            "BLOCK_K": 16,
            "BLOCK_Dp": 16,
            "num_warps": 2,
            "num_stages": 2,
            "parallel_k": 2,
            "div_k": false,
            "div_d": true,
            "div_dp": true,
            "acc_dtype": "fp32",
            "dtype": "fp32",
            "sm": 86
        },
        "meta": {
            "shared": 3072,
            "num_warps": 2,
            "num_stages": 2,
            "global_scratch_size": 0
        }
    },
    "Config(BLOCK_N=16, BLOCK_K=32, BLOCK_Dp=128, num_warps=4, num_stages=2, parallel_k=2, div_k=False, div_d=True, div_dp=True, acc_dtype='fp16', dtype='fp16', sm=89).ptx": {
        "config": {
            "BLOCK_N": 16,
            "BLOCK_K": 32,
            "BLOCK_Dp": 128,
            "num_warps": 4,
            "num_stages": 2,
            "parallel_k": 2,
            "div_k": false,
            "div_d": true,
            "div_dp": true,
            "acc_dtype": "fp16",
            "dtype": "fp16",
            "sm": 89
        },
        "meta": {
            "shared": 9216,
            "num_warps": 4,
            "num_stages": 2,
            "global_scratch_size": 0
        }
    },
    "Config(BLOCK_N=16, BLOCK_K=32, BLOCK_Dp=64, num_warps=4, num_stages=2, parallel_k=2, div_k=False, div_d=True, div_dp=True, acc_dtype='fp32', dtype='fp16', sm=86).ptx": {
        "config": {
            "BLOCK_N": 16,
            "BLOCK_K": 32,
            "BLOCK_Dp": 64,
            "num_warps": 4,
            "num_stages": 2,
            "parallel_k": 2,
            "div_k": false,
            "div_d": true,
            "div_dp": true,
            "acc_dtype": "fp32",
            "dtype": "fp16",
            "sm": 86
        },
        "meta": {
            "shared": 5120,
            "num_warps": 4,
            "num_stages": 2,
            "global_scratch_size": 0
        }
    },
    "Config(BLOCK_N=32, BLOCK_K=16, BLOCK_Dp=16, num_warps=2, num_stages=2, parallel_k=2, div_k=False, div_d=True, div_dp=True, acc_dtype='fp32', dtype='fp16', sm=86).ptx": {
        "config": {
            "BLOCK_N": 32,
            "BLOCK_K": 16,
            "BLOCK_Dp": 16,
            "num_warps": 2,
            "num_stages": 2,
            "parallel_k": 2,
            "div_k": false,
            "div_d": true,
            "div_dp": true,
            "acc_dtype": "fp32",
            "dtype": "fp16",
            "sm": 86
        },
        "meta": {
            "shared": 1536,
            "num_warps": 2,
            "num_stages": 2,
            "global_scratch_size": 0
        }
    },
    "Config(BLOCK_N=32, BLOCK_K=16, BLOCK_Dp=16, num_warps=2, num_stages=2, parallel_k=2, div_k=False, div_d=True, div_dp=True, acc_dtype='fp32', dtype='fp32', sm=89).ptx": {
        "config": {
            "BLOCK_N": 32,
            "BLOCK_K": 16,
            "BLOCK_Dp": 16,
            "num_warps": 2,
            "num_stages": 2,
            "parallel_k": 2,
            "div_k": false,
            "div_d": true,
            "div_dp": true,
            "acc_dtype": "fp32",
            "dtype": "fp32",
            "sm": 89
        },
        "meta": {
            "shared": 3072,
            "num_warps": 2,
            "num_stages": 2,
            "global_scratch_size": 0
        }
    },
    "Config(BLOCK_N=32, BLOCK_K=32, BLOCK_Dp=16, num_warps=2, num_stages=2, parallel_k=2, div_k=False, div_d=True, div_dp=True, acc_dtype='fp32', dtype='fp16', sm=86).ptx": {
        "config": {
            "BLOCK_N": 32,
            "BLOCK_K": 32,
            "BLOCK_Dp": 16,
            "num_warps": 2,
            "num_stages": 2,
            "parallel_k": 2,
            "div_k": false,
            "div_d": true,
            "div_dp": true,
            "acc_dtype": "fp32",
            "dtype": "fp16",
            "sm": 86
        },
        "meta": {
            "shared": 3072,
            "num_warps": 2,
            "num_stages": 2,
            "global_scratch_size": 0
        }
    },
    "Config(BLOCK_N=32, BLOCK_K=16, BLOCK_Dp=16, num_warps=2, num_stages=2, parallel_k=2, div_k=False, div_d=True, div_dp=True, acc_dtype='fp32', dtype='fp16', sm=89).ptx": {
        "config": {
            "BLOCK_N": 32,
            "BLOCK_K": 16,
            "BLOCK_Dp": 16,
            "num_warps": 2,
            "num_stages": 2,
            "parallel_k": 2,
            "div_k": false,
            "div_d": true,
            "div_dp": true,
            "acc_dtype": "fp32",
            "dtype": "fp16",
            "sm": 89
        },
        "meta": {
            "shared": 1536,
            "num_warps": 2,
            "num_stages": 2,
            "global_scratch_size": 0
        }
    },
    "Config(BLOCK_N=16, BLOCK_K=16, BLOCK_Dp=16, num_warps=2, num_stages=2, parallel_k=2, div_k=False, div_d=True, div_dp=True, acc_dtype='fp32', dtype='fp16', sm=86).ptx": {
        "config": {
            "BLOCK_N": 16,
            "BLOCK_K": 16,
            "BLOCK_Dp": 16,
            "num_warps": 2,
            "num_stages": 2,
            "parallel_k": 2,
            "div_k": false,
            "div_d": true,
            "div_dp": true,
            "acc_dtype": "fp32",
            "dtype": "fp16",
            "sm": 86
        },
        "meta": {
            "shared": 1024,
            "num_warps": 2,
            "num_stages": 2,
            "global_scratch_size": 0
        }
    },
    "Config(BLOCK_N=16, BLOCK_K=16, BLOCK_Dp=16, num_warps=2, num_stages=2, parallel_k=2, div_k=False, div_d=True, div_dp=True, acc_dtype='fp32', dtype='fp16', sm=89).ptx": {
        "config": {
            "BLOCK_N": 16,
            "BLOCK_K": 16,
            "BLOCK_Dp": 16,
            "num_warps": 2,
            "num_stages": 2,
            "parallel_k": 2,
            "div_k": false,
            "div_d": true,
            "div_dp": true,
            "acc_dtype": "fp32",
            "dtype": "fp16",
            "sm": 89
        },
        "meta": {
            "shared": 1024,
            "num_warps": 2,
            "num_stages": 2,
            "global_scratch_size": 0
        }
    },
    "Config(BLOCK_N=16, BLOCK_K=32, BLOCK_Dp=64, num_warps=4, num_stages=2, parallel_k=2, div_k=False, div_d=True, div_dp=True, acc_dtype='fp32', dtype='fp32', sm=89).ptx": {
        "config": {
            "BLOCK_N": 16,
            "BLOCK_K": 32,
            "BLOCK_Dp": 64,
            "num_warps": 4,
            "num_stages": 2,
            "parallel_k": 2,
            "div_k": false,
            "div_d": true,
            "div_dp": true,
            "acc_dtype": "fp32",
            "dtype": "fp32",
            "sm": 89
        },
        "meta": {
            "shared": 10240,
            "num_warps": 4,
            "num_stages": 2,
            "global_scratch_size": 0
        }
    },
    "Config(BLOCK_N=16, BLOCK_K=16, BLOCK_Dp=16, num_warps=2, num_stages=2, parallel_k=2, div_k=False, div_d=True, div_dp=True, acc_dtype='fp16', dtype='fp16', sm=86).ptx": {
        "config": {
            "BLOCK_N": 16,
            "BLOCK_K": 16,
            "BLOCK_Dp": 16,
            "num_warps": 2,
            "num_stages": 2,
            "parallel_k": 2,
            "div_k": false,
            "div_d": true,
            "div_dp": true,
            "acc_dtype": "fp16",
            "dtype": "fp16",
            "sm": 86
        },
        "meta": {
            "shared": 1024,
            "num_warps": 2,
            "num_stages": 2,
            "global_scratch_size": 0
        }
    },
    "Config(BLOCK_N=128, BLOCK_K=32, BLOCK_Dp=32, num_warps=4, num_stages=2, parallel_k=2, div_k=False, div_d=True, div_dp=True, acc_dtype='fp16', dtype='fp16', sm=89).ptx": {
        "config": {
            "BLOCK_N": 128,
            "BLOCK_K": 32,
            "BLOCK_Dp": 32,
            "num_warps": 4,
            "num_stages": 2,
            "parallel_k": 2,
            "div_k": false,
            "div_d": true,
            "div_dp": true,
            "acc_dtype": "fp16",
            "dtype": "fp16",
            "sm": 89
        },
        "meta": {
            "shared": 10240,
            "num_warps": 4,
            "num_stages": 2,
            "global_scratch_size": 0
        }
    },
    "Config(BLOCK_N=16, BLOCK_K=32, BLOCK_Dp=64, num_warps=4, num_stages=2, parallel_k=2, div_k=False, div_d=True, div_dp=True, acc_dtype='fp32', dtype='fp32', sm=86).ptx": {
        "config": {
            "BLOCK_N": 16,
            "BLOCK_K": 32,
            "BLOCK_Dp": 64,
            "num_warps": 4,
            "num_stages": 2,
            "parallel_k": 2,
            "div_k": false,
            "div_d": true,
            "div_dp": true,
            "acc_dtype": "fp32",
            "dtype": "fp32",
            "sm": 86
        },
        "meta": {
            "shared": 10240,
            "num_warps": 4,
            "num_stages": 2,
            "global_scratch_size": 0
        }
    },
    "Config(BLOCK_N=128, BLOCK_K=32, BLOCK_Dp=32, num_warps=4, num_stages=2, parallel_k=2, div_k=False, div_d=True, div_dp=True, acc_dtype='fp16', dtype='fp16', sm=86).ptx": {
        "config": {
            "BLOCK_N": 128,
            "BLOCK_K": 32,
            "BLOCK_Dp": 32,
            "num_warps": 4,
            "num_stages": 2,
            "parallel_k": 2,
            "div_k": false,
            "div_d": true,
            "div_dp": true,
            "acc_dtype": "fp16",
            "dtype": "fp16",
            "sm": 86
        },
        "meta": {
            "shared": 10240,
            "num_warps": 4,
            "num_stages": 2,
            "global_scratch_size": 0
        }
    },
    "Config(BLOCK_N=16, BLOCK_K=32, BLOCK_Dp=64, num_warps=2, num_stages=2, parallel_k=2, div_k=False, div_d=True, div_dp=True, acc_dtype='fp32', dtype='fp16', sm=86).ptx": {
        "config": {
            "BLOCK_N": 16,
            "BLOCK_K": 32,
            "BLOCK_Dp": 64,
            "num_warps": 2,
            "num_stages": 2,
            "parallel_k": 2,
            "div_k": false,
            "div_d": true,
            "div_dp": true,
            "acc_dtype": "fp32",
            "dtype": "fp16",
            "sm": 86
        },
        "meta": {
            "shared": 5120,
            "num_warps": 2,
            "num_stages": 2,
            "global_scratch_size": 0
        }
    },
    "Config(BLOCK_N=32, BLOCK_K=32, BLOCK_Dp=16, num_warps=2, num_stages=2, parallel_k=2, div_k=False, div_d=True, div_dp=True, acc_dtype='fp32', dtype='fp32', sm=86).ptx": {
        "config": {
            "BLOCK_N": 32,
            "BLOCK_K": 32,
            "BLOCK_Dp": 16,
            "num_warps": 2,
            "num_stages": 2,
            "parallel_k": 2,
            "div_k": false,
            "div_d": true,
            "div_dp": true,
            "acc_dtype": "fp32",
            "dtype": "fp32",
            "sm": 86
        },
        "meta": {
            "shared": 6144,
            "num_warps": 2,
            "num_stages": 2,
            "global_scratch_size": 0
        }
    },
    "Config(BLOCK_N=16, BLOCK_K=32, BLOCK_Dp=64, num_warps=2, num_stages=2, parallel_k=2, div_k=False, div_d=True, div_dp=True, acc_dtype='fp32', dtype='fp32', sm=89).ptx": {
        "config": {
            "BLOCK_N": 16,
            "BLOCK_K": 32,
            "BLOCK_Dp": 64,
            "num_warps": 2,
            "num_stages": 2,
            "parallel_k": 2,
            "div_k": false,
            "div_d": true,
            "div_dp": true,
            "acc_dtype": "fp32",
            "dtype": "fp32",
            "sm": 89
        },
        "meta": {
            "shared": 10240,
            "num_warps": 2,
            "num_stages": 2,
            "global_scratch_size": 0
        }
    },
    "Config(BLOCK_N=16, BLOCK_K=32, BLOCK_Dp=64, num_warps=2, num_stages=2, parallel_k=2, div_k=False, div_d=True, div_dp=True, acc_dtype='fp32', dtype='fp16', sm=89).ptx": {
        "config": {
            "BLOCK_N": 16,
            "BLOCK_K": 32,
            "BLOCK_Dp": 64,
            "num_warps": 2,
            "num_stages": 2,
            "parallel_k": 2,
            "div_k": false,
            "div_d": true,
            "div_dp": true,
            "acc_dtype": "fp32",
            "dtype": "fp16",
            "sm": 89
        },
        "meta": {
            "shared": 5120,
            "num_warps": 2,
            "num_stages": 2,
            "global_scratch_size": 0
        }
    },
    "Config(BLOCK_N=16, BLOCK_K=16, BLOCK_Dp=16, num_warps=2, num_stages=2, parallel_k=2, div_k=False, div_d=True, div_dp=True, acc_dtype='fp16', dtype='fp16', sm=89).ptx": {
        "config": {
            "BLOCK_N": 16,
            "BLOCK_K": 16,
            "BLOCK_Dp": 16,
            "num_warps": 2,
            "num_stages": 2,
            "parallel_k": 2,
            "div_k": false,
            "div_d": true,
            "div_dp": true,
            "acc_dtype": "fp16",
            "dtype": "fp16",
            "sm": 89
        },
        "meta": {
            "shared": 1024,
            "num_warps": 2,
            "num_stages": 2,
            "global_scratch_size": 0
        }
    },
    "Config(BLOCK_N=16, BLOCK_K=64, BLOCK_Dp=64, num_warps=4, num_stages=2, parallel_k=2, div_k=False, div_d=True, div_dp=True, acc_dtype='fp16', dtype='fp16', sm=89).ptx": {
        "config": {
            "BLOCK_N": 16,
            "BLOCK_K": 64,
            "BLOCK_Dp": 64,
            "num_warps": 4,
            "num_stages": 2,
            "parallel_k": 2,
            "div_k": false,
            "div_d": true,
            "div_dp": true,
            "acc_dtype": "fp16",
            "dtype": "fp16",
            "sm": 89
        },
        "meta": {
            "shared": 10240,
            "num_warps": 4,
            "num_stages": 2,
            "global_scratch_size": 0
        }
    },
    "Config(BLOCK_N=16, BLOCK_K=64, BLOCK_Dp=64, num_warps=4, num_stages=2, parallel_k=2, div_k=False, div_d=True, div_dp=True, acc_dtype='fp16', dtype='fp16', sm=86).ptx": {
        "config": {
            "BLOCK_N": 16,
            "BLOCK_K": 64,
            "BLOCK_Dp": 64,
            "num_warps": 4,
            "num_stages": 2,
            "parallel_k": 2,
            "div_k": false,
            "div_d": true,
            "div_dp": true,
            "acc_dtype": "fp16",
            "dtype": "fp16",
            "sm": 86
        },
        "meta": {
            "shared": 10240,
            "num_warps": 4,
            "num_stages": 2,
            "global_scratch_size": 0
        }
    },
    "Config(BLOCK_N=16, BLOCK_K=32, BLOCK_Dp=64, num_warps=2, num_stages=2, parallel_k=2, div_k=False, div_d=True, div_dp=True, acc_dtype='fp16', dtype='fp16', sm=89).ptx": {
        "config": {
            "BLOCK_N": 16,
            "BLOCK_K": 32,
            "BLOCK_Dp": 64,
            "num_warps": 2,
            "num_stages": 2,
            "parallel_k": 2,
            "div_k": false,
            "div_d": true,
            "div_dp": true,
            "acc_dtype": "fp16",
            "dtype": "fp16",
            "sm": 89
        },
        "meta": {
            "shared": 5120,
            "num_warps": 2,
            "num_stages": 2,
            "global_scratch_size": 0
        }
    },
    "Config(BLOCK_N=16, BLOCK_K=64, BLOCK_Dp=64, num_warps=4, num_stages=2, parallel_k=2, div_k=False, div_d=True, div_dp=True, acc_dtype='fp32', dtype='fp32', sm=89).ptx": {
        "config": {
            "BLOCK_N": 16,
            "BLOCK_K": 64,
            "BLOCK_Dp": 64,
            "num_warps": 4,
            "num_stages": 2,
            "parallel_k": 2,
            "div_k": false,
            "div_d": true,
            "div_dp": true,
            "acc_dtype": "fp32",
            "dtype": "fp32",
            "sm": 89
        },
        "meta": {
            "shared": 20480,
            "num_warps": 4,
            "num_stages": 2,
            "global_scratch_size": 0
        }
    },
    "Config(BLOCK_N=16, BLOCK_K=64, BLOCK_Dp=64, num_warps=4, num_stages=2, parallel_k=2, div_k=False, div_d=True, div_dp=True, acc_dtype='fp32', dtype='fp16', sm=89).ptx": {
        "config": {
            "BLOCK_N": 16,
            "BLOCK_K": 64,
            "BLOCK_Dp": 64,
            "num_warps": 4,
            "num_stages": 2,
            "parallel_k": 2,
            "div_k": false,
            "div_d": true,
            "div_dp": true,
            "acc_dtype": "fp32",
            "dtype": "fp16",
            "sm": 89
        },
        "meta": {
            "shared": 10240,
            "num_warps": 4,
            "num_stages": 2,
            "global_scratch_size": 0
        }
    },
    "Config(BLOCK_N=16, BLOCK_K=64, BLOCK_Dp=64, num_warps=4, num_stages=2, parallel_k=2, div_k=False, div_d=True, div_dp=True, acc_dtype='fp32', dtype='fp16', sm=86).ptx": {
        "config": {
            "BLOCK_N": 16,
            "BLOCK_K": 64,
            "BLOCK_Dp": 64,
            "num_warps": 4,
            "num_stages": 2,
            "parallel_k": 2,
            "div_k": false,
            "div_d": true,
            "div_dp": true,
            "acc_dtype": "fp32",
            "dtype": "fp16",
            "sm": 86
        },
        "meta": {
            "shared": 10240,
            "num_warps": 4,
            "num_stages": 2,
            "global_scratch_size": 0
        }
    },
    "Config(BLOCK_N=32, BLOCK_K=16, BLOCK_Dp=16, num_warps=2, num_stages=2, parallel_k=2, div_k=False, div_d=False, div_dp=False, acc_dtype='fp32', dtype='fp32', sm=86).ptx": {
        "config": {
            "BLOCK_N": 32,
            "BLOCK_K": 16,
            "BLOCK_Dp": 16,
            "num_warps": 2,
            "num_stages": 2,
            "parallel_k": 2,
            "div_k": false,
            "div_d": false,
            "div_dp": false,
            "acc_dtype": "fp32",
            "dtype": "fp32",
            "sm": 86
        },
        "meta": {
            "shared": 3072,
            "num_warps": 2,
            "num_stages": 2,
            "global_scratch_size": 0
        }
    },
    "Config(BLOCK_N=32, BLOCK_K=16, BLOCK_Dp=16, num_warps=2, num_stages=2, parallel_k=2, div_k=False, div_d=False, div_dp=False, acc_dtype='fp32', dtype='fp16', sm=86).ptx": {
        "config": {
            "BLOCK_N": 32,
            "BLOCK_K": 16,
            "BLOCK_Dp": 16,
            "num_warps": 2,
            "num_stages": 2,
            "parallel_k": 2,
            "div_k": false,
            "div_d": false,
            "div_dp": false,
            "acc_dtype": "fp32",
            "dtype": "fp16",
            "sm": 86
        },
        "meta": {
            "shared": 1536,
            "num_warps": 2,
            "num_stages": 2,
            "global_scratch_size": 0
        }
    },
    "Config(BLOCK_N=32, BLOCK_K=16, BLOCK_Dp=16, num_warps=2, num_stages=2, parallel_k=2, div_k=False, div_d=False, div_dp=False, acc_dtype='fp32', dtype='fp32', sm=89).ptx": {
        "config": {
            "BLOCK_N": 32,
            "BLOCK_K": 16,
            "BLOCK_Dp": 16,
            "num_warps": 2,
            "num_stages": 2,
            "parallel_k": 2,
            "div_k": false,
            "div_d": false,
            "div_dp": false,
            "acc_dtype": "fp32",
            "dtype": "fp32",
            "sm": 89
        },
        "meta": {
            "shared": 3072,
            "num_warps": 2,
            "num_stages": 2,
            "global_scratch_size": 0
        }
    },
    "Config(BLOCK_N=16, BLOCK_K=32, BLOCK_Dp=32, num_warps=2, num_stages=2, parallel_k=2, div_k=False, div_d=False, div_dp=False, acc_dtype='fp16', dtype='fp16', sm=89).ptx": {
        "config": {
            "BLOCK_N": 16,
            "BLOCK_K": 32,
            "BLOCK_Dp": 32,
            "num_warps": 2,
            "num_stages": 2,
            "parallel_k": 2,
            "div_k": false,
            "div_d": false,
            "div_dp": false,
            "acc_dtype": "fp16",
            "dtype": "fp16",
            "sm": 89
        },
        "meta": {
            "shared": 3072,
            "num_warps": 2,
            "num_stages": 2,
            "global_scratch_size": 0
        }
    },
    "Config(BLOCK_N=32, BLOCK_K=16, BLOCK_Dp=16, num_warps=2, num_stages=2, parallel_k=2, div_k=False, div_d=False, div_dp=False, acc_dtype='fp32', dtype='fp16', sm=89).ptx": {
        "config": {
            "BLOCK_N": 32,
            "BLOCK_K": 16,
            "BLOCK_Dp": 16,
            "num_warps": 2,
            "num_stages": 2,
            "parallel_k": 2,
            "div_k": false,
            "div_d": false,
            "div_dp": false,
            "acc_dtype": "fp32",
            "dtype": "fp16",
            "sm": 89
        },
        "meta": {
            "shared": 1536,
            "num_warps": 2,
            "num_stages": 2,
            "global_scratch_size": 0
        }
    },
    "Config(BLOCK_N=16, BLOCK_K=32, BLOCK_Dp=32, num_warps=2, num_stages=2, parallel_k=2, div_k=False, div_d=False, div_dp=False, acc_dtype='fp16', dtype='fp16', sm=86).ptx": {
        "config": {
            "BLOCK_N": 16,
            "BLOCK_K": 32,
            "BLOCK_Dp": 32,
            "num_warps": 2,
            "num_stages": 2,
            "parallel_k": 2,
            "div_k": false,
            "div_d": false,
            "div_dp": false,
            "acc_dtype": "fp16",
            "dtype": "fp16",
            "sm": 86
        },
        "meta": {
            "shared": 3072,
            "num_warps": 2,
            "num_stages": 2,
            "global_scratch_size": 0
        }
    },
    "Config(BLOCK_N=16, BLOCK_K=32, BLOCK_Dp=64, num_warps=2, num_stages=2, parallel_k=2, div_k=False, div_d=False, div_dp=False, acc_dtype='fp16', dtype='fp16', sm=89).ptx": {
        "config": {
            "BLOCK_N": 16,
            "BLOCK_K": 32,
            "BLOCK_Dp": 64,
            "num_warps": 2,
            "num_stages": 2,
            "parallel_k": 2,
            "div_k": false,
            "div_d": false,
            "div_dp": false,
            "acc_dtype": "fp16",
            "dtype": "fp16",
            "sm": 89
        },
        "meta": {
            "shared": 5120,
            "num_warps": 2,
            "num_stages": 2,
            "global_scratch_size": 0
        }
    },
    "Config(BLOCK_N=128, BLOCK_K=32, BLOCK_Dp=32, num_warps=8, num_stages=2, parallel_k=2, div_k=False, div_d=False, div_dp=False, acc_dtype='fp32', dtype='fp32', sm=89).ptx": {
        "config": {
            "BLOCK_N": 128,
            "BLOCK_K": 32,
            "BLOCK_Dp": 32,
            "num_warps": 8,
            "num_stages": 2,
            "parallel_k": 2,
            "div_k": false,
            "div_d": false,
            "div_dp": false,
            "acc_dtype": "fp32",
            "dtype": "fp32",
            "sm": 89
        },
        "meta": {
            "shared": 20480,
            "num_warps": 8,
            "num_stages": 2,
            "global_scratch_size": 0
        }
    },
    "Config(BLOCK_N=16, BLOCK_K=32, BLOCK_Dp=32, num_warps=2, num_stages=2, parallel_k=2, div_k=False, div_d=False, div_dp=False, acc_dtype='fp32', dtype='fp32', sm=86).ptx": {
        "config": {
            "BLOCK_N": 16,
            "BLOCK_K": 32,
            "BLOCK_Dp": 32,
            "num_warps": 2,
            "num_stages": 2,
            "parallel_k": 2,
            "div_k": false,
            "div_d": false,
            "div_dp": false,
            "acc_dtype": "fp32",
            "dtype": "fp32",
            "sm": 86
        },
        "meta": {
            "shared": 6144,
            "num_warps": 2,
            "num_stages": 2,
            "global_scratch_size": 0
        }
    },
    "Config(BLOCK_N=128, BLOCK_K=32, BLOCK_Dp=32, num_warps=4, num_stages=2, parallel_k=2, div_k=False, div_d=False, div_dp=False, acc_dtype='fp32', dtype='fp16', sm=89).ptx": {
        "config": {
            "BLOCK_N": 128,
            "BLOCK_K": 32,
            "BLOCK_Dp": 32,
            "num_warps": 4,
            "num_stages": 2,
            "parallel_k": 2,
            "div_k": false,
            "div_d": false,
            "div_dp": false,
            "acc_dtype": "fp32",
            "dtype": "fp16",
            "sm": 89
        },
        "meta": {
            "shared": 10240,
            "num_warps": 4,
            "num_stages": 2,
            "global_scratch_size": 0
        }
    },
    "Config(BLOCK_N=32, BLOCK_K=16, BLOCK_Dp=16, num_warps=2, num_stages=2, parallel_k=2, div_k=False, div_d=False, div_dp=False, acc_dtype='fp16', dtype='fp16', sm=86).ptx": {
        "config": {
            "BLOCK_N": 32,
            "BLOCK_K": 16,
            "BLOCK_Dp": 16,
            "num_warps": 2,
            "num_stages": 2,
            "parallel_k": 2,
            "div_k": false,
            "div_d": false,
            "div_dp": false,
            "acc_dtype": "fp16",
            "dtype": "fp16",
            "sm": 86
        },
        "meta": {
            "shared": 1536,
            "num_warps": 2,
            "num_stages": 2,
            "global_scratch_size": 0
        }
    },
    "Config(BLOCK_N=16, BLOCK_K=32, BLOCK_Dp=32, num_warps=2, num_stages=2, parallel_k=2, div_k=False, div_d=False, div_dp=False, acc_dtype='fp32', dtype='fp32', sm=89).ptx": {
        "config": {
            "BLOCK_N": 16,
            "BLOCK_K": 32,
            "BLOCK_Dp": 32,
            "num_warps": 2,
            "num_stages": 2,
            "parallel_k": 2,
            "div_k": false,
            "div_d": false,
            "div_dp": false,
            "acc_dtype": "fp32",
            "dtype": "fp32",
            "sm": 89
        },
        "meta": {
            "shared": 6144,
            "num_warps": 2,
            "num_stages": 2,
            "global_scratch_size": 0
        }
    },
    "Config(BLOCK_N=16, BLOCK_K=16, BLOCK_Dp=16, num_warps=2, num_stages=2, parallel_k=2, div_k=False, div_d=False, div_dp=False, acc_dtype='fp16', dtype='fp16', sm=86).ptx": {
        "config": {
            "BLOCK_N": 16,
            "BLOCK_K": 16,
            "BLOCK_Dp": 16,
            "num_warps": 2,
            "num_stages": 2,
            "parallel_k": 2,
            "div_k": false,
            "div_d": false,
            "div_dp": false,
            "acc_dtype": "fp16",
            "dtype": "fp16",
            "sm": 86
        },
        "meta": {
            "shared": 1024,
            "num_warps": 2,
            "num_stages": 2,
            "global_scratch_size": 0
        }
    },
    "Config(BLOCK_N=32, BLOCK_K=16, BLOCK_Dp=16, num_warps=2, num_stages=2, parallel_k=2, div_k=False, div_d=False, div_dp=False, acc_dtype='fp16', dtype='fp16', sm=89).ptx": {
        "config": {
            "BLOCK_N": 32,
            "BLOCK_K": 16,
            "BLOCK_Dp": 16,
            "num_warps": 2,
            "num_stages": 2,
            "parallel_k": 2,
            "div_k": false,
            "div_d": false,
            "div_dp": false,
            "acc_dtype": "fp16",
            "dtype": "fp16",
            "sm": 89
        },
        "meta": {
            "shared": 1536,
            "num_warps": 2,
            "num_stages": 2,
            "global_scratch_size": 0
        }
    },
    "Config(BLOCK_N=16, BLOCK_K=32, BLOCK_Dp=32, num_warps=2, num_stages=2, parallel_k=2, div_k=False, div_d=False, div_dp=False, acc_dtype='fp32', dtype='fp16', sm=86).ptx": {
        "config": {
            "BLOCK_N": 16,
            "BLOCK_K": 32,
            "BLOCK_Dp": 32,
            "num_warps": 2,
            "num_stages": 2,
            "parallel_k": 2,
            "div_k": false,
            "div_d": false,
            "div_dp": false,
            "acc_dtype": "fp32",
            "dtype": "fp16",
            "sm": 86
        },
        "meta": {
            "shared": 3072,
            "num_warps": 2,
            "num_stages": 2,
            "global_scratch_size": 0
        }
    },
    "Config(BLOCK_N=128, BLOCK_K=32, BLOCK_Dp=32, num_warps=4, num_stages=2, parallel_k=2, div_k=False, div_d=False, div_dp=False, acc_dtype='fp32', dtype='fp32', sm=86).ptx": {
        "config": {
            "BLOCK_N": 128,
            "BLOCK_K": 32,
            "BLOCK_Dp": 32,
            "num_warps": 4,
            "num_stages": 2,
            "parallel_k": 2,
            "div_k": false,
            "div_d": false,
            "div_dp": false,
            "acc_dtype": "fp32",
            "dtype": "fp32",
            "sm": 86
        },
        "meta": {
            "shared": 20480,
            "num_warps": 4,
            "num_stages": 2,
            "global_scratch_size": 0
        }
    },
    "Config(BLOCK_N=16, BLOCK_K=16, BLOCK_Dp=16, num_warps=2, num_stages=2, parallel_k=2, div_k=False, div_d=False, div_dp=False, acc_dtype='fp16', dtype='fp16', sm=89).ptx": {
        "config": {
            "BLOCK_N": 16,
            "BLOCK_K": 16,
            "BLOCK_Dp": 16,
            "num_warps": 2,
            "num_stages": 2,
            "parallel_k": 2,
            "div_k": false,
            "div_d": false,
            "div_dp": false,
            "acc_dtype": "fp16",
            "dtype": "fp16",
            "sm": 89
        },
        "meta": {
            "shared": 1024,
            "num_warps": 2,
            "num_stages": 2,
            "global_scratch_size": 0
        }
    },
    "Config(BLOCK_N=16, BLOCK_K=32, BLOCK_Dp=32, num_warps=2, num_stages=2, parallel_k=2, div_k=False, div_d=False, div_dp=False, acc_dtype='fp32', dtype='fp16', sm=89).ptx": {
        "config": {
            "BLOCK_N": 16,
            "BLOCK_K": 32,
            "BLOCK_Dp": 32,
            "num_warps": 2,
            "num_stages": 2,
            "parallel_k": 2,
            "div_k": false,
            "div_d": false,
            "div_dp": false,
            "acc_dtype": "fp32",
            "dtype": "fp16",
            "sm": 89
        },
        "meta": {
            "shared": 3072,
            "num_warps": 2,
            "num_stages": 2,
            "global_scratch_size": 0
        }
    },
    "Config(BLOCK_N=128, BLOCK_K=32, BLOCK_Dp=32, num_warps=4, num_stages=2, parallel_k=2, div_k=False, div_d=False, div_dp=False, acc_dtype='fp32', dtype='fp32', sm=89).ptx": {
        "config": {
            "BLOCK_N": 128,
            "BLOCK_K": 32,
            "BLOCK_Dp": 32,
            "num_warps": 4,
            "num_stages": 2,
            "parallel_k": 2,
            "div_k": false,
            "div_d": false,
            "div_dp": false,
            "acc_dtype": "fp32",
            "dtype": "fp32",
            "sm": 89
        },
        "meta": {
            "shared": 20480,
            "num_warps": 4,
            "num_stages": 2,
            "global_scratch_size": 0
        }
    },
    "Config(BLOCK_N=16, BLOCK_K=32, BLOCK_Dp=64, num_warps=4, num_stages=2, parallel_k=2, div_k=False, div_d=False, div_dp=False, acc_dtype='fp32', dtype='fp32', sm=86).ptx": {
        "config": {
            "BLOCK_N": 16,
            "BLOCK_K": 32,
            "BLOCK_Dp": 64,
            "num_warps": 4,
            "num_stages": 2,
            "parallel_k": 2,
            "div_k": false,
            "div_d": false,
            "div_dp": false,
            "acc_dtype": "fp32",
            "dtype": "fp32",
            "sm": 86
        },
        "meta": {
            "shared": 10240,
            "num_warps": 4,
            "num_stages": 2,
            "global_scratch_size": 0
        }
    },
    "Config(BLOCK_N=128, BLOCK_K=32, BLOCK_Dp=32, num_warps=4, num_stages=2, parallel_k=2, div_k=False, div_d=False, div_dp=False, acc_dtype='fp16', dtype='fp16', sm=86).ptx": {
        "config": {
            "BLOCK_N": 128,
            "BLOCK_K": 32,
            "BLOCK_Dp": 32,
            "num_warps": 4,
            "num_stages": 2,
            "parallel_k": 2,
            "div_k": false,
            "div_d": false,
            "div_dp": false,
            "acc_dtype": "fp16",
            "dtype": "fp16",
            "sm": 86
        },
        "meta": {
            "shared": 10240,
            "num_warps": 4,
            "num_stages": 2,
            "global_scratch_size": 0
        }
    },
    "Config(BLOCK_N=16, BLOCK_K=32, BLOCK_Dp=64, num_warps=4, num_stages=2, parallel_k=2, div_k=False, div_d=False, div_dp=False, acc_dtype='fp32', dtype='fp32', sm=89).ptx": {
        "config": {
            "BLOCK_N": 16,
            "BLOCK_K": 32,
            "BLOCK_Dp": 64,
            "num_warps": 4,
            "num_stages": 2,
            "parallel_k": 2,
            "div_k": false,
            "div_d": false,
            "div_dp": false,
            "acc_dtype": "fp32",
            "dtype": "fp32",
            "sm": 89
        },
        "meta": {
            "shared": 10240,
            "num_warps": 4,
            "num_stages": 2,
            "global_scratch_size": 0
        }
    },
    "Config(BLOCK_N=32, BLOCK_K=32, BLOCK_Dp=16, num_warps=2, num_stages=2, parallel_k=2, div_k=False, div_d=False, div_dp=False, acc_dtype='fp32', dtype='fp16', sm=86).ptx": {
        "config": {
            "BLOCK_N": 32,
            "BLOCK_K": 32,
            "BLOCK_Dp": 16,
            "num_warps": 2,
            "num_stages": 2,
            "parallel_k": 2,
            "div_k": false,
            "div_d": false,
            "div_dp": false,
            "acc_dtype": "fp32",
            "dtype": "fp16",
            "sm": 86
        },
        "meta": {
            "shared": 3072,
            "num_warps": 2,
            "num_stages": 2,
            "global_scratch_size": 0
        }
    },
    "Config(BLOCK_N=128, BLOCK_K=32, BLOCK_Dp=32, num_warps=4, num_stages=2, parallel_k=2, div_k=False, div_d=False, div_dp=False, acc_dtype='fp16', dtype='fp16', sm=89).ptx": {
        "config": {
            "BLOCK_N": 128,
            "BLOCK_K": 32,
            "BLOCK_Dp": 32,
            "num_warps": 4,
            "num_stages": 2,
            "parallel_k": 2,
            "div_k": false,
            "div_d": false,
            "div_dp": false,
            "acc_dtype": "fp16",
            "dtype": "fp16",
            "sm": 89
        },
        "meta": {
            "shared": 10240,
            "num_warps": 4,
            "num_stages": 2,
            "global_scratch_size": 0
        }
    },
    "Config(BLOCK_N=16, BLOCK_K=16, BLOCK_Dp=16, num_warps=2, num_stages=2, parallel_k=2, div_k=False, div_d=False, div_dp=False, acc_dtype='fp32', dtype='fp32', sm=86).ptx": {
        "config": {
            "BLOCK_N": 16,
            "BLOCK_K": 16,
            "BLOCK_Dp": 16,
            "num_warps": 2,
            "num_stages": 2,
            "parallel_k": 2,
            "div_k": false,
            "div_d": false,
            "div_dp": false,
            "acc_dtype": "fp32",
            "dtype": "fp32",
            "sm": 86
        },
        "meta": {
            "shared": 2048,
            "num_warps": 2,
            "num_stages": 2,
            "global_scratch_size": 0
        }
    },
    "Config(BLOCK_N=16, BLOCK_K=32, BLOCK_Dp=64, num_warps=4, num_stages=2, parallel_k=2, div_k=False, div_d=False, div_dp=False, acc_dtype='fp32', dtype='fp16', sm=86).ptx": {
        "config": {
            "BLOCK_N": 16,
            "BLOCK_K": 32,
            "BLOCK_Dp": 64,
            "num_warps": 4,
            "num_stages": 2,
            "parallel_k": 2,
            "div_k": false,
            "div_d": false,
            "div_dp": false,
            "acc_dtype": "fp32",
            "dtype": "fp16",
            "sm": 86
        },
        "meta": {
            "shared": 5120,
            "num_warps": 4,
            "num_stages": 2,
            "global_scratch_size": 0
        }
    },
    "Config(BLOCK_N=32, BLOCK_K=16, BLOCK_Dp=32, num_warps=2, num_stages=2, parallel_k=2, div_k=False, div_d=False, div_dp=False, acc_dtype='fp32', dtype='fp16', sm=89).ptx": {
        "config": {
            "BLOCK_N": 32,
            "BLOCK_K": 16,
            "BLOCK_Dp": 32,
            "num_warps": 2,
            "num_stages": 2,
            "parallel_k": 2,
            "div_k": false,
            "div_d": false,
            "div_dp": false,
            "acc_dtype": "fp32",
            "dtype": "fp16",
            "sm": 89
        },
        "meta": {
            "shared": 2048,
            "num_warps": 2,
            "num_stages": 2,
            "global_scratch_size": 0
        }
    },
    "Config(BLOCK_N=16, BLOCK_K=16, BLOCK_Dp=16, num_warps=2, num_stages=2, parallel_k=2, div_k=False, div_d=False, div_dp=False, acc_dtype='fp32', dtype='fp32', sm=89).ptx": {
        "config": {
            "BLOCK_N": 16,
            "BLOCK_K": 16,
            "BLOCK_Dp": 16,
            "num_warps": 2,
            "num_stages": 2,
            "parallel_k": 2,
            "div_k": false,
            "div_d": false,
            "div_dp": false,
            "acc_dtype": "fp32",
            "dtype": "fp32",
            "sm": 89
        },
        "meta": {
            "shared": 2048,
            "num_warps": 2,
            "num_stages": 2,
            "global_scratch_size": 0
        }
    },
    "Config(BLOCK_N=32, BLOCK_K=16, BLOCK_Dp=32, num_warps=2, num_stages=2, parallel_k=2, div_k=False, div_d=False, div_dp=False, acc_dtype='fp32', dtype='fp16', sm=86).ptx": {
        "config": {
            "BLOCK_N": 32,
            "BLOCK_K": 16,
            "BLOCK_Dp": 32,
            "num_warps": 2,
            "num_stages": 2,
            "parallel_k": 2,
            "div_k": false,
            "div_d": false,
            "div_dp": false,
            "acc_dtype": "fp32",
            "dtype": "fp16",
            "sm": 86
        },
        "meta": {
            "shared": 2048,
            "num_warps": 2,
            "num_stages": 2,
            "global_scratch_size": 0
        }
    },
    "Config(BLOCK_N=16, BLOCK_K=16, BLOCK_Dp=16, num_warps=2, num_stages=2, parallel_k=2, div_k=False, div_d=False, div_dp=False, acc_dtype='fp32', dtype='fp16', sm=89).ptx": {
        "config": {
            "BLOCK_N": 16,
            "BLOCK_K": 16,
            "BLOCK_Dp": 16,
            "num_warps": 2,
            "num_stages": 2,
            "parallel_k": 2,
            "div_k": false,
            "div_d": false,
            "div_dp": false,
            "acc_dtype": "fp32",
            "dtype": "fp16",
            "sm": 89
        },
        "meta": {
            "shared": 1024,
            "num_warps": 2,
            "num_stages": 2,
            "global_scratch_size": 0
        }
    },
    "Config(BLOCK_N=16, BLOCK_K=16, BLOCK_Dp=16, num_warps=2, num_stages=2, parallel_k=2, div_k=False, div_d=False, div_dp=False, acc_dtype='fp32', dtype='fp16', sm=86).ptx": {
        "config": {
            "BLOCK_N": 16,
            "BLOCK_K": 16,
            "BLOCK_Dp": 16,
            "num_warps": 2,
            "num_stages": 2,
            "parallel_k": 2,
            "div_k": false,
            "div_d": false,
            "div_dp": false,
            "acc_dtype": "fp32",
            "dtype": "fp16",
            "sm": 86
        },
        "meta": {
            "shared": 1024,
            "num_warps": 2,
            "num_stages": 2,
            "global_scratch_size": 0
        }
    },
    "Config(BLOCK_N=32, BLOCK_K=32, BLOCK_Dp=16, num_warps=2, num_stages=2, parallel_k=2, div_k=False, div_d=False, div_dp=False, acc_dtype='fp32', dtype='fp32', sm=86).ptx": {
        "config": {
            "BLOCK_N": 32,
            "BLOCK_K": 32,
            "BLOCK_Dp": 16,
            "num_warps": 2,
            "num_stages": 2,
            "parallel_k": 2,
            "div_k": false,
            "div_d": false,
            "div_dp": false,
            "acc_dtype": "fp32",
            "dtype": "fp32",
            "sm": 86
        },
        "meta": {
            "shared": 6144,
            "num_warps": 2,
            "num_stages": 2,
            "global_scratch_size": 0
        }
    },
    "Config(BLOCK_N=32, BLOCK_K=16, BLOCK_Dp=32, num_warps=2, num_stages=2, parallel_k=2, div_k=False, div_d=False, div_dp=False, acc_dtype='fp32', dtype='fp32', sm=86).ptx": {
        "config": {
            "BLOCK_N": 32,
            "BLOCK_K": 16,
            "BLOCK_Dp": 32,
            "num_warps": 2,
            "num_stages": 2,
            "parallel_k": 2,
            "div_k": false,
            "div_d": false,
            "div_dp": false,
            "acc_dtype": "fp32",
            "dtype": "fp32",
            "sm": 86
        },
        "meta": {
            "shared": 4096,
            "num_warps": 2,
            "num_stages": 2,
            "global_scratch_size": 0
        }
    },
    "Config(BLOCK_N=16, BLOCK_K=32, BLOCK_Dp=128, num_warps=4, num_stages=2, parallel_k=2, div_k=False, div_d=False, div_dp=False, acc_dtype='fp16', dtype='fp16', sm=89).ptx": {
        "config": {
            "BLOCK_N": 16,
            "BLOCK_K": 32,
            "BLOCK_Dp": 128,
            "num_warps": 4,
            "num_stages": 2,
            "parallel_k": 2,
            "div_k": false,
            "div_d": false,
            "div_dp": false,
            "acc_dtype": "fp16",
            "dtype": "fp16",
            "sm": 89
        },
        "meta": {
            "shared": 9216,
            "num_warps": 4,
            "num_stages": 2,
            "global_scratch_size": 0
        }
    },
    "Config(BLOCK_N=32, BLOCK_K=16, BLOCK_Dp=32, num_warps=2, num_stages=2, parallel_k=2, div_k=False, div_d=False, div_dp=False, acc_dtype='fp32', dtype='fp32', sm=89).ptx": {
        "config": {
            "BLOCK_N": 32,
            "BLOCK_K": 16,
            "BLOCK_Dp": 32,
            "num_warps": 2,
            "num_stages": 2,
            "parallel_k": 2,
            "div_k": false,
            "div_d": false,
            "div_dp": false,
            "acc_dtype": "fp32",
            "dtype": "fp32",
            "sm": 89
        },
        "meta": {
            "shared": 4096,
            "num_warps": 2,
            "num_stages": 2,
            "global_scratch_size": 0
        }
    },
    "Config(BLOCK_N=16, BLOCK_K=64, BLOCK_Dp=64, num_warps=4, num_stages=2, parallel_k=2, div_k=False, div_d=False, div_dp=False, acc_dtype='fp32', dtype='fp16', sm=89).ptx": {
        "config": {
            "BLOCK_N": 16,
            "BLOCK_K": 64,
            "BLOCK_Dp": 64,
            "num_warps": 4,
            "num_stages": 2,
            "parallel_k": 2,
            "div_k": false,
            "div_d": false,
            "div_dp": false,
            "acc_dtype": "fp32",
            "dtype": "fp16",
            "sm": 89
        },
        "meta": {
            "shared": 10240,
            "num_warps": 4,
            "num_stages": 2,
            "global_scratch_size": 0
        }
    },
    "Config(BLOCK_N=16, BLOCK_K=32, BLOCK_Dp=64, num_warps=4, num_stages=2, parallel_k=2, div_k=False, div_d=False, div_dp=False, acc_dtype='fp16', dtype='fp16', sm=89).ptx": {
        "config": {
            "BLOCK_N": 16,
            "BLOCK_K": 32,
            "BLOCK_Dp": 64,
            "num_warps": 4,
            "num_stages": 2,
            "parallel_k": 2,
            "div_k": false,
            "div_d": false,
            "div_dp": false,
            "acc_dtype": "fp16",
            "dtype": "fp16",
            "sm": 89
        },
        "meta": {
            "shared": 5120,
            "num_warps": 4,
            "num_stages": 2,
            "global_scratch_size": 0
        }
    },
    "Config(BLOCK_N=16, BLOCK_K=64, BLOCK_Dp=64, num_warps=4, num_stages=2, parallel_k=2, div_k=False, div_d=False, div_dp=False, acc_dtype='fp32', dtype='fp16', sm=86).ptx": {
        "config": {
            "BLOCK_N": 16,
            "BLOCK_K": 64,
            "BLOCK_Dp": 64,
            "num_warps": 4,
            "num_stages": 2,
            "parallel_k": 2,
            "div_k": false,
            "div_d": false,
            "div_dp": false,
            "acc_dtype": "fp32",
            "dtype": "fp16",
            "sm": 86
        },
        "meta": {
            "shared": 10240,
            "num_warps": 4,
            "num_stages": 2,
            "global_scratch_size": 0
        }
    },
    "Config(BLOCK_N=16, BLOCK_K=32, BLOCK_Dp=64, num_warps=2, num_stages=2, parallel_k=2, div_k=False, div_d=False, div_dp=False, acc_dtype='fp32', dtype='fp16', sm=89).ptx": {
        "config": {
            "BLOCK_N": 16,
            "BLOCK_K": 32,
            "BLOCK_Dp": 64,
            "num_warps": 2,
            "num_stages": 2,
            "parallel_k": 2,
            "div_k": false,
            "div_d": false,
            "div_dp": false,
            "acc_dtype": "fp32",
            "dtype": "fp16",
            "sm": 89
        },
        "meta": {
            "shared": 5120,
            "num_warps": 2,
            "num_stages": 2,
            "global_scratch_size": 0
        }
    },
    "Config(BLOCK_N=16, BLOCK_K=32, BLOCK_Dp=64, num_warps=2, num_stages=2, parallel_k=2, div_k=False, div_d=False, div_dp=False, acc_dtype='fp32', dtype='fp16', sm=86).ptx": {
        "config": {
            "BLOCK_N": 16,
            "BLOCK_K": 32,
            "BLOCK_Dp": 64,
            "num_warps": 2,
            "num_stages": 2,
            "parallel_k": 2,
            "div_k": false,
            "div_d": false,
            "div_dp": false,
            "acc_dtype": "fp32",
            "dtype": "fp16",
            "sm": 86
        },
        "meta": {
            "shared": 5120,
            "num_warps": 2,
            "num_stages": 2,
            "global_scratch_size": 0
        }
    },
    "Config(BLOCK_N=16, BLOCK_K=64, BLOCK_Dp=64, num_warps=4, num_stages=2, parallel_k=2, div_k=False, div_d=False, div_dp=False, acc_dtype='fp32', dtype='fp32', sm=89).ptx": {
        "config": {
            "BLOCK_N": 16,
            "BLOCK_K": 64,
            "BLOCK_Dp": 64,
            "num_warps": 4,
            "num_stages": 2,
            "parallel_k": 2,
            "div_k": false,
            "div_d": false,
            "div_dp": false,
            "acc_dtype": "fp32",
            "dtype": "fp32",
            "sm": 89
        },
        "meta": {
            "shared": 20480,
            "num_warps": 4,
            "num_stages": 2,
            "global_scratch_size": 0
        }
    },
    "Config(BLOCK_N=16, BLOCK_K=32, BLOCK_Dp=128, num_warps=4, num_stages=2, parallel_k=2, div_k=False, div_d=False, div_dp=False, acc_dtype='fp32', dtype='fp16', sm=89).ptx": {
        "config": {
            "BLOCK_N": 16,
            "BLOCK_K": 32,
            "BLOCK_Dp": 128,
            "num_warps": 4,
            "num_stages": 2,
            "parallel_k": 2,
            "div_k": false,
            "div_d": false,
            "div_dp": false,
            "acc_dtype": "fp32",
            "dtype": "fp16",
            "sm": 89
        },
        "meta": {
            "shared": 9216,
            "num_warps": 4,
            "num_stages": 2,
            "global_scratch_size": 0
        }
    },
    "Config(BLOCK_N=16, BLOCK_K=32, BLOCK_Dp=64, num_warps=2, num_stages=2, parallel_k=2, div_k=False, div_d=False, div_dp=False, acc_dtype='fp32', dtype='fp32', sm=89).ptx": {
        "config": {
            "BLOCK_N": 16,
            "BLOCK_K": 32,
            "BLOCK_Dp": 64,
            "num_warps": 2,
            "num_stages": 2,
            "parallel_k": 2,
            "div_k": false,
            "div_d": false,
            "div_dp": false,
            "acc_dtype": "fp32",
            "dtype": "fp32",
            "sm": 89
        },
        "meta": {
            "shared": 10240,
            "num_warps": 2,
            "num_stages": 2,
            "global_scratch_size": 0
        }
    },
    "Config(BLOCK_N=32, BLOCK_K=16, BLOCK_Dp=32, num_warps=2, num_stages=2, parallel_k=2, div_k=False, div_d=False, div_dp=False, acc_dtype='fp16', dtype='fp16', sm=86).ptx": {
        "config": {
            "BLOCK_N": 32,
            "BLOCK_K": 16,
            "BLOCK_Dp": 32,
            "num_warps": 2,
            "num_stages": 2,
            "parallel_k": 2,
            "div_k": false,
            "div_d": false,
            "div_dp": false,
            "acc_dtype": "fp16",
            "dtype": "fp16",
            "sm": 86
        },
        "meta": {
            "shared": 2048,
            "num_warps": 2,
            "num_stages": 2,
            "global_scratch_size": 0
        }
    },
    "Config(BLOCK_N=16, BLOCK_K=32, BLOCK_Dp=128, num_warps=4, num_stages=2, parallel_k=2, div_k=False, div_d=False, div_dp=False, acc_dtype='fp32', dtype='fp16', sm=86).ptx": {
        "config": {
            "BLOCK_N": 16,
            "BLOCK_K": 32,
            "BLOCK_Dp": 128,
            "num_warps": 4,
            "num_stages": 2,
            "parallel_k": 2,
            "div_k": false,
            "div_d": false,
            "div_dp": false,
            "acc_dtype": "fp32",
            "dtype": "fp16",
            "sm": 86
        },
        "meta": {
            "shared": 9216,
            "num_warps": 4,
            "num_stages": 2,
            "global_scratch_size": 0
        }
    },
    "Config(BLOCK_N=32, BLOCK_K=16, BLOCK_Dp=32, num_warps=2, num_stages=2, parallel_k=2, div_k=False, div_d=False, div_dp=False, acc_dtype='fp16', dtype='fp16', sm=89).ptx": {
        "config": {
            "BLOCK_N": 32,
            "BLOCK_K": 16,
            "BLOCK_Dp": 32,
            "num_warps": 2,
            "num_stages": 2,
            "parallel_k": 2,
            "div_k": false,
            "div_d": false,
            "div_dp": false,
            "acc_dtype": "fp16",
            "dtype": "fp16",
            "sm": 89
        },
        "meta": {
            "shared": 2048,
            "num_warps": 2,
            "num_stages": 2,
            "global_scratch_size": 0
        }
    },
    "Config(BLOCK_N=16, BLOCK_K=64, BLOCK_Dp=64, num_warps=4, num_stages=2, parallel_k=2, div_k=False, div_d=False, div_dp=False, acc_dtype='fp16', dtype='fp16', sm=86).ptx": {
        "config": {
            "BLOCK_N": 16,
            "BLOCK_K": 64,
            "BLOCK_Dp": 64,
            "num_warps": 4,
            "num_stages": 2,
            "parallel_k": 2,
            "div_k": false,
            "div_d": false,
            "div_dp": false,
            "acc_dtype": "fp16",
            "dtype": "fp16",
            "sm": 86
        },
        "meta": {
            "shared": 10240,
            "num_warps": 4,
            "num_stages": 2,
            "global_scratch_size": 0
        }
    },
    "Config(BLOCK_N=16, BLOCK_K=64, BLOCK_Dp=64, num_warps=4, num_stages=2, parallel_k=2, div_k=False, div_d=False, div_dp=False, acc_dtype='fp16', dtype='fp16', sm=89).ptx": {
        "config": {
            "BLOCK_N": 16,
            "BLOCK_K": 64,
            "BLOCK_Dp": 64,
            "num_warps": 4,
            "num_stages": 2,
            "parallel_k": 2,
            "div_k": false,
            "div_d": false,
            "div_dp": false,
            "acc_dtype": "fp16",
            "dtype": "fp16",
            "sm": 89
        },
        "meta": {
            "shared": 10240,
            "num_warps": 4,
            "num_stages": 2,
            "global_scratch_size": 0
        }
    }
}